snapshot_time,rank,artist_name,song_title,likes_count,play_count,comments_count,song_url,artist_url,cover_image_url,artist_handle,artist_identity,artist_city,artist_joined_date,artist_accredited_datetime,artist_music_count,artist_fans_count,artist_following_count,artist_facebook_url,artist_instagram_url,artist_youtube_url,genre,album_title,album_url,collaborators,description,lyrics,release_date,song_accredited_datetime,is_editor_recommended,is_song_of_the_day,critic_review_url
2026-05-09 21:47:14,1,,,51,4334,23,https://streetvoice.com/shigurehime2018/songs/856401/,https://streetvoice.com/shigurehime2018/,"https://akstatic.streetvoice.com/song_covers/sh/ig/shigurehime2018/U9mqbU3U2YJxUPsQzyPJAk.jpeg?x-oss-process=image/resize,m_fixed,h_1,w_1,limit_0/resize,m_fixed,h_630,w_1200,limit_0/watermark,image_c29uZ19jb3ZlcnMvc2gvaWcvc2hpZ3VyZWhpbWUyMDE4L1U5bXFiVTNVMllKeFVQc1F6eVBKQWsuanBlZz94LW9zcy1wcm9jZXNzPWltYWdlL3Jlc2l6ZSxtX2ZpeGVkLGhfMzQ0LHdfMzQ0LGxpbWl0XzA,g_nw,x_428,y_143/watermark,image_YXNzZXQvaW1hZ2VzL21ldGFpbWFnZS1zb25nLnBuZw,g_nw,x_0,y_0",@shigurehime2018,音樂人,,,,,19,1,,,https://www.youtube.com/user/StreetVoiceTV,ACG,,,,"𝙉𝙚𝙬 𝙎𝙞𝙣𝙜𝙡𝙚 𝙍𝙚𝙡𝙚𝙖𝙨𝙚𝙨 『誰よりも、』 當喜歡成為唯一，愛也開始越過界線。 「比任何人都更加深愛你。」 「比任何人都更加需要你。」 「也因此，比任何人都無法容許失去你。」 愛意在靠近與拉扯之間反覆滋長， 溫柔與不安交錯，思念與執著並存。 越是珍惜，越害怕失去；越想擁有，越難以放手。 當世界只剩下一個人， 那份心意，究竟是愛，還是 —— 束縛。 【 Production Credits 】 詞 Lyrics ｜ 高孟淵 TT Kao / 蒟蒻 𝗋𝖾𝗄𝗂 曲 Composer ｜ 高孟淵 TT Kao / 時雨姬しぐれひめ 編曲 Arranger ｜ 高孟淵 TT Kao / 時雨姬しぐれひめ 製作人 Producer ｜ 高孟淵 TT Kao 混音 Mixing ｜ 林群力 Charlie-One Lin 吉他 Guitar ｜ 林昕樺(ㄒㄏ) / 高孟淵 TT Kao 貝斯 Bass ｜ Yui 鼓 Drum ｜ 蝸牛 封面 Illustration ｜ 蒟蒻 𝗋𝖾𝗄𝗂 / 蝸牛 
𝙉𝙚𝙬 𝙎𝙞𝙣𝙜𝙡𝙚 𝙍𝙚𝙡𝙚𝙖𝙨𝙚𝙨
『誰よりも、』
當喜歡成為唯一，愛也開始越過界線。
「比任何人都更加深愛你。」 「比任何人都更加需要你。」 「也因此，比任何人都無法容許失去你。」
愛意在靠近與拉扯之間反覆滋長， 溫柔與不安交錯，思念與執著並存。 越是珍惜，越害怕失去；越想擁有，越難以放手。
當世界只剩下一個人， 那份心意，究竟是愛，還是 —— 束縛。
【 Production Credits 】 詞 Lyrics ｜ 高孟淵 TT Kao / 蒟蒻 𝗋𝖾𝗄𝗂 曲 Composer ｜ 高孟淵 TT Kao / 時雨姬しぐれひめ 編曲 Arranger ｜ 高孟淵 TT Kao / 時雨姬しぐれひめ 製作人 Producer ｜ 高孟淵 TT Kao 混音 Mixing ｜ 林群力 Charlie-One Lin 吉他 Guitar ｜ 林昕樺(ㄒㄏ) / 高孟淵 TT Kao 貝斯 Bass ｜ Yui 鼓 Drum ｜ 蝸牛 封面 Illustration ｜ 蒟蒻 𝗋𝖾𝗄𝗂 / 蝸牛","誰も知らない秘密の場所で 君の影を追ってる ガラス越しの笑顔は 私だけのものよ 呼吸さえ忘れてしまうほど 夢中になってもいいでしょう？ 近づく足音 僅かな視線が 私を狂わせてく 境界線が揺れる 愛してる 誰よりも深く 君だけが全てなの この手で閉じ込めてしまいたい 永遠に離さない 他の誰かと話す声 許せない、許したくない 私の瞳には 君しか映らないから 重なる吐息 触れる指先が 私を囚われてく 理性が壊れてく 愛してる 誰よりも深く 君だけが全てなの この手で閉じ込めてしまいたい 永遠に離さない 壊れるくらいに愛しても 足りない、まだ足りない 君の心を 全部私にちょうだい 愛してる 誰よりも深く 君だけが全てなの この手で閉じ込めてしまいたい 永遠に離さない 在沒有人知道的秘密之地，我追尋著你的身影 透過玻璃的微笑，只屬於我 就算忘記呼吸，也可以沉迷其中吧？ 靠近的腳步聲，微弱的視線 讓我陷入瘋狂，界線在顫動 我愛你，比任何人都深刻，你是我的一切 想用這雙手將你鎖住，永遠不放手 聽到你和別人說話的聲音，我無法原諒，也不想原諒 在我的眼中，只有你 重疊的呼吸，觸碰的指尖 讓我被束縛，理智逐漸崩壞 我愛你，比任何人都深刻，你是我的一切 想用這雙手將你鎖住，永遠不放手 即使愛到破碎也不夠，還不夠，還不夠 把你的心全部交給我 我愛你，比任何人都深刻，你是我的一切 想用這雙手將你鎖住，永遠不放手 
誰も知らない秘密の場所で 君の影を追ってる ガラス越しの笑顔は 私だけのものよ 呼吸さえ忘れてしまうほど 夢中になってもいいでしょう？
近づく足音 僅かな視線が 私を狂わせてく 境界線が揺れる
愛してる 誰よりも深く 君だけが全てなの この手で閉じ込めてしまいたい 永遠に離さない
他の誰かと話す声 許せない、許したくない 私の瞳には 君しか映らないから
重なる吐息 触れる指先が 私を囚われてく 理性が壊れてく
愛してる 誰よりも深く 君だけが全てなの この手で閉じ込めてしまいたい 永遠に離さない
壊れるくらいに愛しても 足りない、まだ足りない 君の心を 全部私にちょうだい
愛してる 誰よりも深く 君だけが全てなの この手で閉じ込めてしまいたい 永遠に離さない
在沒有人知道的秘密之地，我追尋著你的身影 透過玻璃的微笑，只屬於我 就算忘記呼吸，也可以沉迷其中吧？
靠近的腳步聲，微弱的視線 讓我陷入瘋狂，界線在顫動
我愛你，比任何人都深刻，你是我的一切 想用這雙手將你鎖住，永遠不放手
聽到你和別人說話的聲音，我無法原諒，也不想原諒 在我的眼中，只有你
重疊的呼吸，觸碰的指尖 讓我被束縛，理智逐漸崩壞
我愛你，比任何人都深刻，你是我的一切 想用這雙手將你鎖住，永遠不放手
即使愛到破碎也不夠，還不夠，還不夠 把你的心全部交給我
我愛你，比任何人都深刻，你是我的一切 想用這雙手將你鎖住，永遠不放手
留言（ 23 ） 最相關留言 所有留言
留言（ 23 ）",2026-05-02,,True,True,
2026-05-09 21:47:14,2,,,16,1849,5,https://streetvoice.com/bubbletea20260321/songs/857503/,https://streetvoice.com/bubbletea20260321/,"https://akstatic.streetvoice.com/song_covers/bu/bb/bubbletea20260321/AmGAXic2cTjbCarjKe5x4A.jpeg?x-oss-process=image/resize,m_fixed,h_1,w_1,limit_0/resize,m_fixed,h_630,w_1200,limit_0/watermark,image_c29uZ19jb3ZlcnMvYnUvYmIvYnViYmxldGVhMjAyNjAzMjEvQW1HQVhpYzJjVGpiQ2FyaktlNXg0QS5qcGVnP3gtb3NzLXByb2Nlc3M9aW1hZ2UvcmVzaXplLG1fZml4ZWQsaF8zNDQsd18zNDQsbGltaXRfMA,g_nw,x_428,y_143/watermark,image_YXNzZXQvaW1hZ2VzL21ldGFpbWFnZS1zb25nLnBuZw,g_nw,x_0,y_0",@bubbletea20260321,音樂人,台灣,2026-03-01,,,,,,,https://www.youtube.com/user/StreetVoiceTV,Alternative,,,YOSHI、Yu Chiao、樂承宇 Yue Yu、幽冥券,"𝗟𝘆𝗿𝗶𝗰𝗶𝘀𝘁 & 𝗖𝗼𝗺𝗽𝗼𝘀𝗲𝗿｜𝗕𝘂𝗯𝗯𝗹𝗲 𝗧𝗲𝗮 𝗔𝗿𝗿𝗮𝗻𝗴𝗲𝗺𝗲𝗻𝘁｜𝗬𝗢𝗦𝗛𝗜 𝗚𝘂𝗶𝘁𝗮𝗿｜𝗬𝘂𝗲 𝗬𝘂 𝗞𝗲𝘆𝘀 / 𝗦𝘆𝗻𝘁𝗵｜𝗬𝗢𝗦𝗛𝗜 𝗗𝗿𝘂𝗺𝘀｜𝗬𝘂-𝗖𝗵𝗶𝗮𝗼 𝗧𝗮𝗻𝗴 𝗕𝗮𝘀𝘀 | 𝗕𝗶𝗿𝗱𝘆.𝗖 𝗠𝗜𝗫 | 𝘁𝘇𝘂𝗱𝗮𝗻 𝗦𝘂 
𝗟𝘆𝗿𝗶𝗰𝗶𝘀𝘁 & 𝗖𝗼𝗺𝗽𝗼𝘀𝗲𝗿｜𝗕𝘂𝗯𝗯𝗹𝗲 𝗧𝗲𝗮
𝗔𝗿𝗿𝗮𝗻𝗴𝗲𝗺𝗲𝗻𝘁｜𝗬𝗢𝗦𝗛𝗜 𝗚𝘂𝗶𝘁𝗮𝗿｜𝗬𝘂𝗲 𝗬𝘂 𝗞𝗲𝘆𝘀 / 𝗦𝘆𝗻𝘁𝗵｜𝗬𝗢𝗦𝗛𝗜 𝗗𝗿𝘂𝗺𝘀｜𝗬𝘂-𝗖𝗵𝗶𝗮𝗼 𝗧𝗮𝗻𝗴 𝗕𝗮𝘀𝘀 | 𝗕𝗶𝗿𝗱𝘆.𝗖 𝗠𝗜𝗫 | 𝘁𝘇𝘂𝗱𝗮𝗻 𝗦𝘂","𝕍𝟙 青春流乾 夢沉海岸 揣無避風港 黑暗起變化 點點魚花 漂流過大山 閃過網仔線 拚命向前走 ℂ𝟙 人生親像魚花 泅來 泅去 北漂的牽掛 揣無靠山 痛嘛唱歌 目屎藏海岸 有時會畏寒 親像魚花(親像魚花) 𝕍𝟚 螢幕的光 閃爍無聲 揣無避風港 一个人孤單 半暝我拚命 剩影來作伴 案頭疊規山 來唱歌 ℂ𝟚 人生親像魚花 泅來 泅去 北漂的牽掛 揣無靠山 痛嘛唱歌 目屎藏海岸 有時會畏寒 親像魚花(親像魚花) 𝔹𝕣𝕚𝕕𝕘𝕖 凡勢生命 毋是攏好行 鱗黏著沙 雙鰭拚命 ℂ𝟛 人生親像魚花 泅來 泅去 北漂的牽掛 揣無靠山 痛嘛唱歌 目屎藏海岸 有時會畏寒 親像魚花(親像魚花) 
𝕍𝟙 青春流乾 夢沉海岸 揣無避風港 黑暗起變化
點點魚花 漂流過大山 閃過網仔線 拚命向前走
ℂ𝟙 人生親像魚花 泅來 泅去 北漂的牽掛 揣無靠山 痛嘛唱歌 目屎藏海岸 有時會畏寒 親像魚花(親像魚花)
𝕍𝟚 螢幕的光 閃爍無聲 揣無避風港 一个人孤單
半暝我拚命 剩影來作伴 案頭疊規山 來唱歌
ℂ𝟚 人生親像魚花 泅來 泅去 北漂的牽掛 揣無靠山 痛嘛唱歌 目屎藏海岸 有時會畏寒 親像魚花(親像魚花)
𝔹𝕣𝕚𝕕𝕘𝕖 凡勢生命 毋是攏好行 鱗黏著沙 雙鰭拚命
ℂ𝟛 人生親像魚花 泅來 泅去 北漂的牽掛 揣無靠山 痛嘛唱歌 目屎藏海岸 有時會畏寒 親像魚花(親像魚花)
留言（ 5 ） 最相關留言 所有留言
留言（ 5 ）",2026-05-08,,True,False,
2026-05-09 21:47:14,3,,,68,2900,10,https://streetvoice.com/seizer_official/songs/854519/,https://streetvoice.com/seizer_official/,"https://akstatic.streetvoice.com/song_covers/se/iz/seizer_official/ffPUS3jfKfT63UaxG9Bjkr.jpeg?x-oss-process=image/resize,m_fixed,h_1,w_1,limit_0/resize,m_fixed,h_630,w_1200,limit_0/watermark,image_c29uZ19jb3ZlcnMvc2UvaXovc2VpemVyX29mZmljaWFsL2ZmUFVTM2pmS2ZUNjNVYXhHOUJqa3IuanBlZz94LW9zcy1wcm9jZXNzPWltYWdlL3Jlc2l6ZSxtX2ZpeGVkLGhfMzQ0LHdfMzQ0LGxpbWl0XzA,g_nw,x_428,y_143/watermark,image_YXNzZXQvaW1hZ2VzL21ldGFpbWFnZS1zb25nLnBuZw,g_nw,x_0,y_0",@seizer_official,音樂人,台中市,2024-08-01,2024-09-10 20:11,9,2082,,,https://www.instagram.com/seizer.com.tw/,https://www.youtube.com/user/StreetVoiceTV,Alternative,,,,"我們都聽過太多歌曲有著 熟悉的痛苦、熟悉的旋律、熟悉的感動。 明知道它們有時是刻意設計的內容 卻仍然撕心裂肺地唱著。 在流行與真實之間， 誠實有時只是另一種表演。 是不是發自內心的感受 若是你喜歡，是真是演又何妨？ 當掌聲落下、燈光熄滅， 只剩下一句自嘲的謝詞： 謝謝你們膚淺的包容。 ———————————————————— 紙鳶 Seizer 第二張專輯先行曲〈矯〉 詞 Lyrics｜仁杰 曲 Composer｜仁杰 編曲 Arrangement｜紙鳶 Seizer 主唱 Vocal｜仁杰 和聲 Backing Vocal｜黃夏蘿 SUKINO、仁杰、蘇崇祐 Kay 電吉他 Electric Guitar｜楊博皓 Seal 貝斯 Bass｜呂建亨 Henry 鼓組 Drum｜王秉宸 Daniel 鍵盤與合成器 ｜Keyboards & Synth Design｜楊博皓 Seal 製作人 Producer｜楊博皓 Seal 鼓組錄音室 Drum Recording Studio｜秉乾工作室 鼓組錄音師 Drum Recording Engineer｜張家誠 Chia Chen Chang 鼓技師 Drum Technician｜莊開旭 Cash Chuang 人聲錄音室 Vocal Recording Studio｜Recover studio 人聲配唱 Vocal Producer｜蘇崇祐 Kay 和聲編寫 Backing Vocal Arrangement｜黃夏蘿 SUKINO、仁杰、蘇崇祐 Kay 錄音師 Recording Engineer｜楊博皓 Seal 混音師 Mixing Engineer｜張家誠 Chia Chen Chang 母帶後期製作 Mastering Engineer｜張家誠 Chia Chen Chang 藝人經紀 Artist Manager｜育珊 Yü3 藝人助理 Artist Assistant｜育辰、書昀 單曲封面設計 Cover Art｜李縉加 Jonas Lee 
我們都聽過太多歌曲有著 熟悉的痛苦、熟悉的旋律、熟悉的感動。
明知道它們有時是刻意設計的內容 卻仍然撕心裂肺地唱著。
在流行與真實之間， 誠實有時只是另一種表演。
是不是發自內心的感受 若是你喜歡，是真是演又何妨？
當掌聲落下、燈光熄滅， 只剩下一句自嘲的謝詞：
謝謝你們膚淺的包容。 ———————————————————— 紙鳶 Seizer 第二張專輯先行曲〈矯〉 詞 Lyrics｜仁杰 曲 Composer｜仁杰 編曲 Arrangement｜紙鳶 Seizer
主唱 Vocal｜仁杰 和聲 Backing Vocal｜黃夏蘿 SUKINO、仁杰、蘇崇祐 Kay 電吉他 Electric Guitar｜楊博皓 Seal 貝斯 Bass｜呂建亨 Henry 鼓組 Drum｜王秉宸 Daniel 鍵盤與合成器 ｜Keyboards & Synth Design｜楊博皓 Seal
製作人 Producer｜楊博皓 Seal 鼓組錄音室 Drum Recording Studio｜秉乾工作室 鼓組錄音師 Drum Recording Engineer｜張家誠 Chia Chen Chang 鼓技師 Drum Technician｜莊開旭 Cash Chuang 人聲錄音室 Vocal Recording Studio｜Recover studio 人聲配唱 Vocal Producer｜蘇崇祐 Kay 和聲編寫 Backing Vocal Arrangement｜黃夏蘿 SUKINO、仁杰、蘇崇祐 Kay 錄音師 Recording Engineer｜楊博皓 Seal
混音師 Mixing Engineer｜張家誠 Chia Chen Chang 母帶後期製作 Mastering Engineer｜張家誠 Chia Chen Chang
藝人經紀 Artist Manager｜育珊 Yü3 藝人助理 Artist Assistant｜育辰、書昀
單曲封面設計 Cover Art｜李縉加 Jonas Lee","我唱著前人道盡的哀愁 讓人錯覺我好像經歷過 感受著未曾發生的苦痛 用美麗的謊言包裝醜陋 我唱著眾人喜愛的情歌 讓人錯覺我好像深愛過 重複著千篇一律的架構 卻還是流著淚感同身受 我撕心裂肺地唱著 你都聽過的感受 廉價的感動連我都無地自容 我用盡全力地唱著 無人聽聞的內容 曲終人散去 衷心感謝你膚淺的包容 不用在意我想傳達甚麼 只要能讓你愛上這節奏 我還是願意接受這荒謬 諷刺的是 你根本也不想懂 我撕心裂肺地唱著 你都聽過的感受 廉價的感動連我都無地自容 我用盡全力地唱著 無人聽聞的內容 曲終人散去 衷心感謝你膚淺的包容 
我唱著前人道盡的哀愁 讓人錯覺我好像經歷過 感受著未曾發生的苦痛 用美麗的謊言包裝醜陋
我唱著眾人喜愛的情歌 讓人錯覺我好像深愛過 重複著千篇一律的架構 卻還是流著淚感同身受
我撕心裂肺地唱著 你都聽過的感受 廉價的感動連我都無地自容 我用盡全力地唱著 無人聽聞的內容 曲終人散去 衷心感謝你膚淺的包容
不用在意我想傳達甚麼 只要能讓你愛上這節奏 我還是願意接受這荒謬 諷刺的是 你根本也不想懂
我撕心裂肺地唱著 你都聽過的感受 廉價的感動連我都無地自容 我用盡全力地唱著 無人聽聞的內容 曲終人散去 衷心感謝你膚淺的包容
留言（ 10 ） 最相關留言 所有留言
留言（ 10 ）",2026-05-06,,True,False,
2026-05-09 21:47:14,4,,,23,2920,7,https://streetvoice.com/HakkaPopMusic/songs/854978/,https://streetvoice.com/HakkaPopMusic/,"https://akstatic.streetvoice.com/music_albums/Ha/kk/HakkaPopMusic/NLUVZmkXMpNBaTVjYRtRgV.jpeg?x-oss-process=image/resize,m_fixed,h_1,w_1,limit_0/resize,m_fixed,h_630,w_1200,limit_0/watermark,image_bXVzaWNfYWxidW1zL0hhL2trL0hha2thUG9wTXVzaWMvTkxVVlpta1hNcE5CYVRWallSdFJnVi5qcGVnP3gtb3NzLXByb2Nlc3M9aW1hZ2UvcmVzaXplLG1fZml4ZWQsaF8zNDQsd18zNDQsbGltaXRfMA,g_nw,x_428,y_143/watermark,image_YXNzZXQvaW1hZ2VzL21ldGFpbWFnZS1zb25nLnBuZw,g_nw,x_0,y_0",@HakkaPopMusic,音樂人,台北市,2020-02-01,,13,155,,,,https://www.youtube.com/user/StreetVoiceTV,Blues,2025 全球客家流行音樂大賽合輯,https://streetvoice.com/HakkaPopMusic/songs/album/97325132/,Anna 莊啟馨,"Anna 莊啟馨｜𠊎毋驚 英：I Don’t Give A… 作詞｜管啟源、Anna 莊啟馨   作曲｜Anna 莊啟馨 《𠊎毋驚》講述的是8-90年代醞釀快速致富之道，自己在90-2000年出來闖時頻頻遇見這些人要他放棄夢想，實際一點。 音樂表現上非常精彩且大膽，歌詞中有一句：「食米粉多過麵」，靈感其實是來自早期美劇《Six Million Dollar Man》的諧音梗，這種南洋客家特有的幽默感讓歌曲瞬間生動起來。 在編曲與唱法上，這首歌不僅有像是在對話般的說話式獨白，更融合了旋律演唱與層次豐富的和弦唱法。多種聲音交織在一起，讓整首歌聽起來充滿生命力與畫面感 透過這首歌，Anna 想要告訴大家：成功的定義從來不是只有一種。在這個追求速度與財富的時代，不一定要跟隨別人的腳步才算贏。 每個人都有權利決定自己的成功，能夠看透物質的誘惑，踏實地過好自己的人生，那份發自內心的快樂，就是最珍貴、最福裕的定義。 
Anna 莊啟馨｜𠊎毋驚 英：I Don’t Give A… 作詞｜管啟源、Anna 莊啟馨   作曲｜Anna 莊啟馨
《𠊎毋驚》講述的是8-90年代醞釀快速致富之道，自己在90-2000年出來闖時頻頻遇見這些人要他放棄夢想，實際一點。
音樂表現上非常精彩且大膽，歌詞中有一句：「食米粉多過麵」，靈感其實是來自早期美劇《Six Million Dollar Man》的諧音梗，這種南洋客家特有的幽默感讓歌曲瞬間生動起來。 在編曲與唱法上，這首歌不僅有像是在對話般的說話式獨白，更融合了旋律演唱與層次豐富的和弦唱法。多種聲音交織在一起，讓整首歌聽起來充滿生命力與畫面感
透過這首歌，Anna 想要告訴大家：成功的定義從來不是只有一種。在這個追求速度與財富的時代，不一定要跟隨別人的腳步才算贏。
每個人都有權利決定自己的成功，能夠看透物質的誘惑，踏實地過好自己的人生，那份發自內心的快樂，就是最珍貴、最福裕的定義。","𠊎毋驚 詞Lyricists： 管啟源 Kuan、莊啟馨 Anna Chong 曲Composer：莊啟馨 Anna Chong 編曲Arrangers：莊啟馨 Anna Chong 、劉維忠 Liu Wei Zhong 十幾年無見隻朋友來尋𠊎飲茶 聽講𠊎食米粉又多過麵 過得去啦𠊎撈佢講 「無麼該過毋去個  係冇」 佢講上隻時代𠊎兜錯過忒多 麼該 bit coin  麼該蘋果 what 十幾年無見隻朋友有啲傲氣 你看你看賓士隻鎖匙特意放在那位 過得去啦  佢撈 𠊎講 「有幾十千就過得去 有幾百萬就冇問題」 佢有隻課程 佢有位先生 佢曉教𠊎樣邊做人 𠊎毋驚𠊎毋驚  你講𠊎無錢（𠊎係當真無） 𠊎毋驚𠊎毋驚  你講𠊎毋曉（𠊎當真毋曉） 𠊎毋驚𠊎毋驚𠊎毋驚 你講𠊎憨 𠊎𠊎𠊎真係好憨 講講講 講講講 講	坐等這邊聽你 講講講 講講講 十幾年無見個朋友愛送𠊎iphone 佢講快快快簽那隻配套就送iphone 窩 佢講佢都係為𠊎好 𠊎愛毋愛信佢好咧 40歲前財富自由毋係夢 𠊎打目睡唔知佢講馬該鬼 十幾年無見個朋友來尋涯飲茶 𠊎撈佢講  佢好本事 搞藝術𠊎  真好開心 𠊎唔係小蚊仔唔蘇擔心𠊎 𠊎毋驚𠊎毋驚  你講𠊎無錢（𠊎係當真無） 𠊎毋驚𠊎毋驚  你講𠊎毋曉（𠊎當真毋曉） 𠊎毋驚𠊎毋驚𠊎毋驚 你講𠊎憨 𠊎真係好憨 𠊎...𠊎..𠊎𠊎...𠊎..𠊎 Nga Nga Nga Nga Nga Nga Nga Nga 驚 驚	驚 驚 驚 Bududu badudu bom BAO 𠊎𠊎𠊎 真係好  真係好  真係好 真係好  真係好  真係好 Ui 你 愛 簽 冇 喔 
𠊎毋驚 詞Lyricists： 管啟源 Kuan、莊啟馨 Anna Chong 曲Composer：莊啟馨 Anna Chong 編曲Arrangers：莊啟馨 Anna Chong 、劉維忠 Liu Wei Zhong
十幾年無見隻朋友來尋𠊎飲茶 聽講𠊎食米粉又多過麵 過得去啦𠊎撈佢講 「無麼該過毋去個  係冇」 佢講上隻時代𠊎兜錯過忒多 麼該 bit coin  麼該蘋果 what
十幾年無見隻朋友有啲傲氣 你看你看賓士隻鎖匙特意放在那位 過得去啦  佢撈 𠊎講 「有幾十千就過得去 有幾百萬就冇問題」 佢有隻課程 佢有位先生 佢曉教𠊎樣邊做人
𠊎毋驚𠊎毋驚  你講𠊎無錢（𠊎係當真無） 𠊎毋驚𠊎毋驚  你講𠊎毋曉（𠊎當真毋曉） 𠊎毋驚𠊎毋驚𠊎毋驚 你講𠊎憨 𠊎𠊎𠊎真係好憨
講講講 講講講 講	坐等這邊聽你 講講講 講講講
十幾年無見個朋友愛送𠊎iphone 佢講快快快簽那隻配套就送iphone 窩 佢講佢都係為𠊎好 𠊎愛毋愛信佢好咧 40歲前財富自由毋係夢 𠊎打目睡唔知佢講馬該鬼
十幾年無見個朋友來尋涯飲茶 𠊎撈佢講  佢好本事 搞藝術𠊎  真好開心 𠊎唔係小蚊仔唔蘇擔心𠊎
𠊎毋驚𠊎毋驚  你講𠊎無錢（𠊎係當真無） 𠊎毋驚𠊎毋驚  你講𠊎毋曉（𠊎當真毋曉） 𠊎毋驚𠊎毋驚𠊎毋驚 你講𠊎憨 𠊎真係好憨
𠊎...𠊎..𠊎𠊎...𠊎..𠊎 Nga Nga Nga Nga Nga Nga Nga Nga 驚 驚	驚 驚 驚 Bududu badudu bom BAO 𠊎𠊎𠊎 真係好  真係好  真係好 真係好  真係好  真係好
Ui 你 愛 簽 冇 喔
留言（ 7 ） 最相關留言 所有留言
留言（ 7 ）",2026-04-23,,True,True,https://streetvoice.com/HakkaPopMusic/songs/854978/critic_reviews/
