snapshot_time,rank,artist_name,song_title,likes_count,play_count,comments_count,song_url,artist_url,cover_image_url,artist_handle,artist_identity,artist_city,artist_joined_date,artist_accredited_datetime,artist_music_count,artist_fans_count,artist_following_count,artist_facebook_url,artist_instagram_url,artist_youtube_url,genre,album_title,album_url,collaborators,description,lyrics,release_date,song_accredited_datetime,is_editor_recommended,is_song_of_the_day,critic_review_url
2026-07-14 05:09:44,13,,,70,6829,71,https://streetvoice.com/sleepingwalker_1234/songs/867673/,https://streetvoice.com/sleepingwalker_1234/,"https://akstatic.streetvoice.com/song_covers/sl/ee/sleepingwalker_1234/F4VhUoExdto9RU4SjEN2ZA.jpeg?x-oss-process=image/resize,m_fixed,h_1,w_1,limit_0/resize,m_fixed,h_630,w_1200,limit_0/watermark,image_c29uZ19jb3ZlcnMvc2wvZWUvc2xlZXBpbmd3YWxrZXJfMTIzNC9GNFZoVW9FeGR0bzlSVTRTakVOMlpBLmpwZWc_eC1vc3MtcHJvY2Vzcz1pbWFnZS9yZXNpemUsbV9maXhlZCxoXzM0NCx3XzM0NCxsaW1pdF8w,g_nw,x_428,y_143/watermark,image_YXNzZXQvaW1hZ2VzL21ldGFpbWFnZS1zb25nLnBuZw,g_nw,x_0,y_0",@sleepingwalker_1234,音樂人,新北市,2019-12-01,2022-03-21 15:49,4,822,5,https://www.facebook.com/SleepingWalkersBand,https://www.instagram.com/sleepingwalkers_band/,https://www.youtube.com/@sleepingwalkers,Pop,,,,"「當煙火的煙硝徹底落幕，留在寂靜裡的嘆息，都是我愛過你的痕跡。」 曾經，我們之間只有一步之遙。那份沒能說出口的悸動，最終在躊躇中退回了原點，寂靜地消失在荒野裡。那些與你的交集，終究只被允許在夢境裡重演；回到現實，你依然是我永遠抵達不了的遙不可及。 那是一場絢麗卻轉瞬即逝的煙火，在歌曲後段化為情感猛烈的一場爆破，毫無保留地宣洩著惋惜。而當喧囂散去、煙硝落幕，一切最終在寂靜裡凝結成嘆息，徒留那片荒蕪的光景。 - Song Credit 主唱 Vocal / 張鈞皓 King Chang 吉他 Guitar / 黃士軒 R.Ken 合成器 Synthesizer / 陳立昕 C.Hsin 貝斯 Bass / 張煒堃 FunFunTwo 鼓 Drum / 張宥俞 U Fish 和音 Chorus / 張鈞皓 King Chang, 黃士軒 R.Ken, 陳立昕 C.Hsin, 林侑賢 YOSHI, 阿海 AHI - 詞 Lyricst / 張鈞皓 King Chang, 黃士軒 R.Ken, 張皓棠 Dennis Chang 曲 Composer / 張鈞皓 King Chang, 黃士軒 R.Ken, 張皓棠 Dennis Chang 製作人 Produce / 黃士軒 R.Ken, 林侑賢 YOSHI 編曲 Arranger / 夢遊旅人 Sleeping Walkers, 林侑賢 YOSHI 配唱製作人 Vocal Producer / 張皓棠 Dennis Chang 人聲、鼓組錄音師 Recording Engineer / 黃士軒 R.Ken 人聲、鼓組錄音室 Recording Studio / 騷聲工房 Sound Factory 鼓組技師 Drum Technician / 李欣翰 Hsinhan Lee 混音師 Mixing Engineer / 趙宇晨 Asa Chao 母帶後期工程師 Mastering Engineer / 趙宇晨 Asa Chao - 封面設計與攝影 Cover Design & Photography / 黃子維 Brady - 特別感謝 Dennis、侑賢、欣翰、小黑的幫助，沒有他們我們完成不了這首歌！ 
「當煙火的煙硝徹底落幕，留在寂靜裡的嘆息，都是我愛過你的痕跡。」
曾經，我們之間只有一步之遙。那份沒能說出口的悸動，最終在躊躇中退回了原點，寂靜地消失在荒野裡。那些與你的交集，終究只被允許在夢境裡重演；回到現實，你依然是我永遠抵達不了的遙不可及。
那是一場絢麗卻轉瞬即逝的煙火，在歌曲後段化為情感猛烈的一場爆破，毫無保留地宣洩著惋惜。而當喧囂散去、煙硝落幕，一切最終在寂靜裡凝結成嘆息，徒留那片荒蕪的光景。
-
Song Credit 主唱 Vocal / 張鈞皓 King Chang 吉他 Guitar / 黃士軒 R.Ken 合成器 Synthesizer / 陳立昕 C.Hsin 貝斯 Bass / 張煒堃 FunFunTwo 鼓 Drum / 張宥俞 U Fish 和音 Chorus / 張鈞皓 King Chang, 黃士軒 R.Ken, 陳立昕 C.Hsin, 林侑賢 YOSHI, 阿海 AHI - 詞 Lyricst / 張鈞皓 King Chang, 黃士軒 R.Ken, 張皓棠 Dennis Chang 曲 Composer / 張鈞皓 King Chang, 黃士軒 R.Ken, 張皓棠 Dennis Chang 製作人 Produce / 黃士軒 R.Ken, 林侑賢 YOSHI 編曲 Arranger / 夢遊旅人 Sleeping Walkers, 林侑賢 YOSHI 配唱製作人 Vocal Producer / 張皓棠 Dennis Chang 人聲、鼓組錄音師 Recording Engineer / 黃士軒 R.Ken 人聲、鼓組錄音室 Recording Studio / 騷聲工房 Sound Factory 鼓組技師 Drum Technician / 李欣翰 Hsinhan Lee 混音師 Mixing Engineer / 趙宇晨 Asa Chao 母帶後期工程師 Mastering Engineer / 趙宇晨 Asa Chao
- 封面設計與攝影 Cover Design & Photography / 黃子維 Brady - 特別感謝 Dennis、侑賢、欣翰、小黑的幫助，沒有他們我們完成不了這首歌！","動態歌詞
沉默地看著你無暇的眼眸 那悸動藏心中沒能說出口 我們之間忽遠忽近的距離 始終無法靠近 我一直躊躇在原地 最後 終究 不再聯繫 望著你身影逐漸離去 消失在那荒野裡 一遍一遍 我在這夢裡複習 不願面對失去 這裡還有你的痕跡 遺憾的結局 難道是天意 哪怕再多一點的努力 那雙手也牽不起 無法抽離 不想接受這結局 不停地惋惜 淚擦不盡 嘿 我又夢見你 爆破散去後的光景 是我 愛你的痕跡 一夜 一夜 這場夢揮之不去 逐漸滲入縫隙 無形侵蝕晝夜交替 爛漫 回憶 佔領空地 消逝點滴我害怕失去 卻也不忍再想起 有些 曾經 我對快樂的定義 是誰不敢清醒 原來都已遙不可及 往事已散去 凝結成嘆息 就在最後我獨自駛離 能否記住你的呼吸 嘿 我又夢見你 爆破散去後的光景 是我 愛你的痕跡 嘿 我還在等你 在相遇後的每個瞬間 都在 哀傷 你的溫柔 囚禁著烏有 嘿 我又夢見你 坦然地把你忘記 難道不切實際 嘿 我不再等你 最後的煙硝和光 隨著你而去 你的溫柔 囚禁我所有 （讓它 隨著你而去） 你的溫柔 囚禁著烏有 
沉默地看著你無暇的眼眸 那悸動藏心中沒能說出口
我們之間忽遠忽近的距離 始終無法靠近 我一直躊躇在原地 最後 終究 不再聯繫 望著你身影逐漸離去 消失在那荒野裡
一遍一遍 我在這夢裡複習 不願面對失去 這裡還有你的痕跡 遺憾的結局 難道是天意 哪怕再多一點的努力 那雙手也牽不起
無法抽離 不想接受這結局 不停地惋惜 淚擦不盡
嘿 我又夢見你 爆破散去後的光景 是我 愛你的痕跡
一夜 一夜 這場夢揮之不去 逐漸滲入縫隙 無形侵蝕晝夜交替 爛漫 回憶 佔領空地 消逝點滴我害怕失去 卻也不忍再想起
有些 曾經 我對快樂的定義 是誰不敢清醒 原來都已遙不可及 往事已散去 凝結成嘆息 就在最後我獨自駛離 能否記住你的呼吸
嘿 我又夢見你 爆破散去後的光景 是我 愛你的痕跡 嘿 我還在等你 在相遇後的每個瞬間 都在 哀傷
你的溫柔 囚禁著烏有
嘿 我又夢見你 坦然地把你忘記 難道不切實際 嘿 我不再等你 最後的煙硝和光 隨著你而去
你的溫柔 囚禁我所有 （讓它 隨著你而去） 你的溫柔 囚禁著烏有
留言（ 71 ） 最相關留言 所有留言
留言（ 71 ）",2026-07-06,,True,False,
2026-07-14 05:09:44,14,,,16,1316,3,https://streetvoice.com/nanguaq/songs/867076/,https://streetvoice.com/nanguaq/,"https://akstatic.streetvoice.com/music_albums/na/ng/nanguaq/WxM4QgAAxeTJzg2atWBb2S.jpeg?x-oss-process=image/resize,m_fixed,h_1,w_1,limit_0/resize,m_fixed,h_630,w_1200,limit_0/watermark,image_bXVzaWNfYWxidW1zL25hL25nL25hbmd1YXEvV3hNNFFnQUF4ZVRKemcyYXRXQmIyUy5qcGVnP3gtb3NzLXByb2Nlc3M9aW1hZ2UvcmVzaXplLG1fZml4ZWQsaF8zNDQsd18zNDQsbGltaXRfMA,g_nw,x_428,y_143/watermark,image_YXNzZXQvaW1hZ2VzL21ldGFpbWFnZS1zb25nLnBuZw,g_nw,x_0,y_0",@nanguaq,音樂人,台北市,2020-09-01,2024-01-11 17:13,33,1096,,https://www.facebook.com/nanguaq,https://www.instagram.com/nanguaq/,https://www.youtube.com/@nanguaq188,Hip hop / Rap,𝐑.𝐟𝐮《扛 𝐓𝐇𝐄 𝐖𝐄𝐈𝐆𝐇𝐓》,https://streetvoice.com/nanguaq/songs/album/97325587/,,"製作人 Producer｜黃少雍 Huang Shao Yong、ABAO阿爆 編曲 Arrangement｜王韻筑 Liv W.、黃少雍 Huang Shao Yong、Musa明馬丁 貝斯 Bass｜Payam Ghasemi 管樂 Brass｜Artem Koryapin 弦樂編寫 String Arrangement｜王韻筑 Liv W. 弦樂 Strings｜曜爆甘音樂工作室 Just Busy Music Studio 第一小提琴 First Violin｜陳奕勇 Yi-Yung Chen 第二小提琴 Second Violin｜陳奕勇 Yi-Yung Chen、甘威鵬 Weapon Gan 中提琴 Viola｜甘威鵬 Weapon Gan 配唱製作人 Vocal Producer ｜ABAO阿爆 撒奇萊雅語編譯：Imi．Mayaw （陳玉蘭） 和聲編寫 Background Vocal Arranger｜布蘭地 Brandy Tien、R.fu、ABAO阿爆 和聲 Background Vocal｜R.fu、Arase阿拉斯、曾妮、ABAO阿爆、布蘭地 Brandy Tien 錄音師 Recording Engineer｜林志龍Lin Linz 錄音室 Recording Studio｜Coop Studio 混音師 Mix Engineer｜黃少雍 Huang Shao Yong 混音錄音室 Mixing Studio｜Coop Studio 母帶後期處理工程師 Mastering Engineer｜Dave Kutch 母帶後期處理錄音室 Mastering Studio｜The Mastering Palace 
製作人 Producer｜黃少雍 Huang Shao Yong、ABAO阿爆 編曲 Arrangement｜王韻筑 Liv W.、黃少雍 Huang Shao Yong、Musa明馬丁 貝斯 Bass｜Payam Ghasemi 管樂 Brass｜Artem Koryapin 弦樂編寫 String Arrangement｜王韻筑 Liv W. 弦樂 Strings｜曜爆甘音樂工作室 Just Busy Music Studio 第一小提琴 First Violin｜陳奕勇 Yi-Yung Chen 第二小提琴 Second Violin｜陳奕勇 Yi-Yung Chen、甘威鵬 Weapon Gan 中提琴 Viola｜甘威鵬 Weapon Gan 配唱製作人 Vocal Producer ｜ABAO阿爆 撒奇萊雅語編譯：Imi．Mayaw （陳玉蘭） 和聲編寫 Background Vocal Arranger｜布蘭地 Brandy Tien、R.fu、ABAO阿爆 和聲 Background Vocal｜R.fu、Arase阿拉斯、曾妮、ABAO阿爆、布蘭地 Brandy Tien 錄音師 Recording Engineer｜林志龍Lin Linz 錄音室 Recording Studio｜Coop Studio 混音師 Mix Engineer｜黃少雍 Huang Shao Yong 混音錄音室 Mixing Studio｜Coop Studio 母帶後期處理工程師 Mastering Engineer｜Dave Kutch 母帶後期處理錄音室 Mastering Studio｜The Mastering Palace","2.I'll follow You 詞：R.fu 曲：R.fu anu nayana yay tu kisu a maazih 雖然房間沒有妳的身影 nika  mahiza u izaway tu kisu 但我依然能感受到妳 yu mazateng ku piabubu isu i takuwanan 像是與妳擁抱著回憶 saicelang sa kaku a mauzip 我依然認真活下去 心中 砰 砰 砰 yu  kemeten aku ku mata 當我閉上了眼 matabu nu bulah aku i tisuwan 總是被思念包圍著 na inayay tu kisu  satibahaw satu kauzip aku 沒了妳感覺生活少了完整 kilul hantu aku ku nizaten  照著生活目標 misinanut a taayaw 節奏繼續前進 adasay kapah matengil ku damsayay a dadiw 許下期望能聽見那美妙聲線 mapaicelang ku uzip nu maku 能夠帶動我所有一切生命線 na～ sademsemay a dadiw 美麗的古謠 u paicelangay  u pakabulahay能量又帶點思念 Yeah a a a Caay ku daayumen a maala ku canacanan  所有一切都是得來不易 Yeah a a a I will follow u lima & balucu’ （手與心） I will follow u lima & balucu’（手與心） I will follow u lima & balucu’（手與心） I will follow u lima & balucu’（手與心） 夕陽西下 彷彿你 臉龐的溫柔 Oh ~ AO AO AO ba la ba ba la la la 嘟嚕 嘟嚕 嘟嚕 嘟嚕嚕嚕嚕 suzikuz han miazih sa回頭望著 milihiza mueneng i tisuwan跟你坐在一起 mitabu tu kanamuhan isu a icep包著你最愛的檳榔 sademiad sa katukuh kalabiyan 從早到傍晚 saleni’ sleni’ tu ku labii微風的夜晚 sicaedung tu kaku我穿著族服 mahiza maazihay i labii夜晚彷彿看見 biwbiw sa ku bali picaliway niza她走過夜色像一陣微風 saka lawpelawpesan tu ku bunac星光都為她慢慢失重 tatungus sa a mudadiw美麗的姿態唱著古謠 na ngiha’ mudadiw這歌聲 mapatakelal tu ku Kitakita世界也亮了起來 I will follow u lima & balucu’ （手與心） I will follow u lima & balucu’（手與心） I will follow u lima & balucu’（手與心） I will follow u lima & balucu’（手與心） 夕陽西下 彷彿你 臉龐的溫柔 Oh ~ mihakukay tu nay balucu’ay a kawaw 許下願望 從心做起 i tawa   i lusa’  i bulah  笑聲、眼淚、思念 i piliyas 離別 tabaki ku sakukay aku i tusuwan 感謝的心 yeah yeah yeah yeah I will follow u lima & balucu’ （手與心） I will follow u lima & balucu’（手與心） I will follow u lima & balucu’（手與心） I will follow u lima & balucu’（手與心） 夕陽西下 彷彿你 臉龐的溫柔 Oh ~ follow  follow  follow  follow  you bulu~bulu~bulu~bulucu’ follow  follow  follow  follow  you bulucu’ 
2.I'll follow You
詞：R.fu 曲：R.fu
anu nayana yay tu kisu a maazih 雖然房間沒有妳的身影 nika  mahiza u izaway tu kisu 但我依然能感受到妳 yu mazateng ku piabubu isu i takuwanan 像是與妳擁抱著回憶 saicelang sa kaku a mauzip 我依然認真活下去 心中 砰 砰 砰 yu  kemeten aku ku mata 當我閉上了眼 matabu nu bulah aku i tisuwan 總是被思念包圍著 na inayay tu kisu  satibahaw satu kauzip aku 沒了妳感覺生活少了完整 kilul hantu aku ku nizaten  照著生活目標 misinanut a taayaw 節奏繼續前進 adasay kapah matengil ku damsayay a dadiw 許下期望能聽見那美妙聲線 mapaicelang ku uzip nu maku 能夠帶動我所有一切生命線 na～ sademsemay a dadiw 美麗的古謠 u paicelangay  u pakabulahay能量又帶點思念 Yeah a a a Caay ku daayumen a maala ku canacanan  所有一切都是得來不易 Yeah a a a
I will follow u lima & balucu’ （手與心） I will follow u lima & balucu’（手與心） I will follow u lima & balucu’（手與心） I will follow u lima & balucu’（手與心） 夕陽西下 彷彿你 臉龐的溫柔 Oh ~
AO AO AO ba la ba ba la la la 嘟嚕 嘟嚕 嘟嚕 嘟嚕嚕嚕嚕
suzikuz han miazih sa回頭望著 milihiza mueneng i tisuwan跟你坐在一起 mitabu tu kanamuhan isu a icep包著你最愛的檳榔 sademiad sa katukuh kalabiyan 從早到傍晚 saleni’ sleni’ tu ku labii微風的夜晚 sicaedung tu kaku我穿著族服 mahiza maazihay i labii夜晚彷彿看見 biwbiw sa ku bali picaliway niza她走過夜色像一陣微風 saka lawpelawpesan tu ku bunac星光都為她慢慢失重 tatungus sa a mudadiw美麗的姿態唱著古謠 na ngiha’ mudadiw這歌聲 mapatakelal tu ku Kitakita世界也亮了起來
I will follow u lima & balucu’ （手與心） I will follow u lima & balucu’（手與心） I will follow u lima & balucu’（手與心） I will follow u lima & balucu’（手與心） 夕陽西下 彷彿你 臉龐的溫柔 Oh ~
mihakukay tu nay balucu’ay a kawaw 許下願望 從心做起 i tawa   i lusa’  i bulah  笑聲、眼淚、思念 i piliyas 離別 tabaki ku sakukay aku i tusuwan 感謝的心 yeah yeah yeah yeah
I will follow u lima & balucu’ （手與心） I will follow u lima & balucu’（手與心） I will follow u lima & balucu’（手與心） I will follow u lima & balucu’（手與心） 夕陽西下 彷彿你 臉龐的溫柔 Oh ~
follow  follow  follow  follow  you bulu~bulu~bulu~bulucu’ follow  follow  follow  follow  you bulucu’
留言（ 3 ） 最相關留言 所有留言
留言（ 3 ）",2026-07-01,,True,True,
2026-07-14 05:09:44,15,,,13,840,39,https://streetvoice.com/kingdomofrain/songs/867848/,https://streetvoice.com/kingdomofrain/,"https://akstatic.streetvoice.com/song_covers/ki/ng/kingdomofrain/iuVgsHSMyVi2mdUqbi6yBg.jpeg?x-oss-process=image/resize,m_fixed,h_1,w_1,limit_0/resize,m_fixed,h_630,w_1200,limit_0/watermark,image_c29uZ19jb3ZlcnMva2kvbmcva2luZ2RvbW9mcmFpbi9pdVZnc0hTTXlWaTJtZFVxYmk2eUJnLmpwZWc_eC1vc3MtcHJvY2Vzcz1pbWFnZS9yZXNpemUsbV9maXhlZCxoXzM0NCx3XzM0NCxsaW1pdF8w,g_nw,x_428,y_143/watermark,image_YXNzZXQvaW1hZ2VzL21ldGFpbWFnZS1zb25nLnBuZw,g_nw,x_0,y_0",@kingdomofrain,音樂人,,,2021-05-20 15:42,63,1742,1,,,https://youtu.be/GRV3uu6d_xw,Dance,,,,"詞曲：陳翰 編曲：雨國 混音：曹安 母帶：曹安 
詞曲：陳翰 編曲：雨國 混音：曹安 母帶：曹安","動態歌詞
穿梭在巷弄 誰又能找到出口 已經不能回頭 是否有始有終 已沒有如果 不去後悔所做 從沒想過回頭 不曾去想結果 穿梭在巷弄 誰又能找到出口 已經不能回頭 是否有始有終 已沒有如果 不去後悔所做 從沒想過回頭 不曾去想結果 忘記所有美好想像 聆聽內心想說的話 你有要去的地方 不在意誰的看法 在夜晚的高塔上 看向前方 邁開步伐往前闖 沒有什麼好害怕 滿是星空的遠方 充滿想像 你有要去的地方 不在意誰的看法 在夜晚的高塔上 看向前方 邁開步伐往前闖 沒有什麼好害怕 滿是星空的遠方 充滿想像 穿梭在巷弄 誰又能找到出口 已經不能回頭 是否有始有終 已沒有如果 不去後悔所做 從沒想過回頭 不曾去想結果 穿梭在巷弄 誰又能找到出口 已經不能回頭 是否有始有終 已沒有如果 不去後悔所做 從沒想過回頭 不曾去想結果 忘記所有美好想像 聆聽內心想說的話 你有要去的地方 不在意誰的看法 在夜晚的高塔上 看向前方 邁開步伐往前闖 沒有什麼好害怕 滿是星空的遠方 充滿想像 你有要去的地方 不在意誰的看法 在夜晚的高塔上 看向前方 邁開步伐往前闖 沒有什麼好害怕 滿是星空的遠方 充滿想像 
穿梭在巷弄 誰又能找到出口 已經不能回頭 是否有始有終 已沒有如果 不去後悔所做 從沒想過回頭 不曾去想結果 穿梭在巷弄 誰又能找到出口 已經不能回頭 是否有始有終 已沒有如果 不去後悔所做 從沒想過回頭 不曾去想結果 忘記所有美好想像 聆聽內心想說的話 你有要去的地方 不在意誰的看法 在夜晚的高塔上 看向前方 邁開步伐往前闖 沒有什麼好害怕 滿是星空的遠方 充滿想像 你有要去的地方 不在意誰的看法 在夜晚的高塔上 看向前方 邁開步伐往前闖 沒有什麼好害怕 滿是星空的遠方 充滿想像 穿梭在巷弄 誰又能找到出口 已經不能回頭 是否有始有終 已沒有如果 不去後悔所做 從沒想過回頭 不曾去想結果 穿梭在巷弄 誰又能找到出口 已經不能回頭 是否有始有終 已沒有如果 不去後悔所做 從沒想過回頭 不曾去想結果 忘記所有美好想像 聆聽內心想說的話 你有要去的地方 不在意誰的看法 在夜晚的高塔上 看向前方 邁開步伐往前闖 沒有什麼好害怕 滿是星空的遠方 充滿想像 你有要去的地方 不在意誰的看法 在夜晚的高塔上 看向前方 邁開步伐往前闖 沒有什麼好害怕 滿是星空的遠方 充滿想像
留言（ 39 ） 最相關留言 所有留言
留言（ 39 ）",2026-07-06,,True,False,
2026-07-14 05:09:44,16,,,10,159,9,https://streetvoice.com/ChristopherR/songs/869059/,https://streetvoice.com/ChristopherR/,"https://akstatic.streetvoice.com/song_covers/Ch/ri/ChristopherR/PKu7BKoCiMY64Yc5rXTsvg.jpg?x-oss-process=image/resize,m_fixed,h_1,w_1,limit_0/resize,m_fixed,h_630,w_1200,limit_0/watermark,image_c29uZ19jb3ZlcnMvQ2gvcmkvQ2hyaXN0b3BoZXJSL1BLdTdCS29DaU1ZNjRZYzVyWFRzdmcuanBnP3gtb3NzLXByb2Nlc3M9aW1hZ2UvcmVzaXplLG1fZml4ZWQsaF8zNDQsd18zNDQsbGltaXRfMA,g_nw,x_428,y_143/watermark,image_YXNzZXQvaW1hZ2VzL21ldGFpbWFnZS1zb25nLnBuZw,g_nw,x_0,y_0",@ChristopherR,音樂人,,,,37,37,121,,,https://www.youtube.com/user/StreetVoiceTV,Pop,,,,"Ivre de toi 是法文，意思是「為你而醉」、「醉於你」。不是跟你一起喝醉，而是：酒都還沒喝，你就先讓我暈船惹。 這首歌來自一個出差週五夜：沒有飯局，沒有安排，只剩一張房卡、一杯酒，和突然變得太有溫度的城市。 這不是爛醉，也不是失控；是那種「今晚有沒有人陪，明天要不要一起吃早餐」的高級曖昧。英文主線混合法文耳語，包在 sophisti-pop、city soul、round bass 裡。不過，品味男士沒事不會砸自己的腳。 No alibi, no crime。 沒有不在場證明，也沒有犯罪。只是靈感剛好太靠近。 克非抓到這個念頭，笑了一下，直接一個人回房間，打開 MacBook，反覆修改寫到天亮。歌剛好整理完，也剛好一個人下樓吃早餐。至於 vocal，一夜沒睡，當然是飛回台北再錄再整。 微醺的是歌，不是人。 如果你還是不相信，自己聽聽看： 如果什麼事都沒發生，這首歌為什麼性感得這麼真實。 
Ivre de toi 是法文，意思是「為你而醉」、「醉於你」。不是跟你一起喝醉，而是：酒都還沒喝，你就先讓我暈船惹。
這首歌來自一個出差週五夜：沒有飯局，沒有安排，只剩一張房卡、一杯酒，和突然變得太有溫度的城市。
這不是爛醉，也不是失控；是那種「今晚有沒有人陪，明天要不要一起吃早餐」的高級曖昧。英文主線混合法文耳語，包在 sophisti-pop、city soul、round bass 裡。不過，品味男士沒事不會砸自己的腳。
No alibi, no crime。 沒有不在場證明，也沒有犯罪。只是靈感剛好太靠近。
克非抓到這個念頭，笑了一下，直接一個人回房間，打開 MacBook，反覆修改寫到天亮。歌剛好整理完，也剛好一個人下樓吃早餐。至於 vocal，一夜沒睡，當然是飛回台北再錄再整。
微醺的是歌，不是人。
如果你還是不相信，自己聽聽看： 如果什麼事都沒發生，這首歌為什麼性感得這麼真實。","Ivre de toi ce soir, c’est toi Ivre de toi un peu trop, déjà Friday night in another city no dinner on the plan Just a hotel key, a quiet lobby and a drink in my hand Je suis là pour le travail but the work is finally through Then you smile across the counter and the evening changes view Je devrais rentrer be good, be wise, be gone But the night has empty hours and your eyes keep staying on Ivre de toi ce n’est pas le vin It’s the way you make this city feel like trouble walking in Ivre de toi je perds un peu la voix I was only asking softly will someone stay tonight? Ivre de toi un peu trop près de toi Ivre de toi don’t let the music stop No meeting in the morning no one waiting at the door Just the elevator humming and my shoes beside the floor Tu ris, et je comprends there are things we don’t have to say If tonight is just a question can breakfast be the way? Je devrais sourire and leave it light, comme ça But your fingers touch your glass and the room forgets the law Ivre de toi ce n’est pas le vin It’s the way you make this city feel like trouble walking in Ivre de toi je perds un peu la voix I was only asking softly will someone stay tonight? Ivre de toi un peu trop près de toi Ivre de toi don’t let the music stop Pas de grand roman pas de promesse à minuit Just a Friday with no dinner and the moon above the street Alors reste encore leave the morning undefined If we laugh until the sunrise will you have breakfast with me? Ivre de toi ce n’est pas le vin It’s the way you make this city feel like trouble walking in Ivre de toi je perds un peu la voix I was only asking softly will someone stay tonight? Ivre de toi un peu trop près de toi Ivre de toi don’t let the music stop Not the wine not the night pas le vin juste toi Ivre de toi 
Ivre de toi ce soir, c’est toi Ivre de toi un peu trop, déjà
Friday night in another city no dinner on the plan Just a hotel key, a quiet lobby and a drink in my hand
Je suis là pour le travail but the work is finally through Then you smile across the counter and the evening changes view
Je devrais rentrer be good, be wise, be gone But the night has empty hours and your eyes keep staying on
Ivre de toi ce n’est pas le vin It’s the way you make this city feel like trouble walking in
Ivre de toi je perds un peu la voix I was only asking softly will someone stay tonight?
Ivre de toi un peu trop près de toi Ivre de toi don’t let the music stop
No meeting in the morning no one waiting at the door Just the elevator humming and my shoes beside the floor
Tu ris, et je comprends there are things we don’t have to say If tonight is just a question can breakfast be the way?
Je devrais sourire and leave it light, comme ça But your fingers touch your glass and the room forgets the law
Ivre de toi ce n’est pas le vin It’s the way you make this city feel like trouble walking in
Ivre de toi je perds un peu la voix I was only asking softly will someone stay tonight?
Ivre de toi un peu trop près de toi Ivre de toi don’t let the music stop
Pas de grand roman pas de promesse à minuit Just a Friday with no dinner and the moon above the street
Alors reste encore leave the morning undefined If we laugh until the sunrise will you have breakfast with me?
Ivre de toi ce n’est pas le vin It’s the way you make this city feel like trouble walking in
Ivre de toi je perds un peu la voix I was only asking softly will someone stay tonight?
Ivre de toi un peu trop près de toi Ivre de toi don’t let the music stop
Not the wine not the night pas le vin juste toi
Ivre de toi
留言（ 9 ） 最相關留言 所有留言
留言（ 9 ）",2026-07-13,,False,False,
