snapshot_time,rank,artist_name,song_title,likes_count,play_count,comments_count,song_url,artist_url,cover_image_url,artist_handle,artist_identity,artist_city,artist_joined_date,artist_accredited_datetime,artist_music_count,artist_fans_count,artist_following_count,artist_facebook_url,artist_instagram_url,artist_youtube_url,genre,album_title,album_url,collaborators,description,lyrics,release_date,song_accredited_datetime,is_editor_recommended,is_song_of_the_day,critic_review_url
2026-07-14 05:09:44,22,,,155,8517,18,https://streetvoice.com/sa10940391/songs/864308/,https://streetvoice.com/sa10940391/,"https://akstatic.streetvoice.com/music_albums/sa/10/sa10940391/aJGcingV2aMXxtwvq4iWa3.jpeg?x-oss-process=image/resize,m_fixed,h_1,w_1,limit_0/resize,m_fixed,h_630,w_1200,limit_0/watermark,image_bXVzaWNfYWxidW1zL3NhLzEwL3NhMTA5NDAzOTEvYUpHY2luZ1YyYU1YeHR3dnE0aVdhMy5qcGVnP3gtb3NzLXByb2Nlc3M9aW1hZ2UvcmVzaXplLG1fZml4ZWQsaF8zNDQsd18zNDQsbGltaXRfMA,g_nw,x_428,y_143/watermark,image_YXNzZXQvaW1hZ2VzL21ldGFpbWFnZS1zb25nLnBuZw,g_nw,x_0,y_0",@sa10940391,音樂人,,,,7,40,29,,,https://www.youtube.com/user/StreetVoiceTV,Folk,躺成一片草原,https://streetvoice.com/sa10940391/songs/album/97325466/,,,"詞：施勁瑋 Roy Shih 曲：施勁瑋 我常常到了一個地方 卻忘了要做什麼 陽光灑的剛剛好 回憶停靠在路邊 就像把一切都濃縮 現在我們要去哪 應該有一片草原 陽光灑的剛剛好 回憶停靠在路邊 就像把一切都濃縮 在提醒我還不夠 現在沒什麼煩惱 靈魂的機關是壞掉的 在路上沒開的口 舉例著活著的理由 我的問題是什麼 在路上沒開的口 開始舉例 活著的理由 我常常到了一個地方 卻忘了要做什麼 陽光灑的剛剛好 回憶停靠在路邊 就像把一切都濃縮 在提醒我還不夠 現在沒什麼煩惱 靈魂的機關是壞掉的 在路上沒開的口 舉例著活著的理由 我的問題是什麼 在路上沒開的口 開始舉例 活著的理由 我在路途撞壞了車 在路途中撞壞了車 我在路途撞壞了車 在路途中撞壞了車 在路途中撞壞了車 在路途中撞壞了車 在路途中撞壞的車 他載著我 我在路途中撞壞了車 在路途中撞壞了車 現在沒什麼煩惱 靈魂的機關是壞掉的 在路上沒開的口 舉例著活著的理由 我的問題是什麼 在路上沒開的口 開始舉例 取消 
詞：施勁瑋 Roy Shih 曲：施勁瑋
我常常到了一個地方 卻忘了要做什麼 陽光灑的剛剛好 回憶停靠在路邊 就像把一切都濃縮
現在我們要去哪 應該有一片草原 陽光灑的剛剛好 回憶停靠在路邊 就像把一切都濃縮 在提醒我還不夠
現在沒什麼煩惱 靈魂的機關是壞掉的 在路上沒開的口 舉例著活著的理由 我的問題是什麼 在路上沒開的口 開始舉例 活著的理由
我常常到了一個地方 卻忘了要做什麼 陽光灑的剛剛好 回憶停靠在路邊 就像把一切都濃縮 在提醒我還不夠
現在沒什麼煩惱 靈魂的機關是壞掉的 在路上沒開的口 舉例著活著的理由 我的問題是什麼 在路上沒開的口 開始舉例 活著的理由
我在路途撞壞了車 在路途中撞壞了車 我在路途撞壞了車 在路途中撞壞了車
在路途中撞壞了車 在路途中撞壞了車 在路途中撞壞的車 他載著我
我在路途中撞壞了車 在路途中撞壞了車
現在沒什麼煩惱 靈魂的機關是壞掉的 在路上沒開的口 舉例著活著的理由 我的問題是什麼 在路上沒開的口 開始舉例 取消
留言（ 18 ） 最相關留言 所有留言
留言（ 18 ）",2026-06-14,,True,True,https://streetvoice.com/sa10940391/songs/864308/critic_reviews/
2026-07-14 05:09:44,23,,,2,36,2,https://streetvoice.com/alanences/songs/868933/,https://streetvoice.com/alanences/,"https://akstatic.streetvoice.com/song_covers/al/an/alanences/Sxoa2FAQMqdxuubE6aeaTM.jpeg?x-oss-process=image/resize,m_fixed,h_1,w_1,limit_0/resize,m_fixed,h_630,w_1200,limit_0/watermark,image_c29uZ19jb3ZlcnMvYWwvYW4vYWxhbmVuY2VzL1N4b2EyRkFRTXFkeHV1YkU2YWVhVE0uanBlZz94LW9zcy1wcm9jZXNzPWltYWdlL3Jlc2l6ZSxtX2ZpeGVkLGhfMzQ0LHdfMzQ0LGxpbWl0XzA,g_nw,x_428,y_143/watermark,image_YXNzZXQvaW1hZ2VzL21ldGFpbWFnZS1zb25nLnBuZw,g_nw,x_0,y_0",@alanences,音樂人,台北市,2019-03-01,,24,37,29,,,https://www.youtube.com/user/StreetVoiceTV,Electronic,,,,"詞/曲：Alan 編曲：影子Shadow 鼓組編曲：宗穎 製作人：陳翰 
詞/曲：Alan 編曲：影子Shadow 鼓組編曲：宗穎 製作人：陳翰","主歌Verse 深夜路燈陪我向前走 冷風吹過沉默的街口 那些挫敗刺痛了傷口 也讓現在的我更成熟 副歌Chorus 我在黑夜裡獨自升級 跌過幾次都沒放棄 努力未必會有奇蹟 不去嘗試，怎麼贏自己 
主歌Verse 深夜路燈陪我向前走 冷風吹過沉默的街口 那些挫敗刺痛了傷口 也讓現在的我更成熟
副歌Chorus 我在黑夜裡獨自升級 跌過幾次都沒放棄 努力未必會有奇蹟 不去嘗試，怎麼贏自己
留言（ 2 ） 最相關留言 所有留言
留言（ 2 ）",2026-07-13,,True,False,
2026-07-14 05:09:44,24,,,7,189,6,https://streetvoice.com/anyonesthere/songs/868525/,https://streetvoice.com/anyonesthere/,"https://akstatic.streetvoice.com/song_covers/an/yo/anyonesthere/FBvjDrNDJJwQhSQuoCDjLu.jpeg?x-oss-process=image/resize,m_fixed,h_1,w_1,limit_0/resize,m_fixed,h_630,w_1200,limit_0/watermark,image_c29uZ19jb3ZlcnMvYW4veW8vYW55b25lc3RoZXJlL0ZCdmpEck5ESkp3UWhTUXVvQ0RqTHUuanBlZz94LW9zcy1wcm9jZXNzPWltYWdlL3Jlc2l6ZSxtX2ZpeGVkLGhfMzQ0LHdfMzQ0LGxpbWl0XzA,g_nw,x_428,y_143/watermark,image_YXNzZXQvaW1hZ2VzL21ldGFpbWFnZS1zb25nLnBuZw,g_nw,x_0,y_0",@anyonesthere,音樂人,台北市,2016-05-01,2021-09-07 16:55,19,1170,,https://www.facebook.com/yilelintaiwan,,https://youtube.com/c/YILELIN%E6%9E%97%E4%BB%A5%E6%A8%82,Folk,,,,"一個追一個逃 這樣的人間遊戲還不算是甜蜜 
一個追一個逃 這樣的人間遊戲還不算是甜蜜","I can thinking without to telling i can sing if you don’t hear it It’s been a long season It’s been a long journey mm... Leaves are changing with their color The ground looks so bright because of snowing I am so sorry because I was missing You couldn’t found me And It drives you crazy du du du du du du du du du du People who know me are not always sweet to me We all fucked up things then got some little punishing It’s been a long day to walked on the street And couples are kissing all around How did they get lost and found ? Ah ah ah du du du du du du du du du du Asking a question to me Hanging up the moon to see To be or not to be To think or not to think It should be another answer another answer , another answer another answer another answer another answer another answer another answer When we could finally meet du du du du du du du du du du 
I can thinking without to telling i can sing if you don’t hear it It’s been a long season It’s been a long journey mm...
Leaves are changing with their color The ground looks so bright because of snowing I am so sorry because I was missing You couldn’t found me And It drives you crazy du du du du du du du du du du
People who know me are not always sweet to me We all fucked up things then got some little punishing It’s been a long day to walked on the street And couples are kissing all around How did they get lost and found ? Ah ah ah du du du du du du du du du du
Asking a question to me Hanging up the moon to see To be or not to be To think or not to think It should be another answer another answer , another answer another answer another answer another answer another answer another answer When we could finally meet du du du du du du du du du du
留言（ 6 ） 最相關留言 所有留言
留言（ 6 ）",2026-07-10,,True,False,
2026-07-14 05:09:44,25,,,67,6780,7,https://streetvoice.com/morebeus_official/songs/867203/,https://streetvoice.com/morebeus_official/,"https://akstatic.streetvoice.com/song_covers/mo/re/morebeus_official/SivocSXcbC75RS5TmT5Xrs.jpeg?x-oss-process=image/resize,m_fixed,h_1,w_1,limit_0/resize,m_fixed,h_630,w_1200,limit_0/watermark,image_c29uZ19jb3ZlcnMvbW8vcmUvbW9yZWJldXNfb2ZmaWNpYWwvU2l2b2NTWGNiQzc1UlM1VG1UNVhycy5qcGVnP3gtb3NzLXByb2Nlc3M9aW1hZ2UvcmVzaXplLG1fZml4ZWQsaF8zNDQsd18zNDQsbGltaXRfMA,g_nw,x_428,y_143/watermark,image_YXNzZXQvaW1hZ2VzL21ldGFpbWFnZS1zb25nLnBuZw,g_nw,x_0,y_0",@morebeus_official,音樂人,台灣,2025-12-01,2026-02-12 09:57,5,614,2,,https://www.instagram.com/morebeus_official/,https://www.youtube.com/@morebeus_official,Rock,,,,"〈天命〉這首歌獻給所有創作者：用數不清的遺憾，餵養手裡的歌； 用傷口流下的血，換取台下的掌聲。這樣的執念，如同我們的天命，既痛苦又浪漫。 
〈天命〉這首歌獻給所有創作者：用數不清的遺憾，餵養手裡的歌； 用傷口流下的血，換取台下的掌聲。這樣的執念，如同我們的天命，既痛苦又浪漫。","動態歌詞
你看吧 還是沒學到教訓嗎 人是多麼脆弱的啊 你還不清楚嗎 想愛就愛的猖狂 想恨就恨到底吧 不計代價 不計代價 不計代價 開啟 自我防禦 早已失控的情緒 藏在身體裡 一個一個冰冷的面具 這樣才能活下去 別再 裝作委屈 海市蜃樓的記憶 就讓他死去 一口一口吞噬著自己 逐漸沒了呼吸 其實我只想 要有 一個人愛著 無悔的活著 但我只能 自噬著靈魂 化成了掌聲讓 聚光燈下的我揭開我的傷 一個人愛著 這樣就好了嗎 這是你的天命啊 寫吧 寫吧 把你失去的都寫下 這是你的天命啊 哭吧 哭吧 讓眼淚代替你逃亡 這是你的天命啊 唱吧 唱吧 和你說不出口的話 這是你的天命啊 走吧 走吧 別回頭望一輩子就這樣 其實我不想 要有 一個人愛著 無悔的活著 留我在這 自噬著靈魂 化成了掌聲讓 聚光燈下的我揭開我的傷 一個人唱著 這樣就好了啊 
你看吧 還是沒學到教訓嗎 人是多麼脆弱的啊 你還不清楚嗎 想愛就愛的猖狂 想恨就恨到底吧 不計代價 不計代價 不計代價
開啟 自我防禦 早已失控的情緒 藏在身體裡 一個一個冰冷的面具 這樣才能活下去 別再 裝作委屈 海市蜃樓的記憶 就讓他死去 一口一口吞噬著自己 逐漸沒了呼吸
其實我只想 要有 一個人愛著 無悔的活著 但我只能 自噬著靈魂 化成了掌聲讓 聚光燈下的我揭開我的傷 一個人愛著 這樣就好了嗎
這是你的天命啊 寫吧 寫吧 把你失去的都寫下 這是你的天命啊 哭吧 哭吧 讓眼淚代替你逃亡 這是你的天命啊 唱吧 唱吧 和你說不出口的話 這是你的天命啊 走吧 走吧 別回頭望一輩子就這樣
其實我不想 要有 一個人愛著 無悔的活著 留我在這 自噬著靈魂 化成了掌聲讓 聚光燈下的我揭開我的傷 一個人唱著 這樣就好了啊
留言（ 7 ） 最相關留言 所有留言
留言（ 7 ）",2026-07-01,,True,False,
2026-07-14 05:09:44,26,,,1,117,2,https://streetvoice.com/minze____/songs/869010/,https://streetvoice.com/minze____/,"https://akstatic.streetvoice.com/song_covers/mi/nz/minze____/eoTvnG9kCwMfcPqQFaRzJM.jpeg?x-oss-process=image/resize,m_fixed,h_1,w_1,limit_0/resize,m_fixed,h_630,w_1200,limit_0/watermark,image_c29uZ19jb3ZlcnMvbWkvbnovbWluemVfX19fL2VvVHZuRzlrQ3dNZmNQcVFGYVJ6Sk0uanBlZz94LW9zcy1wcm9jZXNzPWltYWdlL3Jlc2l6ZSxtX2ZpeGVkLGhfMzQ0LHdfMzQ0LGxpbWl0XzA,g_nw,x_428,y_143/watermark,image_YXNzZXQvaW1hZ2VzL21ldGFpbWFnZS1zb25nLnBuZw,g_nw,x_0,y_0",@minze____,音樂人,屏東縣,2021-05-01,,6,10,3,,,https://www.youtube.com/user/StreetVoiceTV,Hip hop / Rap,,,,"哪裡都容不下我，想回去但是也不知道回到哪裡。 不斷地往前走，因為知道不能停下，但我也想要有一個讓我安靜休息的歸處 — by kurumiii 
哪裡都容不下我，想回去但是也不知道回到哪裡。 不斷地往前走，因為知道不能停下，但我也想要有一個讓我安靜休息的歸處 — by kurumiii","Where should I go 哪裡到底適合我 這地方容不下我 感覺我的心很空 我不停尋找著我自己感覺像在談場異地戀 無聲的吶喊止不住的淚不知道已經第幾夜 從小到大沒有人教我遇到險惡該怎麼面對 心理疾病在你們耳中像我在無病聲吟的騙 為什麼我與眾不同 承受疼痛 手變鋼索 我哪裡做錯 我無藥可救 想四處躲 躲到我可以安心休息無人打擾的懷中 Day by day 我的焦慮情緒 feel the pain 腦袋轉不停像壞掉的拉鏈 我停不下來 I’m stuck in my brain smile on my face but I’m not okay 以前的傷疤現在還在蔓延 影響著我每一次的選擇點 到最後只剩一種無感的累 腦海聲音從來沒停過 越想安靜越是失控 再撐一下就要碎 我的世界就像黑洞一樣 越往裡面 伸手不見五指的漆黑 我也想要幾顆星星 還有月亮 在我的黑夜中漂亮的點綴 誰會喜歡在這麼窒息的地方 慢慢等著自己消失不見 為什麼我與眾不同 承受疼痛 手變鋼索 我哪裡做錯 我無藥可救 想四處躲 躲到我可以安心休息無人打擾的懷中 為什麼我與眾不同 承受疼痛 手變鋼索 我哪裡做錯 我無藥可救 想四處躲 躲到我可以安心休息無人打擾的懷中 
Where should I go 哪裡到底適合我 這地方容不下我 感覺我的心很空
我不停尋找著我自己感覺像在談場異地戀 無聲的吶喊止不住的淚不知道已經第幾夜 從小到大沒有人教我遇到險惡該怎麼面對 心理疾病在你們耳中像我在無病聲吟的騙
為什麼我與眾不同 承受疼痛 手變鋼索 我哪裡做錯 我無藥可救 想四處躲 躲到我可以安心休息無人打擾的懷中
Day by day 我的焦慮情緒 feel the pain 腦袋轉不停像壞掉的拉鏈 我停不下來 I’m stuck in my brain
smile on my face but I’m not okay 以前的傷疤現在還在蔓延 影響著我每一次的選擇點 到最後只剩一種無感的累
腦海聲音從來沒停過 越想安靜越是失控 再撐一下就要碎
我的世界就像黑洞一樣 越往裡面 伸手不見五指的漆黑
我也想要幾顆星星 還有月亮 在我的黑夜中漂亮的點綴
誰會喜歡在這麼窒息的地方 慢慢等著自己消失不見
為什麼我與眾不同 承受疼痛 手變鋼索 我哪裡做錯 我無藥可救 想四處躲 躲到我可以安心休息無人打擾的懷中
為什麼我與眾不同 承受疼痛 手變鋼索 我哪裡做錯 我無藥可救 想四處躲 躲到我可以安心休息無人打擾的懷中
留言（ 2 ） 最相關留言 所有留言
留言（ 2 ）",2026-07-13,,False,False,
2026-07-14 05:09:44,27,,,35,2287,10,https://streetvoice.com/marsmeimei/songs/866179/,https://streetvoice.com/marsmeimei/,"https://akstatic.streetvoice.com/song_covers/ma/rs/marsmeimei/Aio8piixdMFwqsRvWtPHv6.jpeg?x-oss-process=image/resize,m_fixed,h_1,w_1,limit_0/resize,m_fixed,h_630,w_1200,limit_0/watermark,image_c29uZ19jb3ZlcnMvbWEvcnMvbWFyc21laW1laS9BaW84cGlpeGRNRndxc1J2V3RQSHY2LmpwZWc_eC1vc3MtcHJvY2Vzcz1pbWFnZS9yZXNpemUsbV9maXhlZCxoXzM0NCx3XzM0NCxsaW1pdF8w,g_nw,x_428,y_143/watermark,image_YXNzZXQvaW1hZ2VzL21ldGFpbWFnZS1zb25nLnBuZw,g_nw,x_0,y_0",@marsmeimei,音樂人,台北市,2017-11-01,2025-10-08 13:38,6,81,8,https://www.facebook.com/share/1GPmAbT9r1/,,https://youtube.com/channel/UCB1mc11lpuGwTK1f7xG9nhg,Singer / Songwriter,《色緻》 The Absolute,https://streetvoice.com/marsmeimei/songs/album/97325559/,謝明諺、柯智豪,"猶原清流的彼个夢，啥款色水佮你相仝？ 澄波先生的油畫布頂，有伊少年時的青春夢。 少年時的陳澄波佇弛放的節奏佮電氣聲響中行來， 用空間的殘響發布了現代主義的結構宣言。 曲中用蘋果剖半素描、清流、琳琅山閣、淡水系列等畫作寫入歌詞， Call & responce的旋律曲調來呼應遮的迷人的畫作， 佮陳澄波堅定的信念。 製作人 Producer：柯智豪 Blaire Ko、謝明諺 Minyen Hsieh 演唱人 Vocal：林理惠 Mars Lin 詞 Lyrics：林理惠 Mars Lin 曲 Composition：林理惠 Mars Lin 編曲 Arrangement：林冠均 Jun Lin 合成器 Synthesizer：詹宗霖 Tsung Lin Chan 合聲編寫 Backing Vocal Arrangement：林理惠Mars Lin 合聲 Backing Vocal：林理惠Mars Lin 錄音 Recording Engineer：劉詩偉 Shih Wei Liu、許智敏 Jamie Hsu 混音 Mixing Engineer：劉詩偉 Shih Wei Liu 母帶後期 Mastering：劉詩偉 Shih Wei Liu 錄音室 Recording Studio：佳聲錄音室 Good Sound Studio、白金錄音室 Platinum Studio、繭房錄音室 Cocoon's Studio 台文校對 Taiwaness Proofreading：鄭順聰 Tēnn Sūn-tshong 完整專輯這裡聽： https://linktr.ee/marsmeimei 
猶原清流的彼个夢，啥款色水佮你相仝？ 澄波先生的油畫布頂，有伊少年時的青春夢。 少年時的陳澄波佇弛放的節奏佮電氣聲響中行來， 用空間的殘響發布了現代主義的結構宣言。 曲中用蘋果剖半素描、清流、琳琅山閣、淡水系列等畫作寫入歌詞， Call & responce的旋律曲調來呼應遮的迷人的畫作， 佮陳澄波堅定的信念。
製作人 Producer：柯智豪 Blaire Ko、謝明諺 Minyen Hsieh 演唱人 Vocal：林理惠 Mars Lin 詞 Lyrics：林理惠 Mars Lin 曲 Composition：林理惠 Mars Lin 編曲 Arrangement：林冠均 Jun Lin
合成器 Synthesizer：詹宗霖 Tsung Lin Chan 合聲編寫 Backing Vocal Arrangement：林理惠Mars Lin 合聲 Backing Vocal：林理惠Mars Lin 錄音 Recording Engineer：劉詩偉 Shih Wei Liu、許智敏 Jamie Hsu 混音 Mixing Engineer：劉詩偉 Shih Wei Liu 母帶後期 Mastering：劉詩偉 Shih Wei Liu 錄音室 Recording Studio：佳聲錄音室 Good Sound Studio、白金錄音室 Platinum Studio、繭房錄音室 Cocoon's Studio 台文校對 Taiwaness Proofreading：鄭順聰 Tēnn Sūn-tshong
完整專輯這裡聽： https://linktr.ee/marsmeimei
https://linktr.ee/marsmeimei","詞曲：林理惠 遊ぼう 來𨑨迌 看田嬰 散步 三線路 陳澄波 佇山頂 畫圖 油彩的布 剖爿りんご 嘉義的雨 os The world puts off its mask of vastness to its lover. It becomes small as one song, as one kiss of the eternal. blossom of song 唱一首琳瑯山閣的夢 waiting so long 畫一筆染做淡水的紅 blossom of song 下色予嘉義街外的人 waiting so long 用藝術拍開台灣的窗 blossom of song 猶原佇清流的彼个夢 waiting so long 等無著淡水的彼个人 blossom of song 啥物款色水佮你相仝 waiting so long 用畫筆填補時間的縫 
詞曲：林理惠 遊ぼう 來𨑨迌 看田嬰 散步 三線路 陳澄波 佇山頂 畫圖 油彩的布 剖爿りんご 嘉義的雨 os The world puts off its mask of vastness to its lover. It becomes small as one song, as one kiss of the eternal. blossom of song 唱一首琳瑯山閣的夢 waiting so long 畫一筆染做淡水的紅 blossom of song 下色予嘉義街外的人 waiting so long 用藝術拍開台灣的窗 blossom of song 猶原佇清流的彼个夢 waiting so long 等無著淡水的彼个人 blossom of song 啥物款色水佮你相仝 waiting so long 用畫筆填補時間的縫
留言（ 10 ） 最相關留言 所有留言
留言（ 10 ）",2026-06-26,,True,True,
2026-07-14 05:09:44,28,,,5,263,0,https://streetvoice.com/jeffcch/songs/868688/,https://streetvoice.com/jeffcch/,"https://akstatic.streetvoice.com/song_covers/je/ff/jeffcch/Zf7hez5qh3M7oncGk6zqtT.jpeg?x-oss-process=image/resize,m_fixed,h_1,w_1,limit_0/resize,m_fixed,h_630,w_1200,limit_0/watermark,image_c29uZ19jb3ZlcnMvamUvZmYvamVmZmNjaC9aZjdoZXo1cWgzTTdvbmNHazZ6cXRULmpwZWc_eC1vc3MtcHJvY2Vzcz1pbWFnZS9yZXNpemUsbV9maXhlZCxoXzM0NCx3XzM0NCxsaW1pdF8w,g_nw,x_428,y_143/watermark,image_YXNzZXQvaW1hZ2VzL21ldGFpbWFnZS1zb25nLnBuZw,g_nw,x_0,y_0",@jeffcch,音樂人,台北市,2022-02-01,,5,19,3,,,https://www.youtube.com/user/StreetVoiceTV,Hip hop / Rap,,,Dav,"大嘻哈3 淘汰選手 Ｒｅｍｉｘ 『淘汰』以茲紀念 Lyrics / Composer: J3ff, Dav維鈞 Produced by: 淨土 Pureland Arranger: GAOGE4150, 于修 Yssue Recording engineer: GAOGE4150 Mixing / Mastering: GAOGE4150, 于修 Yssue Vocal Production: Dav維鈞 特別感謝: 陳奕迅/周杰倫 
大嘻哈3 淘汰選手 Ｒｅｍｉｘ 『淘汰』以茲紀念
Lyrics / Composer: J3ff, Dav維鈞 Produced by: 淨土 Pureland Arranger: GAOGE4150, 于修 Yssue Recording engineer: GAOGE4150 Mixing / Mastering: GAOGE4150, 于修 Yssue Vocal Production: Dav維鈞
特別感謝: 陳奕迅/周杰倫","淘了汰 結局怎麼醬 這首換個type 你們怎麼想 收到好多愛 還有夥伴在 回公司打領帶 也沒怎麼樣 Keep going 做音樂應該很過癮 就繼續的打磨著自己的作品 一樣工作每天喝兩杯coffee 一樣fridaynight 我香菸配酒精 Remix 陳奕遜的淘汰但我們才沒有很遜 那評審對我說你押什麼爛韻難怪沒有進 God damn 對 得說謝謝 不用比賽 省了特休來飛去日本找姐姐 Back to the studio 還是繼續做著音樂 I don’t really care now 管他上不上tv I don’t really care now 他們說我配不配 音樂怎能被比較 哪來的對不對 沒有多大的抱負 我只想看你笑 在音軌裡面陪你哭泣 偶爾也陪你鬧 So u tell me now 到底怎麽樣才算被淘汰 就算是跌倒 這次也要跌得豪邁 
淘了汰 結局怎麼醬 這首換個type 你們怎麼想 收到好多愛 還有夥伴在 回公司打領帶 也沒怎麼樣 Keep going 做音樂應該很過癮 就繼續的打磨著自己的作品 一樣工作每天喝兩杯coffee 一樣fridaynight 我香菸配酒精 Remix 陳奕遜的淘汰但我們才沒有很遜 那評審對我說你押什麼爛韻難怪沒有進 God damn 對 得說謝謝 不用比賽 省了特休來飛去日本找姐姐 Back to the studio 還是繼續做著音樂 I don’t really care now 管他上不上tv I don’t really care now 他們說我配不配 音樂怎能被比較 哪來的對不對 沒有多大的抱負 我只想看你笑 在音軌裡面陪你哭泣 偶爾也陪你鬧 So u tell me now 到底怎麽樣才算被淘汰 就算是跌倒 這次也要跌得豪邁
留言（ 0 ） 最相關留言 所有留言
留言（ 0 ）",2026-07-11,,False,False,
