snapshot_time,rank,artist_name,song_title,likes_count,play_count,comments_count,song_url,artist_url,cover_image_url,artist_handle,artist_identity,artist_city,artist_joined_date,artist_accredited_datetime,artist_music_count,artist_fans_count,artist_following_count,artist_facebook_url,artist_instagram_url,artist_youtube_url,genre,album_title,album_url,collaborators,description,lyrics,release_date,song_accredited_datetime,is_editor_recommended,is_song_of_the_day,critic_review_url
2026-07-21 04:38:31,25,,,18,1176,3,https://streetvoice.com/backquarterno5/songs/869115/,https://streetvoice.com/backquarterno5/,"https://akstatic.streetvoice.com/song_covers/ba/ck/backquarterno5/ERFHqqyNVQ8KBDuDppsruu.jpeg?x-oss-process=image/resize,m_fixed,h_1,w_1,limit_0/resize,m_fixed,h_630,w_1200,limit_0/watermark,image_c29uZ19jb3ZlcnMvYmEvY2svYmFja3F1YXJ0ZXJubzUvRVJGSHFxeU5WUThLQkR1RHBwc3J1dS5qcGVnP3gtb3NzLXByb2Nlc3M9aW1hZ2UvcmVzaXplLG1fZml4ZWQsaF8zNDQsd18zNDQsbGltaXRfMA,g_nw,x_428,y_143/watermark,image_YXNzZXQvaW1hZ2VzL21ldGFpbWFnZS1zb25nLnBuZw,g_nw,x_0,y_0",@backquarterno5,音樂人,台北市,2008-06-01,,9,990,1,,,https://www.youtube.com/user/StreetVoiceTV,Rock,,,,"項鍊 詞：陳如山 曲：陳如山 編曲：四分衛 2000 年 11 月 29 日（星期三），四分衛在台北師大路的地下社會演出。 當時虎神的哥哥捷任，在台下用 MiniDisc（MD）錄下了整場演出，之後再轉錄到 CD 保存。 那時候的四分衛是： 主唱｜阿山 吉他｜虎神、小郭 貝斯｜阿辰 鼓｜阿玩 原本這張錄音有十幾首歌，但經過二十六年的時間，CD 已經有些毀損。如今只有前面六首還能完整播放，後面的曲目不是出現數位雜訊，就是已經無法修復。 今天心血來潮，把這六首整理後上傳到 StreetVoice。 這不是一張經過重新混音或修正的 Live 專輯，而是一段被時間保存下來的現場紀錄。那些失真、雜音、觀眾的歡呼，甚至器材留下的痕跡，都是 2000 年 11 月 29 日那個夜晚的一部分。 謝謝捷任當年按下錄音鍵，也謝謝這張傷痕累累的 CD，讓二十六年前地下社會的聲音，今天還能再次被聽見。 
項鍊 詞：陳如山 曲：陳如山 編曲：四分衛
2000 年 11 月 29 日（星期三），四分衛在台北師大路的地下社會演出。 當時虎神的哥哥捷任，在台下用 MiniDisc（MD）錄下了整場演出，之後再轉錄到 CD 保存。 那時候的四分衛是： 主唱｜阿山 吉他｜虎神、小郭 貝斯｜阿辰 鼓｜阿玩 原本這張錄音有十幾首歌，但經過二十六年的時間，CD 已經有些毀損。如今只有前面六首還能完整播放，後面的曲目不是出現數位雜訊，就是已經無法修復。 今天心血來潮，把這六首整理後上傳到 StreetVoice。 這不是一張經過重新混音或修正的 Live 專輯，而是一段被時間保存下來的現場紀錄。那些失真、雜音、觀眾的歡呼，甚至器材留下的痕跡，都是 2000 年 11 月 29 日那個夜晚的一部分。 謝謝捷任當年按下錄音鍵，也謝謝這張傷痕累累的 CD，讓二十六年前地下社會的聲音，今天還能再次被聽見。","經過了許多脈動以後，似乎我已醒來，圍繞在頸動脈 滑過了肩膀的那場雨，從我眼框出來，藏在你的鱗片裡 不讓人知道你曾經哭紅了眼睛，佈滿淚痕 我是一道拋開詛咒的蟒蛇 吃掉你的寂寞，甘願為你犧牲 我是一道害怕冬眠的蟒蛇 發射絢爛圖騰，散發出光和熱 需要，需要妳的體溫 漫步在24個小時的飢餓感裡面，佈滿傷痕∼ 時間耗損了新鮮感，逐漸退去光澤，等待著無盡永恆 忽然間，失落感，在血液中擴散開來， 從你鬆開我雙手開始 我是一道拋開詛咒的蟒蛇 躲在搖籃哭泣，習慣了窗外景色 我是一道害怕冬眠的蟒蛇 無法和妳一起∼在鏡子面前沸騰 需要，需要妳的體溫 需要，需要妳的體溫 forever∼forever∼forever∼forever 
經過了許多脈動以後，似乎我已醒來，圍繞在頸動脈 滑過了肩膀的那場雨，從我眼框出來，藏在你的鱗片裡
不讓人知道你曾經哭紅了眼睛，佈滿淚痕
我是一道拋開詛咒的蟒蛇 吃掉你的寂寞，甘願為你犧牲 我是一道害怕冬眠的蟒蛇 發射絢爛圖騰，散發出光和熱 需要，需要妳的體溫
漫步在24個小時的飢餓感裡面，佈滿傷痕∼ 時間耗損了新鮮感，逐漸退去光澤，等待著無盡永恆
忽然間，失落感，在血液中擴散開來， 從你鬆開我雙手開始
我是一道拋開詛咒的蟒蛇 躲在搖籃哭泣，習慣了窗外景色 我是一道害怕冬眠的蟒蛇 無法和妳一起∼在鏡子面前沸騰 需要，需要妳的體溫 需要，需要妳的體溫
forever∼forever∼forever∼forever
留言（ 3 ） 最相關留言 所有留言
留言（ 3 ）",2026-07-13,,True,False,
2026-07-21 04:38:31,26,,,22,7404,5,https://streetvoice.com/ribingu2024/songs/867410/,https://streetvoice.com/ribingu2024/,"https://akstatic.streetvoice.com/music_albums/ri/bi/ribingu2024/czWkRTxVGZHUsKL2D7UQnF.jpeg?x-oss-process=image/resize,m_fixed,h_1,w_1,limit_0/resize,m_fixed,h_630,w_1200,limit_0/watermark,image_bXVzaWNfYWxidW1zL3JpL2JpL3JpYmluZ3UyMDI0L2N6V2tSVHhWR1pIVXNLTDJEN1VRbkYuanBlZz94LW9zcy1wcm9jZXNzPWltYWdlL3Jlc2l6ZSxtX2ZpeGVkLGhfMzQ0LHdfMzQ0LGxpbWl0XzA,g_nw,x_428,y_143/watermark,image_YXNzZXQvaW1hZ2VzL21ldGFpbWFnZS1zb25nLnBuZw,g_nw,x_0,y_0",@ribingu2024,音樂人,,,,13,43,,,,https://www.youtube.com/user/StreetVoiceTV,Rock,Living,https://streetvoice.com/ribingu2024/songs/album/97325602/,,"作詞 Lyricist｜Melet@RIBINGU 作曲 Composer｜RIBINGU 製作人 Producer｜RIBINGU 編曲 Arrangement｜Yu@RIBINGU 配唱製作人 Vocal Recording Producer｜RIBINGU 音頻剪輯工程師 Audio Editing Engineer｜嚴予良 Yu Liang Yen／Yu@RIBINGU 和聲編寫 Background Vocal Arrangement｜RIBNGU 和聲 Background Vocal｜RIBINGU 電貝斯 Electric Bass｜陳馮岓 Axter.chen 爵士鼓 Drum｜陳東浩 Tong-Hao Chen 錄音師 Recording Engineer｜嚴予良／Yu@RIBINGU 錄音室 Recording Studio｜喵老闆 Meow Music Studio 混音師 Mixing Engineer｜張名廷 ex3545 混音室 Mixing Studio｜基械貓音樂有限公司 Robokatz Music Production 母帶後期處理工程師 Mastering Engineer｜陳陸泰(A-Tai)LuTai Chen 母帶後期處理錄音室 Mastering Studio｜原艾母帶工程錄音室 Mugwort Mastering 
作詞 Lyricist｜Melet@RIBINGU 作曲 Composer｜RIBINGU
製作人 Producer｜RIBINGU 編曲 Arrangement｜Yu@RIBINGU 配唱製作人 Vocal Recording Producer｜RIBINGU 音頻剪輯工程師 Audio Editing Engineer｜嚴予良 Yu Liang Yen／Yu@RIBINGU 和聲編寫 Background Vocal Arrangement｜RIBNGU 和聲 Background Vocal｜RIBINGU 電貝斯 Electric Bass｜陳馮岓 Axter.chen 爵士鼓 Drum｜陳東浩 Tong-Hao Chen 錄音師 Recording Engineer｜嚴予良／Yu@RIBINGU 錄音室 Recording Studio｜喵老闆 Meow Music Studio 混音師 Mixing Engineer｜張名廷 ex3545 混音室 Mixing Studio｜基械貓音樂有限公司 Robokatz Music Production 母帶後期處理工程師 Mastering Engineer｜陳陸泰(A-Tai)LuTai Chen 母帶後期處理錄音室 Mastering Studio｜原艾母帶工程錄音室 Mugwort Mastering","We wanna fly high 想定義怎樣的自 We wanna survive 只愛亻厓同你 亻厓 看一下日頭 乜看星仔月華 看世界發光 樹椏 擘擘杈杈 蟬聲 唧唧唧唧 在茶園撞走 啊 天空在敨氣 頭擺秘密 無有人聽講 沒有了目的地 腳步也不會停 會去到哪裡 We wanna fly high 想定義怎樣的自己 We wanna survive 只愛亻厓同你 亻厓 倆儕 共下 行在闊野野个土地 今晡日 都可以 只要有愛 啊 天空在敨氣 頭擺秘密 無有人聽講 沒有了目的地 腳步也不會停 也不用在意 We wanna fly high 想定義怎樣的自己 We wanna survive 只愛亻厓同你 亻厓 倆儕 共下 行在闊野野个土地 今晡日 都可以 只要有愛 We wanna fly high 想定義怎樣的自己 We wanna survive 只愛亻厓同你 亻厓 倆儕 共下 行在闊野野个土地 今晡日 都可以 只要有愛 就行 
We wanna fly high 想定義怎樣的自 We wanna survive 只愛亻厓同你
亻厓 看一下日頭 乜看星仔月華 看世界發光 樹椏 擘擘杈杈 蟬聲 唧唧唧唧 在茶園撞走
啊 天空在敨氣 頭擺秘密 無有人聽講 沒有了目的地 腳步也不會停 會去到哪裡
We wanna fly high 想定義怎樣的自己 We wanna survive 只愛亻厓同你 亻厓 倆儕 共下 行在闊野野个土地 今晡日 都可以 只要有愛
啊 天空在敨氣 頭擺秘密 無有人聽講 沒有了目的地 腳步也不會停 也不用在意
We wanna fly high 想定義怎樣的自己 We wanna survive 只愛亻厓同你 亻厓 倆儕 共下 行在闊野野个土地 今晡日 都可以 只要有愛
We wanna fly high 想定義怎樣的自己 We wanna survive 只愛亻厓同你 亻厓 倆儕 共下 行在闊野野个土地 今晡日 都可以 只要有愛 就行
留言（ 5 ） 最相關留言 所有留言
留言（ 5 ）",2026-07-04,,True,True,
2026-07-21 04:38:31,27,,,3,211,5,https://streetvoice.com/hochun/songs/870083/,https://streetvoice.com/hochun/,"https://akstatic.streetvoice.com/song_covers/ho/ch/hochun/buvwDzDmG7sjkrjR4xa5Yd.jpeg?x-oss-process=image/resize,m_fixed,h_1,w_1,limit_0/resize,m_fixed,h_630,w_1200,limit_0/watermark,image_c29uZ19jb3ZlcnMvaG8vY2gvaG9jaHVuL2J1dndEekRtRzdzamtyalI0eGE1WWQuanBlZz94LW9zcy1wcm9jZXNzPWltYWdlL3Jlc2l6ZSxtX2ZpeGVkLGhfMzQ0LHdfMzQ0LGxpbWl0XzA,g_nw,x_428,y_143/watermark,image_YXNzZXQvaW1hZ2VzL21ldGFpbWFnZS1zb25nLnBuZw,g_nw,x_0,y_0",@hochun,音樂人,新北市,2013-08-01,,5,3,1,,,https://www.youtube.com/user/StreetVoiceTV,Singer / Songwriter,,,,"有些人離開了，思念卻沒有離開。 這首歌寫的是深夜裡放不下的牽掛，把想念藏進每一次呼吸，默默等待一個不知道會不會回頭的人。願每一個曾經深愛過的人，都能在這首歌裡找到自己的故事。 
有些人離開了，思念卻沒有離開。
這首歌寫的是深夜裡放不下的牽掛，把想念藏進每一次呼吸，默默等待一個不知道會不會回頭的人。願每一個曾經深愛過的人，都能在這首歌裡找到自己的故事。","( verse ) 在沒有你的夜裡 我把想念藏進每次呼吸 卻還是不小心想起你 夜燈熄了城市安靜 我在回憶中沉醉 只剩下一顆心還在等你 （ chorus ) 我還在等你一次真心的回頭 那些沒說完的話還卡在心口 這深夜太長了 我連呼吸都變得不太自由 是不是你也會想起我 ( verse 2 ) 在沒有你的夜裡 我把想念藏進每次呼吸 卻還是不小心想起你 夜燈熄了城市安靜 我在回憶中沉醉 只剩下一顆心還在等你 
( verse ) 在沒有你的夜裡 我把想念藏進每次呼吸 卻還是不小心想起你 夜燈熄了城市安靜 我在回憶中沉醉 只剩下一顆心還在等你
（ chorus ) 我還在等你一次真心的回頭 那些沒說完的話還卡在心口 這深夜太長了 我連呼吸都變得不太自由 是不是你也會想起我
( verse 2 ) 在沒有你的夜裡 我把想念藏進每次呼吸 卻還是不小心想起你 夜燈熄了城市安靜 我在回憶中沉醉 只剩下一顆心還在等你
留言（ 5 ） 最相關留言 所有留言
留言（ 5 ）",2026-07-19,,False,False,
2026-07-21 04:38:31,28,,,7,319,1,https://streetvoice.com/djdidilong/songs/869677/,https://streetvoice.com/djdidilong/,"https://akstatic.streetvoice.com/song_covers/dj/di/djdidilong/VoUBGZvKDRYf35h6WLVTRf.jpeg?x-oss-process=image/resize,m_fixed,h_1,w_1,limit_0/resize,m_fixed,h_630,w_1200,limit_0/watermark,image_c29uZ19jb3ZlcnMvZGovZGkvZGpkaWRpbG9uZy9Wb1VCR1p2S0RSWWYzNWg2V0xWVFJmLmpwZWc_eC1vc3MtcHJvY2Vzcz1pbWFnZS9yZXNpemUsbV9maXhlZCxoXzM0NCx3XzM0NCxsaW1pdF8w,g_nw,x_428,y_143/watermark,image_YXNzZXQvaW1hZ2VzL21ldGFpbWFnZS1zb25nLnBuZw,g_nw,x_0,y_0",@djdidilong,音樂人,,,2025-09-25 13:13,3,236,,https://www.facebook.com/djdidilong,https://www.instagram.com/djdidilong/,https://www.youtube.com/@djdidilong945,Hip hop / Rap,,,,"這首歌是2026實境節目《寰宇龍虎豹》的同名主題曲，看呱吉、迪拉、逞誠這三個中年大叔跨國遠征，音樂當然也要夠狂！由李英宏親自操刀，直接把大叔們的中年浪漫催到最高點。 整首歌開滿了「大無畏的速度感」，那個新潮又帶點壞的獨特台語唱腔一出來，就是不讓你睡，準備好跟著他們一路玩到太瘋！編曲帶點迷幻又超性感的線條，在極致的節奏裡，直接幫這群大叔披上英雄披風，魅力根本不敗！耳機戴上，這劑台味新潮的「新世紀催情劑」絕對幫你傳好勢，馬上就跟著大叔們狂奔一場！ 
這首歌是2026實境節目《寰宇龍虎豹》的同名主題曲，看呱吉、迪拉、逞誠這三個中年大叔跨國遠征，音樂當然也要夠狂！由李英宏親自操刀，直接把大叔們的中年浪漫催到最高點。
整首歌開滿了「大無畏的速度感」，那個新潮又帶點壞的獨特台語唱腔一出來，就是不讓你睡，準備好跟著他們一路玩到太瘋！編曲帶點迷幻又超性感的線條，在極致的節奏裡，直接幫這群大叔披上英雄披風，魅力根本不敗！耳機戴上，這劑台味新潮的「新世紀催情劑」絕對幫你傳好勢，馬上就跟著大叔們狂奔一場！","龍虎豹 帶你來去賴賴趖 叨位嚨會使 跟我們來去𨑨迌 卡等仔咱要去叨 看我Ki Mo Chi 只要爽就好 現在就要來去 別說這麼多 若是歹鬥陣的 咱就免來相找 繼續直直撞 保持咱的氣魄 呵咾我真緣投 那是多講的 飛龍要帶你來去天頂飛 我敬你一杯 但是毋湯馬西 山珍海味 我若到位就要傳到好勢 咱知影禮貌 嚨會說好話 真係好嘢 真係好好味 鬥嘴果 一定好犀利 毋湯太超過 我給你揌落 喂喂 你目睭看路 龍虎豹 沒在烏龍踅桌 從頭到尾 絕對蓋 jōtō 你擱屎屎尿尿 給你關便所 沒有錯沒有錯 把手舉起來給我 Make Some Noise 玩到太瘋 忘了幾點鐘 完全沒有極限 全年都不公休 沒有錯沒有錯 把手舉起來給我 Make Some Noise 最帶種 不偷偷摸摸 龍虎豹 你知影安怎說 龍虎豹 帶你來去賴賴趖 叨位嚨可以 跟我們來去七逃 卡等誒咱要去哪 看我奇摩子 只要爽就好 我說你安呢不夠 耍的沒透 一定攢出好料 絕對沒在開玩笑 龍虎豹 確實真有較小 麥三泡兩泡 拿出你的擋頭 沒有錯沒有錯 把手舉起來給我 Make Some Noise 玩到太瘋 忘了幾點鐘 完全沒有極限 全年都不公休 沒有錯沒有錯 把手舉起來給我 Make Some Noise 最帶種 不偷偷摸摸 龍虎豹 你知影安怎說 龍虎豹 帶你來去賴賴趖 叨位嚨可以 跟我們來去七逃 卡等誒咱要去哪 看我奇摩子 只要爽就好 
龍虎豹 帶你來去賴賴趖 叨位嚨會使 跟我們來去𨑨迌 卡等仔咱要去叨 看我Ki Mo Chi 只要爽就好
現在就要來去 別說這麼多 若是歹鬥陣的 咱就免來相找 繼續直直撞 保持咱的氣魄 呵咾我真緣投 那是多講的
飛龍要帶你來去天頂飛 我敬你一杯 但是毋湯馬西 山珍海味 我若到位就要傳到好勢 咱知影禮貌 嚨會說好話 真係好嘢 真係好好味 鬥嘴果 一定好犀利 毋湯太超過 我給你揌落 喂喂 你目睭看路 龍虎豹 沒在烏龍踅桌 從頭到尾 絕對蓋 jōtō 你擱屎屎尿尿 給你關便所
沒有錯沒有錯 把手舉起來給我 Make Some Noise 玩到太瘋 忘了幾點鐘 完全沒有極限 全年都不公休
沒有錯沒有錯 把手舉起來給我 Make Some Noise 最帶種 不偷偷摸摸 龍虎豹 你知影安怎說
龍虎豹 帶你來去賴賴趖 叨位嚨可以 跟我們來去七逃 卡等誒咱要去哪 看我奇摩子 只要爽就好
我說你安呢不夠 耍的沒透 一定攢出好料 絕對沒在開玩笑 龍虎豹 確實真有較小 麥三泡兩泡 拿出你的擋頭
沒有錯沒有錯 把手舉起來給我 Make Some Noise 玩到太瘋 忘了幾點鐘 完全沒有極限 全年都不公休
沒有錯沒有錯 把手舉起來給我 Make Some Noise 最帶種 不偷偷摸摸 龍虎豹 你知影安怎說
龍虎豹 帶你來去賴賴趖 叨位嚨可以 跟我們來去七逃 卡等誒咱要去哪 看我奇摩子 只要爽就好
留言（ 1 ） 最相關留言 所有留言
留言（ 1 ）",2026-07-16,,True,False,
2026-07-21 04:38:31,29,,,15,902,1,https://streetvoice.com/ALBATROSS/songs/867946/,https://streetvoice.com/ALBATROSS/,"https://akstatic.streetvoice.com/song_covers/AL/BA/ALBATROSS/FFFBFxfG8LvVtZpYBvLFjd.jpeg?x-oss-process=image/resize,m_fixed,h_1,w_1,limit_0/resize,m_fixed,h_630,w_1200,limit_0/watermark,image_c29uZ19jb3ZlcnMvQUwvQkEvQUxCQVRST1NTL0ZGRkJGeGZHOEx2VnRacFlCdkxGamQuanBlZz94LW9zcy1wcm9jZXNzPWltYWdlL3Jlc2l6ZSxtX2ZpeGVkLGhfMzQ0LHdfMzQ0LGxpbWl0XzA,g_nw,x_428,y_143/watermark,image_YXNzZXQvaW1hZ2VzL21ldGFpbWFnZS1zb25nLnBuZw,g_nw,x_0,y_0",@ALBATROSS,音樂人,,,,6,7,,,,https://www.youtube.com/user/StreetVoiceTV,Pop,,,,"ALBATROSS 的〈TOKYO RIVER〉。在都市的河流意象中奔流的一首歌，節奏明快、充滿能量，是我們少數更外放的作品。 適合在移動、散步、或需要一點推力的時刻聆聽。 如果喜歡，歡迎在 Spotify 上「儲存這首歌」： https://open.spotify.com/intl-ja/track/5NAOdhbM918YIMCMJYPhki 
ALBATROSS 的〈TOKYO RIVER〉。在都市的河流意象中奔流的一首歌，節奏明快、充滿能量，是我們少數更外放的作品。
適合在移動、散步、或需要一點推力的時刻聆聽。
如果喜歡，歡迎在 Spotify 上「儲存這首歌」： https://open.spotify.com/intl-ja/track/5NAOdhbM918YIMCMJYPhki
https://open.spotify.com/intl-ja/track/5NAOdhbM918YIMCMJYPhki","ベッドに沈み込んで すでに数時間 禅問答のような 永遠のループ 僕や君や彼のはち切れそうな 煩悩を燃料に東京は今日も 冷めない頭を冷ましに飛び乗る 3周目の首都高 光の海 車窓の流星が 猛スピードで 旋回をくりかえして 巨大なスパイラルで飲み込んでいく 螺旋を描く眠らないライトリバー 雑念も夢も矛盾も光に溶けてく 制御不能の覚醒で向かう行く先はUp or Down? 周り続けてる　東京は今日もこうして この光の河は 無数の想い たどり着く果ての光の海 孤独と喧騒が代わる代わるに 希望と未練を 巨大なスパイラルに飲み込んでいく 螺旋を描く眠らないライトリバー 出口の無い東京の夜に溶けてく 生涯孤独でも立ち向かう 行く先はUp or Down? 周り続ければ 群青の朝がきっと 僕ら魔法に 魅せられ泳いでゆく このディープリバー あれは蜃気楼？ また今夜も夜に溶けていく 螺旋を描く眠らないライトリバー 雑念も夢も矛盾も光に溶けてく 正体不明の確信で向かう行く先はUp or Down? 周り続けてる　東京は今日もこうして 
ベッドに沈み込んで すでに数時間 禅問答のような 永遠のループ
僕や君や彼のはち切れそうな 煩悩を燃料に東京は今日も
冷めない頭を冷ましに飛び乗る 3周目の首都高 光の海
車窓の流星が 猛スピードで 旋回をくりかえして 巨大なスパイラルで飲み込んでいく
螺旋を描く眠らないライトリバー 雑念も夢も矛盾も光に溶けてく 制御不能の覚醒で向かう行く先はUp or Down? 周り続けてる　東京は今日もこうして
この光の河は 無数の想い たどり着く果ての光の海
孤独と喧騒が代わる代わるに 希望と未練を 巨大なスパイラルに飲み込んでいく
螺旋を描く眠らないライトリバー 出口の無い東京の夜に溶けてく 生涯孤独でも立ち向かう 行く先はUp or Down? 周り続ければ 群青の朝がきっと
僕ら魔法に 魅せられ泳いでゆく このディープリバー あれは蜃気楼？ また今夜も夜に溶けていく
螺旋を描く眠らないライトリバー 雑念も夢も矛盾も光に溶けてく 正体不明の確信で向かう行く先はUp or Down? 周り続けてる　東京は今日もこうして
留言（ 1 ） 最相關留言 所有留言
留言（ 1 ）",2026-07-07,,True,True,
2026-07-21 04:38:31,30,,,3,209,0,https://streetvoice.com/jiangdou/songs/870025/,https://streetvoice.com/jiangdou/,"https://akstatic.streetvoice.com/song_covers/ji/an/jiangdou/APDiNGD3P7V6iszggDdBTq.jpeg?x-oss-process=image/resize,m_fixed,h_1,w_1,limit_0/resize,m_fixed,h_630,w_1200,limit_0/watermark,image_c29uZ19jb3ZlcnMvamkvYW4vamlhbmdkb3UvQVBEaU5HRDNQN1Y2aXN6Z2dEZEJUcS5qcGVnP3gtb3NzLXByb2Nlc3M9aW1hZ2UvcmVzaXplLG1fZml4ZWQsaF8zNDQsd18zNDQsbGltaXRfMA,g_nw,x_428,y_143/watermark,image_YXNzZXQvaW1hZ2VzL21ldGFpbWFnZS1zb25nLnBuZw,g_nw,x_0,y_0",@jiangdou,音樂人,台北市,2008-11-01,2023-04-06 12:35,13,206,4,https://www.facebook.com/jondoe.tw,https://www.instagram.com/jondoemusictw,https://www.youtube.com/@jondoemusictw,Singer / Songwriter,,,,"無 
無","無 (在進化中) 
無 (在進化中)
留言（ 0 ） 最相關留言 所有留言
留言（ 0 ）",2026-07-18,,True,False,
2026-07-21 04:38:31,31,,,4,227,2,https://streetvoice.com/Double_Decker_Couch/songs/830133/,https://streetvoice.com/Double_Decker_Couch/,"https://akstatic.streetvoice.com/music_albums/Do/ub/Double_Decker_Couch/cetZPYbrh2Kk3CCzMmAnx5.jpeg?x-oss-process=image/resize,m_fixed,h_1,w_1,limit_0/resize,m_fixed,h_630,w_1200,limit_0/watermark,image_bXVzaWNfYWxidW1zL0RvL3ViL0RvdWJsZV9EZWNrZXJfQ291Y2gvY2V0WlBZYnJoMktrM0NDek1tQW54NS5qcGVnP3gtb3NzLXByb2Nlc3M9aW1hZ2UvcmVzaXplLG1fZml4ZWQsaF8zNDQsd18zNDQsbGltaXRfMA,g_nw,x_428,y_143/watermark,image_YXNzZXQvaW1hZ2VzL21ldGFpbWFnZS1zb25nLnBuZw,g_nw,x_0,y_0",@Double_Decker_Couch,音樂人,,,,5,25,4,,,https://www.youtube.com/user/StreetVoiceTV,Rock,Insulator,https://streetvoice.com/Double_Decker_Couch/songs/album/97325718/,,"壞事總在發生，沮喪也化作日常。 我死命勾勒著情感的形狀， 但界線並不會永遠維持其輪廓。 它是不穩定，是不說清；它堅韌，卻也保留彈性。 眼淚模糊了雙眸，浸潤視線裡的光澤。 這一次我放手任其渲染，但那將都是我。 
壞事總在發生，沮喪也化作日常。 我死命勾勒著情感的形狀， 但界線並不會永遠維持其輪廓。 它是不穩定，是不說清；它堅韌，卻也保留彈性。 眼淚模糊了雙眸，浸潤視線裡的光澤。 這一次我放手任其渲染，但那將都是我。","I feel I’m in the love woven from endless lies But it keep linger Your whisper If I’m high? Walking alone on the road Scared of seeing my phone Struggle with this thing is such a bore Who can let me go Now it’s three in the dawn No one want to hear my call How I break my empty soul Let it all blur Just can forget where you are Countless hours Will become to the star Nothing occur No need to tear the scars Let it all blur Keep it all blurred 
I feel I’m in the love woven from endless lies But it keep linger Your whisper If I’m high?
Walking alone on the road Scared of seeing my phone Struggle with this thing is such a bore Who can let me go
Now it’s three in the dawn No one want to hear my call How I break my empty soul
Let it all blur Just can forget where you are Countless hours Will become to the star Nothing occur No need to tear the scars Let it all blur Keep it all blurred
留言（ 2 ） 最相關留言 所有留言
留言（ 2 ）",2026-07-18,,True,False,
