snapshot_time,rank,artist_name,song_title,likes_count,play_count,comments_count,song_url,artist_url,cover_image_url,artist_handle,artist_identity,artist_city,artist_joined_date,artist_accredited_datetime,artist_music_count,artist_fans_count,artist_following_count,artist_facebook_url,artist_instagram_url,artist_youtube_url,genre,album_title,album_url,collaborators,description,lyrics,release_date,song_accredited_datetime,is_editor_recommended,is_song_of_the_day,critic_review_url
2026-07-14 05:09:44,1,,,8,323,4,https://streetvoice.com/Jayanbinzz/songs/867960/,https://streetvoice.com/Jayanbinzz/,"https://akstatic.streetvoice.com/song_covers/Ja/ya/Jayanbinzz/i8yaxcVyVabECmhUkL7Foj.jpeg?x-oss-process=image/resize,m_fixed,h_1,w_1,limit_0/resize,m_fixed,h_630,w_1200,limit_0/watermark,image_c29uZ19jb3ZlcnMvSmEveWEvSmF5YW5iaW56ei9pOHlheGNWeVZhYkVDbWhVa0w3Rm9qLmpwZWc_eC1vc3MtcHJvY2Vzcz1pbWFnZS9yZXNpemUsbV9maXhlZCxoXzM0NCx3XzM0NCxsaW1pdF8w,g_nw,x_428,y_143/watermark,image_YXNzZXQvaW1hZ2VzL21ldGFpbWFnZS1zb25nLnBuZw,g_nw,x_0,y_0",@Jayanbinzz,音樂人,,,,2,8,5,,,https://www.youtube.com/user/StreetVoiceTV,Jazz,,https://streetvoice.com/,,"爵士小提琴手黃彥斌將漫畫《藍色巨星》所帶給他的感受，用屬於自己的方式呈現出來，收錄於專輯《給波蘭的一封信》。 小提琴/ 作曲 / 黃彥斌 鋼琴 Adam Lemańczyk 貝斯 Piotr Olszewski 鼓 Mateusz Krawczyk 
爵士小提琴手黃彥斌將漫畫《藍色巨星》所帶給他的感受，用屬於自己的方式呈現出來，收錄於專輯《給波蘭的一封信》。
小提琴/ 作曲 / 黃彥斌 鋼琴 Adam Lemańczyk 貝斯 Piotr Olszewski 鼓 Mateusz Krawczyk","這是沒有提供歌詞的歌曲
留言（ 4 ） 最相關留言 所有留言
留言（ 4 ）",2026-07-07,,True,True,
2026-07-14 05:09:44,2,,,64,2971,11,https://streetvoice.com/alanchou12345/songs/867797/,https://streetvoice.com/alanchou12345/,"https://akstatic.streetvoice.com/song_covers/al/an/alanchou12345/Y4nZTaRGQvJAdXdvTGKcmr.jpeg?x-oss-process=image/resize,m_fixed,h_1,w_1,limit_0/resize,m_fixed,h_630,w_1200,limit_0/watermark,image_c29uZ19jb3ZlcnMvYWwvYW4vYWxhbmNob3UxMjM0NS9ZNG5aVGFSR1F2SkFkWGR2VEdLY21yLmpwZWc_eC1vc3MtcHJvY2Vzcz1pbWFnZS9yZXNpemUsbV9maXhlZCxoXzM0NCx3XzM0NCxsaW1pdF8w,g_nw,x_428,y_143/watermark,image_YXNzZXQvaW1hZ2VzL21ldGFpbWFnZS1zb25nLnBuZw,g_nw,x_0,y_0",@alanchou12345,音樂人,新北市,2019-03-01,2023-01-30 10:32,12,3661,,https://www.facebook.com/profile.php?id=100063938225158,https://www.instagram.com/ac___47/,https://www.youtube.com/@ac47yt,R&B / Soul,,,,"有沒有一種愛， 讓你願意跨越所有距離與考驗？ 「就算這世界對我針鋒相對，風再大、天再黑，我也不撤退。」 獻給每一個在深夜裡依然相信愛的所有存在， 〈漫漫長夜〉，蔓延日夜。 
有沒有一種愛， 讓你願意跨越所有距離與考驗？
「就算這世界對我針鋒相對，風再大、天再黑，我也不撤退。」
獻給每一個在深夜裡依然相信愛的所有存在，
〈漫漫長夜〉，蔓延日夜。","時間停止瞬間 別說話讓我收藏有關於你的一切 思緒像微風 在你身邊盤旋 不需言語我了解 總在夜深人靜 腦袋不自覺浮現你最美的笑臉 牽起我的手 趁夜沒發現 再讓我更靠近你一些些 在這漫漫長夜 讓我守護你身邊 day by day 把所有想像都實現 閉上你雙眼 你的愛我來擁有 漫漫長夜 讓我照亮你 每一天每一夜 我會在身邊 不要再懷疑 不要再後退 我只為你眷戀 就算這世界 對我針鋒相對 風再大 天再黑 我也不撤退 沒有誰能改變 我的心 讓愛蔓延在漫漫長夜 總在夜深人靜 腦袋不自覺浮現你最美的笑臉 牽起我的手 趁夜沒發現 再讓我更靠近你一些些 (靠近一些些) 在這漫漫長夜 讓我守護你身邊 day by day 把所有想像都實現 閉上你雙眼 (Oh babe) 你的愛我來擁有 漫漫長夜 讓我照亮你 每一天每一夜 我會在身邊 不要再懷疑 不要再後退 我只為你眷戀 就算這世界 對我針鋒相對 風再大 天再黑 我也不撤退 沒有誰能改變 我的心 讓愛蔓延在漫漫長夜 漫漫長夜 day by day 漫漫長夜 day by day 讓愛在漫漫長夜 
時間停止瞬間 別說話讓我收藏有關於你的一切 思緒像微風 在你身邊盤旋 不需言語我了解
總在夜深人靜 腦袋不自覺浮現你最美的笑臉 牽起我的手 趁夜沒發現 再讓我更靠近你一些些
在這漫漫長夜 讓我守護你身邊 day by day 把所有想像都實現 閉上你雙眼 你的愛我來擁有
漫漫長夜 讓我照亮你 每一天每一夜 我會在身邊 不要再懷疑 不要再後退 我只為你眷戀
就算這世界 對我針鋒相對 風再大 天再黑 我也不撤退 沒有誰能改變 我的心 讓愛蔓延在漫漫長夜
總在夜深人靜 腦袋不自覺浮現你最美的笑臉 牽起我的手 趁夜沒發現 再讓我更靠近你一些些 (靠近一些些)
在這漫漫長夜 讓我守護你身邊 day by day 把所有想像都實現 閉上你雙眼 (Oh babe) 你的愛我來擁有
漫漫長夜 讓我照亮你 每一天每一夜 我會在身邊 不要再懷疑 不要再後退 我只為你眷戀
就算這世界 對我針鋒相對 風再大 天再黑 我也不撤退 沒有誰能改變 我的心 讓愛蔓延在漫漫長夜
漫漫長夜 day by day 漫漫長夜 day by day 讓愛在漫漫長夜
留言（ 11 ） 最相關留言 所有留言
留言（ 11 ）",2026-07-06,,True,False,https://streetvoice.com/alanchou12345/songs/867797/critic_reviews/
2026-07-14 05:09:44,3,,,22,1422,4,https://streetvoice.com/Bella0110/songs/868215/,https://streetvoice.com/Bella0110/,"https://akstatic.streetvoice.com/song_covers/Be/ll/Bella0110/9pLjAQsB8JgKUARWtG26qZ.jpeg?x-oss-process=image/resize,m_fixed,h_1,w_1,limit_0/resize,m_fixed,h_630,w_1200,limit_0/watermark,image_c29uZ19jb3ZlcnMvQmUvbGwvQmVsbGEwMTEwLzlwTGpBUXNCOEpnS1VBUld0RzI2cVouanBlZz94LW9zcy1wcm9jZXNzPWltYWdlL3Jlc2l6ZSxtX2ZpeGVkLGhfMzQ0LHdfMzQ0LGxpbWl0XzA,g_nw,x_428,y_143/watermark,image_YXNzZXQvaW1hZ2VzL21ldGFpbWFnZS1zb25nLnBuZw,g_nw,x_0,y_0",@Bella0110,音樂人,,,,2,33,6,,,https://www.youtube.com/user/StreetVoiceTV,Alternative,,,,"不可知的未來是一張網，用心思和精神細細編織，若是時間剛好，那屬於你的便會停留在網上成為繼續存活的養分，如果不是，那便會破壞這張網，甚至得要重來一遍，而最幸福的人終究會是享受一無所有的人。 
不可知的未來是一張網，用心思和精神細細編織，若是時間剛好，那屬於你的便會停留在網上成為繼續存活的養分，如果不是，那便會破壞這張網，甚至得要重來一遍，而最幸福的人終究會是享受一無所有的人。","We’re having too good a time today. We ain’t thinking about tomorrow. We can beat & beat till death Dancing on the dance floor like Mary Lou We don't really  know what happens next (having no purpose driving on the highway) Don't try to save me this is the way I see (on the road we beat and beat and beat till death) Spider is weaving a big web Wish and prepare  for the big time to become the dinner everything belongs to me because I'm poor 詞 / 曲： 李沐霏 主唱： 李沐霏 鍵盤 / 合成器： 東東 Sid 吉他： 曾程威 Eddie 貝斯： Roy 鼓手： 毛恩 
We’re having too good a time today. We ain’t thinking about tomorrow. We can beat & beat till death Dancing on the dance floor like Mary Lou
We don't really  know what happens next (having no purpose driving on the highway) Don't try to save me this is the way I see (on the road we beat and beat and beat till death) Spider is weaving a big web Wish and prepare  for the big time to become the dinner
everything belongs to me because I'm poor
詞 / 曲： 李沐霏 主唱： 李沐霏 鍵盤 / 合成器： 東東 Sid 吉他： 曾程威 Eddie 貝斯： Roy 鼓手： 毛恩
留言（ 4 ） 最相關留言 所有留言
留言（ 4 ）",2026-07-08,,True,False,https://streetvoice.com/Bella0110/songs/868215/critic_reviews/
2026-07-14 05:09:44,4,,,10,876,3,https://streetvoice.com/echo/songs/867916/,https://streetvoice.com/echo/,"https://akstatic.streetvoice.com/song_covers/ec/ho/echo/5x8526KFGgMHkL5XLA3wUo.jpeg?x-oss-process=image/resize,m_fixed,h_1,w_1,limit_0/resize,m_fixed,h_630,w_1200,limit_0/watermark,image_c29uZ19jb3ZlcnMvZWMvaG8vZWNoby81eDg1MjZLRkdnTUhrTDVYTEEzd1VvLmpwZWc_eC1vc3MtcHJvY2Vzcz1pbWFnZS9yZXNpemUsbV9maXhlZCxoXzM0NCx3XzM0NCxsaW1pdF8w,g_nw,x_428,y_143/watermark,image_YXNzZXQvaW1hZ2VzL21ldGFpbWFnZS1zb25nLnBuZw,g_nw,x_0,y_0",@echo,音樂人,台北市,2006-01-01,,19,1650,,,,https://www.youtube.com/user/StreetVoiceTV,Rock,,,,"因為我如此愛你，穿越光年也要見你一面 回聲樂團 Echo of Your Soul 新專輯《靈魂的回聲》已數位發行 08.29 台北Legacy 專輯首唱 
因為我如此愛你，穿越光年也要見你一面
回聲樂團 Echo of Your Soul 新專輯《靈魂的回聲》已數位發行
08.29 台北Legacy 專輯首唱","動態歌詞
你是一個夜晚 等待星空的盛開 在光與暗的糾纏 懸然未決的片段 就讓我成為你一瞬間的斑斕 在這宇宙長流短促相逢的塵埃 Because I love you so And I think you know Because I love you so Let me be your glow Because I love you so With every rhythm I’m gonna let it flow Until the end of time Because I love you so 也許相遇過後只剩無常的詠嘆 但若你記得我 我就會存在 Because I love you so And I think you know Because I love you so Let me be your glow Because I love you so With every rhythm I’m gonna let it flow Until the end of time Because I love you so 
你是一個夜晚 等待星空的盛開 在光與暗的糾纏 懸然未決的片段 就讓我成為你一瞬間的斑斕 在這宇宙長流短促相逢的塵埃 Because I love you so And I think you know Because I love you so Let me be your glow Because I love you so With every rhythm I’m gonna let it flow Until the end of time Because I love you so 也許相遇過後只剩無常的詠嘆 但若你記得我 我就會存在 Because I love you so And I think you know Because I love you so Let me be your glow Because I love you so With every rhythm I’m gonna let it flow Until the end of time Because I love you so
留言（ 3 ） 最相關留言 所有留言
留言（ 3 ）",2026-07-06,,True,True,
2026-07-14 05:09:44,5,,,9,288,1,https://streetvoice.com/ALBATROSS/songs/867946/,https://streetvoice.com/ALBATROSS/,"https://akstatic.streetvoice.com/song_covers/AL/BA/ALBATROSS/FFFBFxfG8LvVtZpYBvLFjd.jpeg?x-oss-process=image/resize,m_fixed,h_1,w_1,limit_0/resize,m_fixed,h_630,w_1200,limit_0/watermark,image_c29uZ19jb3ZlcnMvQUwvQkEvQUxCQVRST1NTL0ZGRkJGeGZHOEx2VnRacFlCdkxGamQuanBlZz94LW9zcy1wcm9jZXNzPWltYWdlL3Jlc2l6ZSxtX2ZpeGVkLGhfMzQ0LHdfMzQ0LGxpbWl0XzA,g_nw,x_428,y_143/watermark,image_YXNzZXQvaW1hZ2VzL21ldGFpbWFnZS1zb25nLnBuZw,g_nw,x_0,y_0",@ALBATROSS,音樂人,,,,6,5,,,,https://www.youtube.com/user/StreetVoiceTV,Pop,,,,"ALBATROSS 的〈TOKYO RIVER〉。在都市的河流意象中奔流的一首歌，節奏明快、充滿能量，是我們少數更外放的作品。 適合在移動、散步、或需要一點推力的時刻聆聽。 如果喜歡，歡迎在 Spotify 上「儲存這首歌」： https://open.spotify.com/intl-ja/track/5NAOdhbM918YIMCMJYPhki 
ALBATROSS 的〈TOKYO RIVER〉。在都市的河流意象中奔流的一首歌，節奏明快、充滿能量，是我們少數更外放的作品。
適合在移動、散步、或需要一點推力的時刻聆聽。
如果喜歡，歡迎在 Spotify 上「儲存這首歌」： https://open.spotify.com/intl-ja/track/5NAOdhbM918YIMCMJYPhki
https://open.spotify.com/intl-ja/track/5NAOdhbM918YIMCMJYPhki","ベッドに沈み込んで すでに数時間 禅問答のような 永遠のループ 僕や君や彼のはち切れそうな 煩悩を燃料に東京は今日も 冷めない頭を冷ましに飛び乗る 3周目の首都高 光の海 車窓の流星が 猛スピードで 旋回をくりかえして 巨大なスパイラルで飲み込んでいく 螺旋を描く眠らないライトリバー 雑念も夢も矛盾も光に溶けてく 制御不能の覚醒で向かう行く先はUp or Down? 周り続けてる　東京は今日もこうして この光の河は 無数の想い たどり着く果ての光の海 孤独と喧騒が代わる代わるに 希望と未練を 巨大なスパイラルに飲み込んでいく 螺旋を描く眠らないライトリバー 出口の無い東京の夜に溶けてく 生涯孤独でも立ち向かう 行く先はUp or Down? 周り続ければ 群青の朝がきっと 僕ら魔法に 魅せられ泳いでゆく このディープリバー あれは蜃気楼？ また今夜も夜に溶けていく 螺旋を描く眠らないライトリバー 雑念も夢も矛盾も光に溶けてく 正体不明の確信で向かう行く先はUp or Down? 周り続けてる　東京は今日もこうして 
ベッドに沈み込んで すでに数時間 禅問答のような 永遠のループ
僕や君や彼のはち切れそうな 煩悩を燃料に東京は今日も
冷めない頭を冷ましに飛び乗る 3周目の首都高 光の海
車窓の流星が 猛スピードで 旋回をくりかえして 巨大なスパイラルで飲み込んでいく
螺旋を描く眠らないライトリバー 雑念も夢も矛盾も光に溶けてく 制御不能の覚醒で向かう行く先はUp or Down? 周り続けてる　東京は今日もこうして
この光の河は 無数の想い たどり着く果ての光の海
孤独と喧騒が代わる代わるに 希望と未練を 巨大なスパイラルに飲み込んでいく
螺旋を描く眠らないライトリバー 出口の無い東京の夜に溶けてく 生涯孤独でも立ち向かう 行く先はUp or Down? 周り続ければ 群青の朝がきっと
僕ら魔法に 魅せられ泳いでゆく このディープリバー あれは蜃気楼？ また今夜も夜に溶けていく
螺旋を描く眠らないライトリバー 雑念も夢も矛盾も光に溶けてく 正体不明の確信で向かう行く先はUp or Down? 周り続けてる　東京は今日もこうして
留言（ 1 ） 最相關留言 所有留言
留言（ 1 ）",2026-07-07,,True,True,
2026-07-14 05:09:44,6,,,21,1739,1,https://streetvoice.com/moocusmoo/songs/867439/,https://streetvoice.com/moocusmoo/,"https://akstatic.streetvoice.com/song_covers/mo/oc/moocusmoo/YqudFDUN4rdDS5km2wYUX4.jpeg?x-oss-process=image/resize,m_fixed,h_1,w_1,limit_0/resize,m_fixed,h_630,w_1200,limit_0/watermark,image_c29uZ19jb3ZlcnMvbW8vb2MvbW9vY3VzbW9vL1lxdWRGRFVONHJkRFM1a20yd1lVWDQuanBlZz94LW9zcy1wcm9jZXNzPWltYWdlL3Jlc2l6ZSxtX2ZpeGVkLGhfMzQ0LHdfMzQ0LGxpbWl0XzA,g_nw,x_428,y_143/watermark,image_YXNzZXQvaW1hZ2VzL21ldGFpbWFnZS1zb25nLnBuZw,g_nw,x_0,y_0",@moocusmoo,音樂人,,,,15,1639,,,,https://www.youtube.com/user/StreetVoiceTV,Hip hop / Rap,,,,,"Look at my style look at my flow Look at my style look at my flow （getting jiggy with it) Look at my style look at my flow (Getting jiggy with it) Look at my style look at my flow (Getting jiggy with it) Look at my style look at my flow (Getting jiggy with it) Look at my style look at my flow 呼 群飛的雲雀跟陽光有默契 我感覺something’s going down 就在今天 站在戰爭的前線 with my mandem we kicking It 看幻燈片上渡輪的頭等艙 首先我的法式卷 真太帥了我道歉 帶了沙漏沒幹嘛就在砂石間 和波小姐 從夕陽一路混到破曉前 在老街前面找廁所準備尬紙片 Smoking that g wood feeling gwood 沒花多久 發現何時會講話的鵜鶘有這麼多 哲學變成幻象讓我迷糊有這麼鬆 看向天空感恩隨著惜福祂這麼說 你身在這世界的角色是什麼 我是個雜技還是個體貼的表演者 那你為何會害怕被他們誤會 我帶著危險的想法並非個討厭鬼 你又具備著什麼樣的天賦 我專搞借鑑 是相似之處的連貫者 孩子一切你感受的distasteful 是為了有天能夠集結我們 One mind！ 如果你想搞清楚什麼線索 這有個人你需要見 他會把每個字句說得true 嗯哼 入夜八里的惡少棍 yeah Man I’m chilling cause I got a plan 我在鑽研我的 taste 我永遠不會失去我的酷 嗯哼 入夜八里的惡少棍 yeah 差點忘了提到我的姑娘 她停不下她眼淚吶喊著受不了 把鞋子丟了走進海裡我說cool down 雙人協力車先靠邊停接著 撿墨鏡 包包 口紅 相機 戴在身上 各種表演型人格 我小眼睛真的已經有一百趴 睜大示意妳先別朝臉親 韓國遊客說 什麼 狀況很芭樂 應該說朝鮮薊 找洗手間的兄弟經過 我說沒事 好心的帥哥留下兩罐舒跑 接著踏著陽光腳步揮手離開 接下來沒有計劃 但我喜歡 送波小姐搭船回碼頭 聽著porcelain 栽進阿育吠陀裡 宇宙問我在世界的角色是什麼 我是個雜技還是個體貼的表演者 那你為何會害怕被他們誤會 我帶著危險的想法並非個討厭鬼 你又具備著什麼樣的天賦 我專搞借鑑 是相似之處的連貫者 孩子一切你感受的distasteful 是為了有天能夠集結我們 One mind 如果你想搞清楚什麼線索 這有個人你需要見 他會把每個字句說得true 嗯哼 入夜八里的惡少棍 yeah Man I’m chilling cause I got a plan 我在鑽研我的 taste 我永遠不會失去我的酷 嗯哼 入夜八里的惡少棍 yeah 你想跟我跳舞ok沒問題 我請保護我的聖靈高歌怪物的歌曲 他們相信我能善用好運氣愛護著社區 騎腳踏車代步試著live my life full of purpse 在每個缺結論的論文上改章 同意我絕對不是聖人但真的跟聖人長太像 面惡心善內涵光與水的仙人掌帶刺 是副作用當我體會每個勝者到敗將 今天是結果 前面的過程 thats that 你跟我跳舞別照著我腳步徘徊 因為你沒經過我思考怎麼會疑惑 很高興我是你的知音當其他人沒聽過 我收割 再豐收 並呈現 我陪做戲 從留下的地方撿起遺傳家人的追尋 就算認定了跟這世界一輩子沒默契 但我不感到偽善當我玩他們的規矩 那是純粹非凡人類的大智慧 告訴你把精神放最珍貴很踏實的 叫醒我你得不只大個分貝來嘗試 誰叫桀驁不馴所帶來的沈醉太花時間 如果你想搞清楚什麼線索 這有個人你需要見 他會把每個字句說得true 嗯哼 入夜八里的惡少棍 yeah Man I’m chilling cause I got a plan 我在鑽研我的 taste 我永遠不會失去我的酷 嗯哼 入夜八里的惡少棍 yeah 
Look at my style look at my flow Look at my style look at my flow （getting jiggy with it) Look at my style look at my flow (Getting jiggy with it) Look at my style look at my flow (Getting jiggy with it) Look at my style look at my flow (Getting jiggy with it) Look at my style look at my flow 呼
群飛的雲雀跟陽光有默契 我感覺something’s going down 就在今天 站在戰爭的前線 with my mandem we kicking It 看幻燈片上渡輪的頭等艙 首先我的法式卷 真太帥了我道歉 帶了沙漏沒幹嘛就在砂石間 和波小姐 從夕陽一路混到破曉前 在老街前面找廁所準備尬紙片 Smoking that g wood feeling gwood 沒花多久 發現何時會講話的鵜鶘有這麼多 哲學變成幻象讓我迷糊有這麼鬆 看向天空感恩隨著惜福祂這麼說
你身在這世界的角色是什麼 我是個雜技還是個體貼的表演者 那你為何會害怕被他們誤會 我帶著危險的想法並非個討厭鬼 你又具備著什麼樣的天賦 我專搞借鑑 是相似之處的連貫者 孩子一切你感受的distasteful 是為了有天能夠集結我們 One mind！
如果你想搞清楚什麼線索 這有個人你需要見 他會把每個字句說得true 嗯哼 入夜八里的惡少棍 yeah
Man I’m chilling cause I got a plan 我在鑽研我的 taste 我永遠不會失去我的酷 嗯哼 入夜八里的惡少棍 yeah
差點忘了提到我的姑娘 她停不下她眼淚吶喊著受不了 把鞋子丟了走進海裡我說cool down 雙人協力車先靠邊停接著 撿墨鏡 包包 口紅 相機 戴在身上 各種表演型人格 我小眼睛真的已經有一百趴 睜大示意妳先別朝臉親 韓國遊客說 什麼 狀況很芭樂 應該說朝鮮薊 找洗手間的兄弟經過 我說沒事 好心的帥哥留下兩罐舒跑 接著踏著陽光腳步揮手離開
接下來沒有計劃 但我喜歡 送波小姐搭船回碼頭 聽著porcelain 栽進阿育吠陀裡
宇宙問我在世界的角色是什麼 我是個雜技還是個體貼的表演者 那你為何會害怕被他們誤會 我帶著危險的想法並非個討厭鬼 你又具備著什麼樣的天賦 我專搞借鑑 是相似之處的連貫者 孩子一切你感受的distasteful 是為了有天能夠集結我們 One mind
如果你想搞清楚什麼線索 這有個人你需要見 他會把每個字句說得true 嗯哼 入夜八里的惡少棍 yeah
Man I’m chilling cause I got a plan 我在鑽研我的 taste 我永遠不會失去我的酷 嗯哼 入夜八里的惡少棍 yeah
你想跟我跳舞ok沒問題 我請保護我的聖靈高歌怪物的歌曲 他們相信我能善用好運氣愛護著社區 騎腳踏車代步試著live my life full of purpse 在每個缺結論的論文上改章 同意我絕對不是聖人但真的跟聖人長太像 面惡心善內涵光與水的仙人掌帶刺 是副作用當我體會每個勝者到敗將 今天是結果 前面的過程 thats that 你跟我跳舞別照著我腳步徘徊 因為你沒經過我思考怎麼會疑惑 很高興我是你的知音當其他人沒聽過 我收割 再豐收 並呈現 我陪做戲 從留下的地方撿起遺傳家人的追尋 就算認定了跟這世界一輩子沒默契 但我不感到偽善當我玩他們的規矩 那是純粹非凡人類的大智慧 告訴你把精神放最珍貴很踏實的 叫醒我你得不只大個分貝來嘗試 誰叫桀驁不馴所帶來的沈醉太花時間
如果你想搞清楚什麼線索 這有個人你需要見 他會把每個字句說得true 嗯哼 入夜八里的惡少棍 yeah
Man I’m chilling cause I got a plan 我在鑽研我的 taste 我永遠不會失去我的酷 嗯哼 入夜八里的惡少棍 yeah
留言（ 1 ） 最相關留言 所有留言
留言（ 1 ）",2026-07-03,,True,True,
