snapshot_time,rank,artist_name,song_title,likes_count,play_count,comments_count,song_url,artist_url,cover_image_url,artist_handle,artist_identity,artist_city,artist_joined_date,artist_accredited_datetime,artist_music_count,artist_fans_count,artist_following_count,artist_facebook_url,artist_instagram_url,artist_youtube_url,genre,album_title,album_url,collaborators,description,lyrics,release_date,song_accredited_datetime,is_editor_recommended,is_song_of_the_day,critic_review_url
2026-07-21 04:38:31,1,,,67,5327,18,https://streetvoice.com/MatthewLiu/songs/870091/,https://streetvoice.com/MatthewLiu/,"https://akstatic.streetvoice.com/song_covers/Ma/tt/MatthewLiu/aSmrrtfn73LUrSFMK2eNVc.jpeg?x-oss-process=image/resize,m_fixed,h_1,w_1,limit_0/resize,m_fixed,h_630,w_1200,limit_0/watermark,image_c29uZ19jb3ZlcnMvTWEvdHQvTWF0dGhld0xpdS9hU21ycnRmbjczTFVyU0ZNSzJlTlZjLmpwZWc_eC1vc3MtcHJvY2Vzcz1pbWFnZS9yZXNpemUsbV9maXhlZCxoXzM0NCx3XzM0NCxsaW1pdF8w,g_nw,x_428,y_143/watermark,image_YXNzZXQvaW1hZ2VzL21ldGFpbWFnZS1zb25nLnBuZw,g_nw,x_0,y_0",@MatthewLiu,音樂人,,,,1,83,,,,https://www.youtube.com/user/StreetVoiceTV,Pop,,,,"這是一首有關三體的歌曲，正式版將收錄於今年即將發行的歌人專輯《朋友、戀人與最糟糕的事》 
這是一首有關三體的歌曲，正式版將收錄於今年即將發行的歌人專輯《朋友、戀人與最糟糕的事》","雲天明 我願意做一顆星球 藏在你無邊的宇宙 在你不捨之前我會先離開 童年時不曾真的有童話 離別時也不曾真的害怕 你如晨星總是明亮 我是銀河之外的悲傷 遙遠地 容不下一句話 我願意做一顆星球 藏在你無邊的宇宙 在你不捨之前我會先離開 沈默如流星般劃過 仰望著恆星的永久 在時間的盡頭 我會等待 沈默如流星般劃過 仰望著恆星的永久 在時間的盡頭 我會等待 等待你醒過來 這次我 會勇敢 說出來 - 詞曲編曲錄音混音演唱：我 
雲天明
我願意做一顆星球 藏在你無邊的宇宙 在你不捨之前我會先離開
童年時不曾真的有童話 離別時也不曾真的害怕 你如晨星總是明亮 我是銀河之外的悲傷 遙遠地 容不下一句話
我願意做一顆星球 藏在你無邊的宇宙 在你不捨之前我會先離開
沈默如流星般劃過 仰望著恆星的永久 在時間的盡頭 我會等待
沈默如流星般劃過 仰望著恆星的永久 在時間的盡頭 我會等待
等待你醒過來 這次我 會勇敢 說出來
-
詞曲編曲錄音混音演唱：我
留言（ 18 ） 最相關留言 所有留言
留言（ 18 ）",2026-07-19,,True,False,
2026-07-21 04:38:31,2,,,46,2369,15,https://streetvoice.com/MatthewLiu/songs/870099/,https://streetvoice.com/MatthewLiu/,"https://akstatic.streetvoice.com/song_covers/Ma/tt/MatthewLiu/ffF2m9xA4aeErySjPCqDcz.jpeg?x-oss-process=image/resize,m_fixed,h_1,w_1,limit_0/resize,m_fixed,h_630,w_1200,limit_0/watermark,image_c29uZ19jb3ZlcnMvTWEvdHQvTWF0dGhld0xpdS9mZkYybTl4QTRhZUVyeVNqUENxRGN6LmpwZWc_eC1vc3MtcHJvY2Vzcz1pbWFnZS9yZXNpemUsbV9maXhlZCxoXzM0NCx3XzM0NCxsaW1pdF8w,g_nw,x_428,y_143/watermark,image_YXNzZXQvaW1hZ2VzL21ldGFpbWFnZS1zb25nLnBuZw,g_nw,x_0,y_0",@MatthewLiu,音樂人,,,,1,63,,,,https://www.youtube.com/user/StreetVoiceTV,Pop,,,,"成立美秀之前與李威、狗柏一起表演過的創作 
成立美秀之前與李威、狗柏一起表演過的創作","深夜的胡思亂想 一個人 走出門 在深夜散步沈澱想法 談不上悲傷但也不快樂 像快要下雨的清晨 已經走 多遠了 想找尋避風港的小船 那些愛的恨的猜不透的 逝去了找不到解答 陪寂寞呼吸著回憶的殘響 纏繞在胸口情緒緊繃迴盪 只是深夜的胡思亂想 沒有你的世界好孤單 沒有你的世界好孤單 沒有你的世界好孤單 簡簡單單 就再次癲狂 眼淚落下帶不走我的崩塌 也許世界已經無法承載我 也許我無法承載悲傷 陪寂寞呼吸著回憶的殘響 纏繞在胸口情緒緊繃迴盪 只是深夜的胡思亂想 沒有你的世界好孤單 沒有你的世界好孤單 沒有你的世界 
深夜的胡思亂想
一個人 走出門 在深夜散步沈澱想法 談不上悲傷但也不快樂 像快要下雨的清晨
已經走 多遠了 想找尋避風港的小船 那些愛的恨的猜不透的 逝去了找不到解答
陪寂寞呼吸著回憶的殘響 纏繞在胸口情緒緊繃迴盪 只是深夜的胡思亂想 沒有你的世界好孤單 沒有你的世界好孤單 沒有你的世界好孤單
簡簡單單 就再次癲狂 眼淚落下帶不走我的崩塌 也許世界已經無法承載我 也許我無法承載悲傷
陪寂寞呼吸著回憶的殘響 纏繞在胸口情緒緊繃迴盪 只是深夜的胡思亂想 沒有你的世界好孤單 沒有你的世界好孤單 沒有你的世界
留言（ 15 ） 最相關留言 所有留言
留言（ 15 ）",2026-07-19,,True,False,
2026-07-21 04:38:31,3,,,28,1633,8,https://streetvoice.com/MatthewLiu/songs/870097/,https://streetvoice.com/MatthewLiu/,"https://akstatic.streetvoice.com/song_covers/Ma/tt/MatthewLiu/b3YA3xfSEr3znsCifWGURc.jpeg?x-oss-process=image/resize,m_fixed,h_1,w_1,limit_0/resize,m_fixed,h_630,w_1200,limit_0/watermark,image_c29uZ19jb3ZlcnMvTWEvdHQvTWF0dGhld0xpdS9iM1lBM3hmU0VyM3puc0NpZldHVVJjLmpwZWc_eC1vc3MtcHJvY2Vzcz1pbWFnZS9yZXNpemUsbV9maXhlZCxoXzM0NCx3XzM0NCxsaW1pdF8w,g_nw,x_428,y_143/watermark,image_YXNzZXQvaW1hZ2VzL21ldGFpbWFnZS1zb25nLnBuZw,g_nw,x_0,y_0",@MatthewLiu,音樂人,,,,2,286,,,,https://www.youtube.com/user/StreetVoiceTV,Punk,,,,"日式流行龐克 
日式流行龐克","環狀線 坐在環狀線上的女孩 多想能一眼把你看穿 每個星期五的傍晚總有一個剎那 能看見你的笑 指尖殘留著油畫的顏料 藝大的簡章 跟身心科的藥 收斂起我太過直接的目光 我只是在你身上看到了她 他總是背著高兩個頭的畫板 問我這個跳色 會部會太好猜 其實我從來就看不出來 你今天是否化了妝 因為我是個龐克 坐在環狀線上的女孩 瑟縮在紅色的大衣中睡著了 耳機中的落日飛車是老的那張 剛好是他的最愛 他總是在形而上的世界盤旋 與萍水相逢的我恣意的眷戀 每一次道別 都可能是最後一次道別 別說的敷衍 別說的敷衍 坐在環狀線上的女孩 新聞播放著你全開的油畫 每一處充滿挑釁不和諧的美感 如果當初我能明白 是否就能再次見到 是否就能再次見到 是否就能再次見到 環狀線上的女孩 
環狀線
坐在環狀線上的女孩 多想能一眼把你看穿 每個星期五的傍晚總有一個剎那 能看見你的笑
指尖殘留著油畫的顏料 藝大的簡章 跟身心科的藥 收斂起我太過直接的目光 我只是在你身上看到了她
他總是背著高兩個頭的畫板 問我這個跳色 會部會太好猜 其實我從來就看不出來 你今天是否化了妝 因為我是個龐克
坐在環狀線上的女孩 瑟縮在紅色的大衣中睡著了 耳機中的落日飛車是老的那張 剛好是他的最愛
他總是在形而上的世界盤旋 與萍水相逢的我恣意的眷戀 每一次道別 都可能是最後一次道別 別說的敷衍 別說的敷衍
坐在環狀線上的女孩 新聞播放著你全開的油畫 每一處充滿挑釁不和諧的美感 如果當初我能明白 是否就能再次見到 是否就能再次見到 是否就能再次見到 環狀線上的女孩
留言（ 8 ） 最相關留言 所有留言
留言（ 8 ）",2026-07-19,,True,False,
2026-07-21 04:38:31,4,,,5,297,7,https://streetvoice.com/MatthewLiu/songs/870095/,https://streetvoice.com/MatthewLiu/,"https://akstatic.streetvoice.com/song_covers/Ma/tt/MatthewLiu/J2EFM8EeC4HPoVWVgQe8UH.jpeg?x-oss-process=image/resize,m_fixed,h_1,w_1,limit_0/resize,m_fixed,h_630,w_1200,limit_0/watermark,image_c29uZ19jb3ZlcnMvTWEvdHQvTWF0dGhld0xpdS9KMkVGTThFZUM0SFBvVldWZ1FlOFVILmpwZWc_eC1vc3MtcHJvY2Vzcz1pbWFnZS9yZXNpemUsbV9maXhlZCxoXzM0NCx3XzM0NCxsaW1pdF8w,g_nw,x_428,y_143/watermark,image_YXNzZXQvaW1hZ2VzL21ldGFpbWFnZS1zb25nLnBuZw,g_nw,x_0,y_0",@MatthewLiu,音樂人,,,,2,304,,,,https://www.youtube.com/user/StreetVoiceTV,Alternative,,,,,"這是沒有提供歌詞的歌曲
留言（ 7 ） 最相關留言 所有留言
留言（ 7 ）",2026-07-19,,True,False,
2026-07-21 04:38:31,5,,,121,6557,15,https://streetvoice.com/alanchou12345/songs/867797/,https://streetvoice.com/alanchou12345/,"https://akstatic.streetvoice.com/song_covers/al/an/alanchou12345/Y4nZTaRGQvJAdXdvTGKcmr.jpeg?x-oss-process=image/resize,m_fixed,h_1,w_1,limit_0/resize,m_fixed,h_630,w_1200,limit_0/watermark,image_c29uZ19jb3ZlcnMvYWwvYW4vYWxhbmNob3UxMjM0NS9ZNG5aVGFSR1F2SkFkWGR2VEdLY21yLmpwZWc_eC1vc3MtcHJvY2Vzcz1pbWFnZS9yZXNpemUsbV9maXhlZCxoXzM0NCx3XzM0NCxsaW1pdF8w,g_nw,x_428,y_143/watermark,image_YXNzZXQvaW1hZ2VzL21ldGFpbWFnZS1zb25nLnBuZw,g_nw,x_0,y_0",@alanchou12345,音樂人,新北市,2019-03-01,2023-01-30 10:32,12,3673,,https://www.facebook.com/profile.php?id=100063938225158,https://www.instagram.com/ac___47/,https://www.youtube.com/@ac47yt,R&B / Soul,,,,"有沒有一種愛， 讓你願意跨越所有距離與考驗？ 「就算這世界對我針鋒相對，風再大、天再黑，我也不撤退。」 獻給每一個在深夜裡依然相信愛的所有存在， 〈漫漫長夜〉，蔓延日夜。 
有沒有一種愛， 讓你願意跨越所有距離與考驗？
「就算這世界對我針鋒相對，風再大、天再黑，我也不撤退。」
獻給每一個在深夜裡依然相信愛的所有存在，
〈漫漫長夜〉，蔓延日夜。","時間停止瞬間 別說話讓我收藏有關於你的一切 思緒像微風 在你身邊盤旋 不需言語我了解 總在夜深人靜 腦袋不自覺浮現你最美的笑臉 牽起我的手 趁夜沒發現 再讓我更靠近你一些些 在這漫漫長夜 讓我守護你身邊 day by day 把所有想像都實現 閉上你雙眼 你的愛我來擁有 漫漫長夜 讓我照亮你 每一天每一夜 我會在身邊 不要再懷疑 不要再後退 我只為你眷戀 就算這世界 對我針鋒相對 風再大 天再黑 我也不撤退 沒有誰能改變 我的心 讓愛蔓延在漫漫長夜 總在夜深人靜 腦袋不自覺浮現你最美的笑臉 牽起我的手 趁夜沒發現 再讓我更靠近你一些些 (靠近一些些) 在這漫漫長夜 讓我守護你身邊 day by day 把所有想像都實現 閉上你雙眼 (Oh babe) 你的愛我來擁有 漫漫長夜 讓我照亮你 每一天每一夜 我會在身邊 不要再懷疑 不要再後退 我只為你眷戀 就算這世界 對我針鋒相對 風再大 天再黑 我也不撤退 沒有誰能改變 我的心 讓愛蔓延在漫漫長夜 漫漫長夜 day by day 漫漫長夜 day by day 讓愛在漫漫長夜 
時間停止瞬間 別說話讓我收藏有關於你的一切 思緒像微風 在你身邊盤旋 不需言語我了解
總在夜深人靜 腦袋不自覺浮現你最美的笑臉 牽起我的手 趁夜沒發現 再讓我更靠近你一些些
在這漫漫長夜 讓我守護你身邊 day by day 把所有想像都實現 閉上你雙眼 你的愛我來擁有
漫漫長夜 讓我照亮你 每一天每一夜 我會在身邊 不要再懷疑 不要再後退 我只為你眷戀
就算這世界 對我針鋒相對 風再大 天再黑 我也不撤退 沒有誰能改變 我的心 讓愛蔓延在漫漫長夜
總在夜深人靜 腦袋不自覺浮現你最美的笑臉 牽起我的手 趁夜沒發現 再讓我更靠近你一些些 (靠近一些些)
在這漫漫長夜 讓我守護你身邊 day by day 把所有想像都實現 閉上你雙眼 (Oh babe) 你的愛我來擁有
漫漫長夜 讓我照亮你 每一天每一夜 我會在身邊 不要再懷疑 不要再後退 我只為你眷戀
就算這世界 對我針鋒相對 風再大 天再黑 我也不撤退 沒有誰能改變 我的心 讓愛蔓延在漫漫長夜
漫漫長夜 day by day 漫漫長夜 day by day 讓愛在漫漫長夜
留言（ 15 ） 最相關留言 所有留言
留言（ 15 ）",2026-07-06,,True,True,https://streetvoice.com/alanchou12345/songs/867797/critic_reviews/
2026-07-21 04:38:31,6,,,18,1223,4,https://streetvoice.com/s8817012011/songs/869352/,https://streetvoice.com/s8817012011/,"https://akstatic.streetvoice.com/song_covers/s8/81/s8817012011/kebDX8bwYE5mh9MZp3UzJc.jpeg?x-oss-process=image/resize,m_fixed,h_1,w_1,limit_0/resize,m_fixed,h_630,w_1200,limit_0/watermark,image_c29uZ19jb3ZlcnMvczgvODEvczg4MTcwMTIwMTEva2ViRFg4YndZRTVtaDlNWnAzVXpKYy5qcGVnP3gtb3NzLXByb2Nlc3M9aW1hZ2UvcmVzaXplLG1fZml4ZWQsaF8zNDQsd18zNDQsbGltaXRfMA,g_nw,x_428,y_143/watermark,image_YXNzZXQvaW1hZ2VzL21ldGFpbWFnZS1zb25nLnBuZw,g_nw,x_0,y_0",@s8817012011,音樂人,台北市,2011-12-01,2021-09-27 15:35,32,331,7,https://www.facebook.com/theMetalspeaker/,https://instagram.com/themetalspeaker,https://youtube.com/channel/UCuzSxL_ns0uTJyx4xAZ5NWw,Rock,我的人生 Master of None,https://streetvoice.com/s8817012011/songs/album/97325613/,,"人生哪可能項項攏順勢。 失敗、孤獨、自我懷疑，都成為成長過程中的一部分。 真正的不在意，不是冷漠，而是經歷過很多事後，依然願意守住內心最初的夢。 「我的夢，一直攏底加。」 這句話，比任何豪言壯語都更加堅定。 有些人長大以後，早就迷失在這大人的世界裡。 而有些人，即使受傷、迷惘、跌跌撞撞，依然繼續往前走。 
人生哪可能項項攏順勢。 失敗、孤獨、自我懷疑，都成為成長過程中的一部分。 真正的不在意，不是冷漠，而是經歷過很多事後，依然願意守住內心最初的夢。 「我的夢，一直攏底加。」 這句話，比任何豪言壯語都更加堅定。 有些人長大以後，早就迷失在這大人的世界裡。 而有些人，即使受傷、迷惘、跌跌撞撞，依然繼續往前走。","其實我 常常夢見 彼段唔知啥叫憂愁的日子 後來我 戈洪叫醒 繼續一天一天傻傻過日子 但我漸漸了解 我愛的是什麼 我知我自己是一定不放棄 外面的風雨咖大我不在意 雖然這個過程傷透我欸心 但人生啊 哪有可能項項都順勢 我的夢 一直攏底加 今罵欸我 什麼攏不驚 其實我 常常夢見 彼段唔知啥叫憂愁的日子 後來我 戈洪叫醒 繼續一天一天傻傻過日子 但我漸漸了解 我愛的是什麼 我知我自己是一定不放棄 外面的風雨咖大我不在意 雖然這個過程傷透我欸心 但人生啊 哪有可能項項都順勢 我的夢 一直攏底加 今罵欸我 什麼攏不驚 不肯放過我自己 所以來開始問自己 到底這是啥意義 啊啊啊 彼段黑暗的日子 暫時攏麥擱再提起 欲出去 走找彼個流浪的心 我知我自己是一定不放棄 外面的風雨咖大我不在意 雖然這個過程傷透我欸心 但人生啊 哪有可能項項都順勢 我的夢 一直攏底加 今罵欸我 什麼攏不驚 
其實我 常常夢見 彼段唔知啥叫憂愁的日子 後來我 戈洪叫醒 繼續一天一天傻傻過日子 但我漸漸了解 我愛的是什麼
我知我自己是一定不放棄 外面的風雨咖大我不在意 雖然這個過程傷透我欸心 但人生啊 哪有可能項項都順勢 我的夢 一直攏底加 今罵欸我 什麼攏不驚
其實我 常常夢見 彼段唔知啥叫憂愁的日子 後來我 戈洪叫醒 繼續一天一天傻傻過日子 但我漸漸了解 我愛的是什麼
我知我自己是一定不放棄 外面的風雨咖大我不在意 雖然這個過程傷透我欸心 但人生啊 哪有可能項項都順勢 我的夢 一直攏底加 今罵欸我 什麼攏不驚
不肯放過我自己 所以來開始問自己 到底這是啥意義 啊啊啊 彼段黑暗的日子 暫時攏麥擱再提起 欲出去 走找彼個流浪的心
我知我自己是一定不放棄 外面的風雨咖大我不在意 雖然這個過程傷透我欸心 但人生啊 哪有可能項項都順勢 我的夢 一直攏底加 今罵欸我 什麼攏不驚
留言（ 4 ） 最相關留言 所有留言
留言（ 4 ）",2026-07-14,,True,False,https://streetvoice.com/s8817012011/songs/869352/critic_reviews/
2026-07-21 04:38:31,7,,,41,3324,4,https://streetvoice.com/Bella0110/songs/868215/,https://streetvoice.com/Bella0110/,"https://akstatic.streetvoice.com/song_covers/Be/ll/Bella0110/9pLjAQsB8JgKUARWtG26qZ.jpeg?x-oss-process=image/resize,m_fixed,h_1,w_1,limit_0/resize,m_fixed,h_630,w_1200,limit_0/watermark,image_c29uZ19jb3ZlcnMvQmUvbGwvQmVsbGEwMTEwLzlwTGpBUXNCOEpnS1VBUld0RzI2cVouanBlZz94LW9zcy1wcm9jZXNzPWltYWdlL3Jlc2l6ZSxtX2ZpeGVkLGhfMzQ0LHdfMzQ0LGxpbWl0XzA,g_nw,x_428,y_143/watermark,image_YXNzZXQvaW1hZ2VzL21ldGFpbWFnZS1zb25nLnBuZw,g_nw,x_0,y_0",@Bella0110,音樂人,,,,2,39,7,,,https://www.youtube.com/user/StreetVoiceTV,Alternative,,,,"不可知的未來是一張網，用心思和精神細細編織，若是時間剛好，那屬於你的便會停留在網上成為繼續存活的養分，如果不是，那便會破壞這張網，甚至得要重來一遍，而最幸福的人終究會是享受一無所有的人。 
不可知的未來是一張網，用心思和精神細細編織，若是時間剛好，那屬於你的便會停留在網上成為繼續存活的養分，如果不是，那便會破壞這張網，甚至得要重來一遍，而最幸福的人終究會是享受一無所有的人。","We’re having too good a time today. We ain’t thinking about tomorrow. We can beat & beat till death Dancing on the dance floor like Mary Lou We don't really  know what happens next (having no purpose driving on the highway) Don't try to save me this is the way I see (on the road we beat and beat and beat till death) Spider is weaving a big web Wish and prepare  for the big time to become the dinner everything belongs to me because I'm poor 詞 / 曲： 李沐霏 主唱： 李沐霏 鍵盤 / 合成器： 東東 Sid 吉他： 曾程威 Eddie 貝斯： Roy 鼓手： 毛恩 
We’re having too good a time today. We ain’t thinking about tomorrow. We can beat & beat till death Dancing on the dance floor like Mary Lou
We don't really  know what happens next (having no purpose driving on the highway) Don't try to save me this is the way I see (on the road we beat and beat and beat till death) Spider is weaving a big web Wish and prepare  for the big time to become the dinner
everything belongs to me because I'm poor
詞 / 曲： 李沐霏 主唱： 李沐霏 鍵盤 / 合成器： 東東 Sid 吉他： 曾程威 Eddie 貝斯： Roy 鼓手： 毛恩
留言（ 4 ） 最相關留言 所有留言
留言（ 4 ）",2026-07-08,,True,False,https://streetvoice.com/Bella0110/songs/868215/critic_reviews/
2026-07-21 04:38:31,8,,,25,2569,5,https://streetvoice.com/echo/songs/867916/,https://streetvoice.com/echo/,"https://akstatic.streetvoice.com/song_covers/ec/ho/echo/5x8526KFGgMHkL5XLA3wUo.jpeg?x-oss-process=image/resize,m_fixed,h_1,w_1,limit_0/resize,m_fixed,h_630,w_1200,limit_0/watermark,image_c29uZ19jb3ZlcnMvZWMvaG8vZWNoby81eDg1MjZLRkdnTUhrTDVYTEEzd1VvLmpwZWc_eC1vc3MtcHJvY2Vzcz1pbWFnZS9yZXNpemUsbV9maXhlZCxoXzM0NCx3XzM0NCxsaW1pdF8w,g_nw,x_428,y_143/watermark,image_YXNzZXQvaW1hZ2VzL21ldGFpbWFnZS1zb25nLnBuZw,g_nw,x_0,y_0",@echo,音樂人,台北市,2006-01-01,,20,1714,,,,https://www.youtube.com/user/StreetVoiceTV,Rock,,,,"因為我如此愛你，穿越光年也要見你一面 回聲樂團 Echo of Your Soul 新專輯《靈魂的回聲》已數位發行 08.29 台北Legacy 專輯首唱 
因為我如此愛你，穿越光年也要見你一面
回聲樂團 Echo of Your Soul 新專輯《靈魂的回聲》已數位發行
08.29 台北Legacy 專輯首唱","動態歌詞
你是一個夜晚 等待星空的盛開 在光與暗的糾纏 懸然未決的片段 就讓我成為你一瞬間的斑斕 在這宇宙長流短促相逢的塵埃 Because I love you so And I think you know Because I love you so Let me be your glow Because I love you so With every rhythm I’m gonna let it flow Until the end of time Because I love you so 也許相遇過後只剩無常的詠嘆 但若你記得我 我就會存在 Because I love you so And I think you know Because I love you so Let me be your glow Because I love you so With every rhythm I’m gonna let it flow Until the end of time Because I love you so 
你是一個夜晚 等待星空的盛開 在光與暗的糾纏 懸然未決的片段 就讓我成為你一瞬間的斑斕 在這宇宙長流短促相逢的塵埃 Because I love you so And I think you know Because I love you so Let me be your glow Because I love you so With every rhythm I’m gonna let it flow Until the end of time Because I love you so 也許相遇過後只剩無常的詠嘆 但若你記得我 我就會存在 Because I love you so And I think you know Because I love you so Let me be your glow Because I love you so With every rhythm I’m gonna let it flow Until the end of time Because I love you so
留言（ 5 ） 最相關留言 所有留言
留言（ 5 ）",2026-07-06,,True,True,
2026-07-21 04:38:31,9,,,7,579,8,https://streetvoice.com/MINJUsince2025/songs/869020/,https://streetvoice.com/MINJUsince2025/,"https://akstatic.streetvoice.com/song_covers/MI/NJ/MINJUsince2025/8gzCiZ63MfxfoSR2Euooap.jpeg?x-oss-process=image/resize,m_fixed,h_1,w_1,limit_0/resize,m_fixed,h_630,w_1200,limit_0/watermark,image_c29uZ19jb3ZlcnMvTUkvTkovTUlOSlVzaW5jZTIwMjUvOGd6Q2laNjNNZnhmb1NSMkV1b29hcC5qcGVnP3gtb3NzLXByb2Nlc3M9aW1hZ2UvcmVzaXplLG1fZml4ZWQsaF8zNDQsd18zNDQsbGltaXRfMA,g_nw,x_428,y_143/watermark,image_YXNzZXQvaW1hZ2VzL21ldGFpbWFnZS1zb25nLnBuZw,g_nw,x_0,y_0",@MINJUsince2025,音樂人,台北市,2025-10-01,2026-05-27 09:41,4,64,3,,https://www.instagram.com/minju.tw/,http://www.youtube.com/@minju.tw.2025,Punk,Nacre,https://streetvoice.com/MINJUsince2025/songs/album/97325682/,,"— 致謝 Credit to 詞 Lyrics｜陳澤 CTL、大頭 BH 曲 Compose｜陳澤 CTL 製作人 Producer｜A-mu@ENZO STUDIO 編曲 Arrangement｜明珠 MINJU、A-mu@ENZO STUDIO 錄音工程師 Recording Engineer｜A-mu@ENZO STUDIO 錄音室 Recording Studios｜ENZO STUDIO 混音工程師 Mixing Engineer｜A-mu@ENZO STUDIO 母帶後期工程師 Mastering Engineer｜A-mu@ENZO STUDIO — 
— 致謝 Credit to 詞 Lyrics｜陳澤 CTL、大頭 BH 曲 Compose｜陳澤 CTL 製作人 Producer｜A-mu@ENZO STUDIO 編曲 Arrangement｜明珠 MINJU、A-mu@ENZO STUDIO 錄音工程師 Recording Engineer｜A-mu@ENZO STUDIO 錄音室 Recording Studios｜ENZO STUDIO 混音工程師 Mixing Engineer｜A-mu@ENZO STUDIO 母帶後期工程師 Mastering Engineer｜A-mu@ENZO STUDIO —","動態歌詞
這 暫停鍵按了好久 畫面卻在流動 什麼時候（總在錯過） 春夏秋冬（偏軸脫軸斷軸） 誰在看我（總在錯過） 是鏡子外的我 小心的鑿開腿 上的枷鎖才發 現只剩些鏽垢 或許你曾經也在原地停留 或許你曾經想像能帶我離開過 或許你眼中的我無法掙脫 但秒針開始轉動 這 播放鍵怎麼沒用 畫面靜止不動 什麼時候（總在回首） 花開葉落（偏軸脫軸斷軸） 誰在看我（總在回首） 是鏡子裡的我 小心的鑿開腿 上的枷鎖才發 現它早已鬆脫 如果遠方就是此刻的重播 如果遠方會有什麼早就被承諾 如果遠方有燈有人還守候 請你拉住我的手 或許我曾經只在原地停留 或許我曾經想像能回頭重來過 或許我的樣子還有些落魄 但秒針開始轉動 
這 暫停鍵按了好久 畫面卻在流動 什麼時候（總在錯過） 春夏秋冬（偏軸脫軸斷軸） 誰在看我（總在錯過） 是鏡子外的我 小心的鑿開腿 上的枷鎖才發 現只剩些鏽垢 或許你曾經也在原地停留 或許你曾經想像能帶我離開過 或許你眼中的我無法掙脫 但秒針開始轉動 這 播放鍵怎麼沒用 畫面靜止不動 什麼時候（總在回首） 花開葉落（偏軸脫軸斷軸） 誰在看我（總在回首） 是鏡子裡的我 小心的鑿開腿 上的枷鎖才發 現它早已鬆脫 如果遠方就是此刻的重播 如果遠方會有什麼早就被承諾 如果遠方有燈有人還守候 請你拉住我的手 或許我曾經只在原地停留 或許我曾經想像能回頭重來過 或許我的樣子還有些落魄 但秒針開始轉動
留言（ 8 ） 最相關留言 所有留言
留言（ 8 ）",2026-07-20,,True,False,
