snapshot_time,rank,artist_name,song_title,likes_count,play_count,comments_count,song_url,artist_url,cover_image_url,artist_handle,artist_identity,artist_city,artist_joined_date,artist_accredited_datetime,artist_music_count,artist_fans_count,artist_following_count,artist_facebook_url,artist_instagram_url,artist_youtube_url,genre,album_title,album_url,collaborators,description,lyrics,release_date,song_accredited_datetime,is_editor_recommended,is_song_of_the_day,critic_review_url
2026-07-14 05:09:44,35,,,2,50,0,https://streetvoice.com/ripplesmusic/songs/868547/,https://streetvoice.com/ripplesmusic/,"https://akstatic.streetvoice.com/music_albums/ri/pp/ripplesmusic/QL3EWTBAmJYTvUDNDcePka.jpeg?x-oss-process=image/resize,m_fixed,h_1,w_1,limit_0/resize,m_fixed,h_630,w_1200,limit_0/watermark,image_bXVzaWNfYWxidW1zL3JpL3BwL3JpcHBsZXNtdXNpYy9RTDNFV1RCQW1KWVR2VURORGNlUGthLmpwZWc_eC1vc3MtcHJvY2Vzcz1pbWFnZS9yZXNpemUsbV9maXhlZCxoXzM0NCx3XzM0NCxsaW1pdF8w,g_nw,x_428,y_143/watermark,image_YXNzZXQvaW1hZ2VzL21ldGFpbWFnZS1zb25nLnBuZw,g_nw,x_0,y_0",@ripplesmusic,音樂人,台北市,2015-11-01,2021-06-04 17:58,15,392,8,https://www.facebook.com/jewelsinging,https://www.instagram.com/jewel_chang/,https://www.youtube.com/channel/UC5_lZwl2CbcFbXrMuIZGM1w,Folk,"新的過去舊的還在 A New Past,Linger",https://streetvoice.com/ripplesmusic/songs/album/97325651/,,"母親離開後，仁與一直幻想著與母親相聚的那一天，母親是否在天堂的門前等待著她？由鄭昭元擔任編曲與製作，歌曲開頭近乎無任何伴奏，仁與極為輕柔又帶有點顫抖的開場，像是在尋找什麼，也在期盼著總有一天的發生。 〈我們終於再相聚〉邀請仁與很喜歡的女性創作者蘇珮卿，蘇珮卿幾年前也寫下關於生死與病痛的一張作品。同時仁與也在想，珮卿作為一個母親是不是更能夠了解這首歌的心情。珮卿像一座橋樑，流動的豎琴聲與和聲，像是來自另一個世界的聲音，直至天庭細微的電波傳輸，與仁與交疊感應，跨越天與地的距離，合而為一。 作詞 Lyricist｜張仁與 Jewel Chang 作曲 Composer｜張仁與 Jewel Chang 製作人 Producer｜鄭昭元 ZAOYUAN 編曲 Arranger｜鄭昭元 ZAOYUAN 配唱製作人 Vocal Producer｜鄭昭元 ZAOYUAN 鋼琴 Piano｜鄭昭元 ZAOYUAN 電豎琴 Electric Harp｜蘇珮卿 Paige Su 長笛 Flute｜蘇珮卿 Paige Su 弦樂編寫 Strings Arranger｜鄭昭元 ZAOYUAN 弦樂 Strings｜涵都盧弦樂製造所 Handle Strings 小提琴 Violin｜盧思蒨 Szu-Chien Lu 大提琴 Cello｜劉涵 Liu Hang 和聲編寫 Backing Vocal Arrangement｜鄭昭元 ZAOYUAN 和音 Backing Vocals｜蘇珮卿 Paige Su、張仁與 Jewel Chang 錄音師 Recording Engineer｜鄭昭元 ZAOYUAN 錄音室 Recording Studio｜玉成戲院錄音室 YuChen Cinema Studio 混音工程師 Mixing Engineer｜Andy Baker 母帶後期工程師 Mastering Engineer｜莊鈞智 Thomas Chuang 
母親離開後，仁與一直幻想著與母親相聚的那一天，母親是否在天堂的門前等待著她？由鄭昭元擔任編曲與製作，歌曲開頭近乎無任何伴奏，仁與極為輕柔又帶有點顫抖的開場，像是在尋找什麼，也在期盼著總有一天的發生。
〈我們終於再相聚〉邀請仁與很喜歡的女性創作者蘇珮卿，蘇珮卿幾年前也寫下關於生死與病痛的一張作品。同時仁與也在想，珮卿作為一個母親是不是更能夠了解這首歌的心情。珮卿像一座橋樑，流動的豎琴聲與和聲，像是來自另一個世界的聲音，直至天庭細微的電波傳輸，與仁與交疊感應，跨越天與地的距離，合而為一。
作詞 Lyricist｜張仁與 Jewel Chang 作曲 Composer｜張仁與 Jewel Chang 製作人 Producer｜鄭昭元 ZAOYUAN 編曲 Arranger｜鄭昭元 ZAOYUAN 配唱製作人 Vocal Producer｜鄭昭元 ZAOYUAN 鋼琴 Piano｜鄭昭元 ZAOYUAN 電豎琴 Electric Harp｜蘇珮卿 Paige Su 長笛 Flute｜蘇珮卿 Paige Su 弦樂編寫 Strings Arranger｜鄭昭元 ZAOYUAN 弦樂 Strings｜涵都盧弦樂製造所 Handle Strings 小提琴 Violin｜盧思蒨 Szu-Chien Lu 大提琴 Cello｜劉涵 Liu Hang 和聲編寫 Backing Vocal Arrangement｜鄭昭元 ZAOYUAN 和音 Backing Vocals｜蘇珮卿 Paige Su、張仁與 Jewel Chang 錄音師 Recording Engineer｜鄭昭元 ZAOYUAN 錄音室 Recording Studio｜玉成戲院錄音室 YuChen Cinema Studio 混音工程師 Mixing Engineer｜Andy Baker 母帶後期工程師 Mastering Engineer｜莊鈞智 Thomas Chuang","我 重複的播放 腦海的畫面 或許 我早就預見結局 還是 讓衝動替我 走到你面前 當然 沒有一次不後悔 我不停地想 不停地想 你說過的話 有時候我感覺你 好像就在我身邊 當我閉上了眼睛 能聽見你 還應該等待多久 倒數相見的時間 你會牽起我的手 就像從前 你 總要我堅強 但失去了你 或許 我不過是在假裝 我試著延續 你愛的一切 卻忘了告別 可惜 我們來不及和解 我不停地想 不停地想 你說過的話 有時候我感覺你 好像就在我身邊 當我閉上了眼睛 能聽見你 還應該等待多久 倒數相見的時間 你會牽起我的手 就像從前 我們終於再相聚 直到那天 
我 重複的播放 腦海的畫面 或許 我早就預見結局 還是 讓衝動替我 走到你面前 當然 沒有一次不後悔
我不停地想 不停地想 你說過的話
有時候我感覺你 好像就在我身邊 當我閉上了眼睛 能聽見你
還應該等待多久 倒數相見的時間 你會牽起我的手 就像從前
你 總要我堅強 但失去了你 或許 我不過是在假裝 我試著延續 你愛的一切 卻忘了告別 可惜 我們來不及和解
我不停地想 不停地想 你說過的話
有時候我感覺你 好像就在我身邊 當我閉上了眼睛 能聽見你
還應該等待多久 倒數相見的時間 你會牽起我的手 就像從前
我們終於再相聚 直到那天
留言（ 0 ） 最相關留言 所有留言
留言（ 0 ）",2026-07-10,,True,False,
2026-07-14 05:09:44,36,,,35,3629,5,https://streetvoice.com/alice_ku/songs/864741/,https://streetvoice.com/alice_ku/,"https://akstatic.streetvoice.com/music_albums/al/ic/alice_ku/U5jcSjLHvsj5MHimRcTnh5.jpeg?x-oss-process=image/resize,m_fixed,h_1,w_1,limit_0/resize,m_fixed,h_630,w_1200,limit_0/watermark,image_bXVzaWNfYWxidW1zL2FsL2ljL2FsaWNlX2t1L1U1amNTakxIdnNqNU1IaW1SY1RuaDUuanBlZz94LW9zcy1wcm9jZXNzPWltYWdlL3Jlc2l6ZSxtX2ZpeGVkLGhfMzQ0LHdfMzQ0LGxpbWl0XzA,g_nw,x_428,y_143/watermark,image_YXNzZXQvaW1hZ2VzL21ldGFpbWFnZS1zb25nLnBuZw,g_nw,x_0,y_0",@alice_ku,音樂人,,,,42,48,2,,,https://www.youtube.com/user/StreetVoiceTV,Experimental,Recall,https://streetvoice.com/alice_ku/songs/album/97325487/,,"https://www.instagram.com/greenhorizon2013/ Corey Best : https://www.instagram.com/aworldwonderedfull/ 
https://www.instagram.com/greenhorizon2013/ Corey Best : https://www.instagram.com/aworldwonderedfull/
https://www.instagram.com/greenhorizon2013/
https://www.instagram.com/aworldwonderedfull/","you found a tree then the ground left space beneath your feet 
you found a tree then the ground left space beneath your feet
留言（ 5 ） 最相關留言 所有留言
留言（ 5 ）",2026-06-16,,True,True,https://streetvoice.com/alice_ku/songs/864741/critic_reviews/
2026-07-14 05:09:44,37,,,32,1603,6,https://streetvoice.com/moocusmoo/songs/867427/,https://streetvoice.com/moocusmoo/,"https://akstatic.streetvoice.com/song_covers/mo/oc/moocusmoo/iuJXDRHTUH5breoFv8ijzM.jpeg?x-oss-process=image/resize,m_fixed,h_1,w_1,limit_0/resize,m_fixed,h_630,w_1200,limit_0/watermark,image_c29uZ19jb3ZlcnMvbW8vb2MvbW9vY3VzbW9vL2l1SlhEUkhUVUg1YnJlb0Z2OGlqek0uanBlZz94LW9zcy1wcm9jZXNzPWltYWdlL3Jlc2l6ZSxtX2ZpeGVkLGhfMzQ0LHdfMzQ0LGxpbWl0XzA,g_nw,x_428,y_143/watermark,image_YXNzZXQvaW1hZ2VzL21ldGFpbWFnZS1zb25nLnBuZw,g_nw,x_0,y_0",@moocusmoo,音樂人,,,,14,1542,,,,https://www.youtube.com/user/StreetVoiceTV,Hip hop / Rap,,,,,"我總騎著腳踏車為了看路人 整理頭髮眼神對接但彼此不出聲 你跟我是否有種相同的孤獨感 看著別人的舌頭接觸另個人的嘟嘟唇 這幾秒鐘裡的照顧讓你承蒙了 留下一張我受夠了紙條那種撤 my bae 很高興在妳對面等紅燈 但這不是那種到你面前跟你 say wussup type thing 但好奇你我會是怨偶 還陌生人難以鑑別呢 想慢工出細活把戀愛不談得便捷cause 我不想傷害誰就因為我風度翩翩but 鐵咩囉 你太可愛不騙你難道騙別人 戒備森嚴外表 內心住著一個潘妮洛普 門庭若市的店鋪專給寂寞的人經過 有點不浪漫當不想對同個人偏心 我10分抱歉 8分音符 十之八九分心過 停下腳步感覺好似有一剎那 我讓你多看了一眼你覺得我辣嗎 短暫的相處後又剩下我一個人惆悵 你不用做太多就能夠讓我感到瘋狂 沒日夜的寂寞在每天都快要塌下 當你想起我 我好奇你覺得我辣嗎 也許我們也有一個未來可以共享 不需要太久只要能讓我感到瘋狂 敢愛敢恨但平衡兩者難以應變 對外我說明會實際上我還卡在行前 搞不懂到底喜歡什麼偏好哪邊傾斜 當男人是個心態從來不是一個性別 多少人快到臨界點 就為了感受這麼一點偉大 拉起與人相處的警戒線 對不起 請 謝謝 你幾點回家 從沒跨出第一步要怎麼演變成明天見 我不希望我也為繁衍不得邁出第一步 害怕默契在一轉眼出了代溝 不想說Do or die或說謝謝你讓我知道了真相 我真想說我能夠接受完美不存在bro 但why i dont believe in love 我多想做做樣子 呼叫地球我在外太空裡一個人 愛很困難當在不對的情緒說對的話 愛很困難為了讓羞恥不演變成疙瘩 停下腳步感覺好似有一剎那 我讓你多看了一眼你覺得我辣嗎 短暫的相處後又剩下我一個人惆悵 你不用做太多就能夠讓我感到瘋狂 沒日夜的寂寞在每天都快要塌下 當你想起我 我好奇你覺得我辣嗎 也許我們也有一個未來可以共享 不需要太久只要能讓我感到瘋狂 怎麼抗拒愛上陌生人 我曇花一現的美貌與智慧 想多看你一眼 這誰懂 誰懂 在每秒 都痛 說不出的問候停在心頭上 U Saw me on the streets but am i in your heart 說我偏門但 也許膚淺其實價值連城 看一眼我知道你是我的人哪怕只是從旁邊經過 我能夠感受你想要什麼樣的方式 咬著指尖思考如何為你量身定做 跟我講 那些你從不告訴別人的事 哪怕我話很少 但聽是我的反應 沈默除非讓你大聲笑 我讓你多看一眼 你也值得被理解 讓我讀出你的心 更靠近我站一些 這陣孤獨的季節 有一天就算一天 並不意外我不完美 但我讓你多看一眼 
我總騎著腳踏車為了看路人 整理頭髮眼神對接但彼此不出聲 你跟我是否有種相同的孤獨感 看著別人的舌頭接觸另個人的嘟嘟唇 這幾秒鐘裡的照顧讓你承蒙了 留下一張我受夠了紙條那種撤 my bae 很高興在妳對面等紅燈 但這不是那種到你面前跟你 say wussup type thing
但好奇你我會是怨偶 還陌生人難以鑑別呢 想慢工出細活把戀愛不談得便捷cause 我不想傷害誰就因為我風度翩翩but 鐵咩囉 你太可愛不騙你難道騙別人 戒備森嚴外表 內心住著一個潘妮洛普 門庭若市的店鋪專給寂寞的人經過 有點不浪漫當不想對同個人偏心 我10分抱歉 8分音符 十之八九分心過
停下腳步感覺好似有一剎那 我讓你多看了一眼你覺得我辣嗎 短暫的相處後又剩下我一個人惆悵 你不用做太多就能夠讓我感到瘋狂
沒日夜的寂寞在每天都快要塌下 當你想起我 我好奇你覺得我辣嗎 也許我們也有一個未來可以共享 不需要太久只要能讓我感到瘋狂
敢愛敢恨但平衡兩者難以應變 對外我說明會實際上我還卡在行前 搞不懂到底喜歡什麼偏好哪邊傾斜 當男人是個心態從來不是一個性別 多少人快到臨界點 就為了感受這麼一點偉大 拉起與人相處的警戒線 對不起 請 謝謝 你幾點回家 從沒跨出第一步要怎麼演變成明天見 我不希望我也為繁衍不得邁出第一步 害怕默契在一轉眼出了代溝 不想說Do or die或說謝謝你讓我知道了真相 我真想說我能夠接受完美不存在bro 但why i dont believe in love 我多想做做樣子 呼叫地球我在外太空裡一個人 愛很困難當在不對的情緒說對的話 愛很困難為了讓羞恥不演變成疙瘩
停下腳步感覺好似有一剎那 我讓你多看了一眼你覺得我辣嗎 短暫的相處後又剩下我一個人惆悵 你不用做太多就能夠讓我感到瘋狂
沒日夜的寂寞在每天都快要塌下 當你想起我 我好奇你覺得我辣嗎 也許我們也有一個未來可以共享 不需要太久只要能讓我感到瘋狂
怎麼抗拒愛上陌生人 我曇花一現的美貌與智慧 想多看你一眼 這誰懂 誰懂 在每秒 都痛 說不出的問候停在心頭上 U Saw me on the streets but am i in your heart
說我偏門但 也許膚淺其實價值連城 看一眼我知道你是我的人哪怕只是從旁邊經過 我能夠感受你想要什麼樣的方式 咬著指尖思考如何為你量身定做
跟我講 那些你從不告訴別人的事 哪怕我話很少 但聽是我的反應 沈默除非讓你大聲笑
我讓你多看一眼 你也值得被理解 讓我讀出你的心 更靠近我站一些 這陣孤獨的季節 有一天就算一天 並不意外我不完美 但我讓你多看一眼
留言（ 6 ） 最相關留言 所有留言
留言（ 6 ）",2026-07-03,,True,False,
2026-07-14 05:09:44,38,,,3,49,1,https://streetvoice.com/ripplesmusic/songs/868546/,https://streetvoice.com/ripplesmusic/,"https://akstatic.streetvoice.com/music_albums/ri/pp/ripplesmusic/QL3EWTBAmJYTvUDNDcePka.jpeg?x-oss-process=image/resize,m_fixed,h_1,w_1,limit_0/resize,m_fixed,h_630,w_1200,limit_0/watermark,image_bXVzaWNfYWxidW1zL3JpL3BwL3JpcHBsZXNtdXNpYy9RTDNFV1RCQW1KWVR2VURORGNlUGthLmpwZWc_eC1vc3MtcHJvY2Vzcz1pbWFnZS9yZXNpemUsbV9maXhlZCxoXzM0NCx3XzM0NCxsaW1pdF8w,g_nw,x_428,y_143/watermark,image_YXNzZXQvaW1hZ2VzL21ldGFpbWFnZS1zb25nLnBuZw,g_nw,x_0,y_0",@ripplesmusic,音樂人,台北市,2015-11-01,2021-06-04 17:58,15,392,8,https://www.facebook.com/jewelsinging,https://www.instagram.com/jewel_chang/,https://www.youtube.com/channel/UC5_lZwl2CbcFbXrMuIZGM1w,Folk,"新的過去舊的還在 A New Past,Linger",https://streetvoice.com/ripplesmusic/songs/album/97325651/,,"這是專輯最後一首歌，也是這張專輯寫下的最後一首歌。「我覺得我已經來到下一章。」說出這句話時，腦中書寫的療癒之旅也即將告一段落。過去幾年的梳理，時而向前時而退縮的狀態，想要訴說自己故事卻又來不及準備好的不確定，在那一刻像是豁然開朗。在這場「輕輕安放」的過程，仁與也在專輯之旅結識許多好友，在母親離開後，繼續用音樂和夥伴們一起前行。歌曲最後的大合唱是這場旅程中重要的夥伴們和聲。即使走過辛苦的這一遭，如果重來。還是願意做妳的小孩。 作詞 Lyricist｜張仁與 Jewel Chang 作曲 Composer｜張仁與 Jewel Chang 製作人 Producer｜趙宇晨 Asa Chao 編曲 Arranger｜蔣希夷 XiYi. Jiang 配唱製作人 Vocal Producer｜吳浚瑋 Genwie Wu 吉他 Guitars｜蔣希夷 XiYi. Jiang 貝斯 Bass｜ Peter Wu 鼓組 Drums｜李欣樺 Hsin Hua Lee 鼓技師 Drums Technician｜莊開旭 Cash Chuang 單簧管 Clarinet｜高杰 J Geddes 長笛 Flute｜高杰 J Geddes 和聲編寫 Backing Vocal Arrangement｜張仁與 Jewel Chang、趙宇晨 Asa Chao 和音 Backing Vocals｜張仁與 Jewel Chang 合唱 Chorus｜趙廣絜 KJ、謝蕎 Chiao、蔣希夷 XiYi. Jiang、李欣樺 Hsin Hua Lee、簡小豪 Kán Siáu-hô、陳以恆 Layman C.、曾紀華 Horsey Tseng、峻豪 Bonobo 錄音師 Recording Engineer｜李詠恩 Joshua Lee (Drums) 、趙宇晨 Asa Chao (Others) 錄音室 Recording Studio｜荒原錄音室 Wasteland Studio、SIDEBon Studio 人聲音訊編輯 Vocal Editing｜林彥慶 Yen 混音工程師 Mixing Engineer｜趙宇晨 Asa Chao 母帶後期工程師 Mastering Engineer｜莊鈞智 Thomas Chuang 
這是專輯最後一首歌，也是這張專輯寫下的最後一首歌。「我覺得我已經來到下一章。」說出這句話時，腦中書寫的療癒之旅也即將告一段落。過去幾年的梳理，時而向前時而退縮的狀態，想要訴說自己故事卻又來不及準備好的不確定，在那一刻像是豁然開朗。在這場「輕輕安放」的過程，仁與也在專輯之旅結識許多好友，在母親離開後，繼續用音樂和夥伴們一起前行。歌曲最後的大合唱是這場旅程中重要的夥伴們和聲。即使走過辛苦的這一遭，如果重來。還是願意做妳的小孩。
作詞 Lyricist｜張仁與 Jewel Chang 作曲 Composer｜張仁與 Jewel Chang 製作人 Producer｜趙宇晨 Asa Chao 編曲 Arranger｜蔣希夷 XiYi. Jiang 配唱製作人 Vocal Producer｜吳浚瑋 Genwie Wu 吉他 Guitars｜蔣希夷 XiYi. Jiang 貝斯 Bass｜ Peter Wu 鼓組 Drums｜李欣樺 Hsin Hua Lee 鼓技師 Drums Technician｜莊開旭 Cash Chuang 單簧管 Clarinet｜高杰 J Geddes 長笛 Flute｜高杰 J Geddes 和聲編寫 Backing Vocal Arrangement｜張仁與 Jewel Chang、趙宇晨 Asa Chao 和音 Backing Vocals｜張仁與 Jewel Chang 合唱 Chorus｜趙廣絜 KJ、謝蕎 Chiao、蔣希夷 XiYi. Jiang、李欣樺 Hsin Hua Lee、簡小豪 Kán Siáu-hô、陳以恆 Layman C.、曾紀華 Horsey Tseng、峻豪 Bonobo 錄音師 Recording Engineer｜李詠恩 Joshua Lee (Drums) 、趙宇晨 Asa Chao (Others) 錄音室 Recording Studio｜荒原錄音室 Wasteland Studio、SIDEBon Studio 人聲音訊編輯 Vocal Editing｜林彥慶 Yen 混音工程師 Mixing Engineer｜趙宇晨 Asa Chao 母帶後期工程師 Mastering Engineer｜莊鈞智 Thomas Chuang","詞曲 / 張仁與 我感覺我已經到了下一章 從來不需要最完美的結尾 我不再想著怎麼做你才不失望 但偶爾還希望你在場 我想我能接受 你成為我無法癒合的傷疤 這一生 我相信你一直活在我身上 如果能夠重來 如果能夠選擇 再出生一次 我願意經歷這個循環 我不畏懼現在 還能嚮往未來 但我想我該 輕輕安放這份孤單 我終於能笑著提起你的事 他們都清楚你對我的重量 我不再想著無法解決的後悔 我不再賦予新的意義 我想我能接受 你成為我無法癒合的傷疤 這一生 我相信你一直活在我身上 如果能夠重來 如果能夠選擇 再出生一次 我願意經歷這個循環 我不畏懼現在 還能嚮往未來 但我想我該 輕輕安放這份孤單 
詞曲 / 張仁與
我感覺我已經到了下一章 從來不需要最完美的結尾 我不再想著怎麼做你才不失望 但偶爾還希望你在場
我想我能接受 你成為我無法癒合的傷疤 這一生 我相信你一直活在我身上
如果能夠重來 如果能夠選擇 再出生一次 我願意經歷這個循環
我不畏懼現在 還能嚮往未來 但我想我該 輕輕安放這份孤單
我終於能笑著提起你的事 他們都清楚你對我的重量 我不再想著無法解決的後悔 我不再賦予新的意義
我想我能接受 你成為我無法癒合的傷疤 這一生 我相信你一直活在我身上
如果能夠重來 如果能夠選擇 再出生一次 我願意經歷這個循環
我不畏懼現在 還能嚮往未來 但我想我該 輕輕安放這份孤單
留言（ 1 ） 最相關留言 所有留言
留言（ 1 ）",2026-07-10,,True,False,
