snapshot_time,rank,artist_name,song_title,likes_count,play_count,comments_count,song_url,artist_url,cover_image_url,artist_handle,artist_identity,artist_city,artist_joined_date,artist_accredited_datetime,artist_music_count,artist_fans_count,artist_following_count,artist_facebook_url,artist_instagram_url,artist_youtube_url,genre,album_title,album_url,collaborators,description,lyrics,release_date,song_accredited_datetime,is_editor_recommended,is_song_of_the_day,critic_review_url
2026-05-09 21:47:14,30,,,2,42,2,https://streetvoice.com/cat_tong_0507/songs/857724/,https://streetvoice.com/cat_tong_0507/,"https://akstatic.streetvoice.com/song_covers/ca/t_/cat_tong_0507/bjTm52dQH82qrUUbfKzBEQ.jpg?x-oss-process=image/resize,m_fixed,h_1,w_1,limit_0/resize,m_fixed,h_630,w_1200,limit_0/watermark,image_c29uZ19jb3ZlcnMvY2EvdF8vY2F0X3RvbmdfMDUwNy9ialRtNTJkUUg4MnFyVVViZkt6QkVRLmpwZz94LW9zcy1wcm9jZXNzPWltYWdlL3Jlc2l6ZSxtX2ZpeGVkLGhfMzQ0LHdfMzQ0LGxpbWl0XzA,g_nw,x_428,y_143/watermark,image_YXNzZXQvaW1hZ2VzL21ldGFpbWFnZS1zb25nLnBuZw,g_nw,x_0,y_0",@cat_tong_0507,音樂人,,,,2,27,7,,,https://www.youtube.com/user/StreetVoiceTV,Rock,,,,"喵- 編制： 電吉他：劉景元 貝斯：周安倪 鼓/KB/混音：張祐翔 詞/曲/主唱：李亮貓 
喵-
編制： 電吉他：劉景元 貝斯：周安倪 鼓/KB/混音：張祐翔 詞/曲/主唱：李亮貓","我點著頭 點著頭 配合演出習慣 不想思考 單純聽你說的「標準答案」 左耳進右耳出 他說這樣不乖 當初誰也是這樣熬過來 都別亂動 聽他說 那套成功典範 什麼都懂 你是對的我要專心發呆 努力一點 開口閉口早就成了習慣 笑著說：「ok 我會照辦（屁啦）」。 就認啦 他也不懂體諒 就唱吧 找不到那個 自己模樣 你誰啊？ 請你遠離我 別製造麻煩 你誰啊？ 憑什麼媽的管得很寬 你誰啊？ 隨便敷衍你 假裝好精彩 沒事就搖頭晃腦聽聽就好 反正已經早有答案 Rap. 說人生要有態度 具體是哪種態度 他們都說不清楚到底該是什麼要素 沒事想什麼幸福 好像那就是歸宿 請不要說著說著（斷點）欸你就想要哭 ：「聽我的準沒錯 這是成功唯一出路 眼淚不要太多 你就跟著我的腳步」 但我想說 喜歡掌握自己的人生自己做主 不需聽誰的話誰想法誰規定誰在乎 活成別人的路數 誰認啦 憑什麼要退讓 就唱吧 我試著活成 自己模樣 你誰啊？ 請你遠離我 別製造麻煩 你誰啊？ 憑什麼媽的管得很寬 你誰啊？ 隨便敷衍你 假裝好精彩 沒事就搖頭晃腦聽聽就好 反正已經早有答案 🎵 Ha ah 你誰啊？ 請你遠離我 別製造麻煩 你誰啊？ 憑什麼媽的管得很寬 你誰啊？ 隨便敷衍你 假裝好精彩 沒事就搖頭晃腦聽聽就好 反正已經早有答案 
我點著頭 點著頭 配合演出習慣 不想思考 單純聽你說的「標準答案」 左耳進右耳出 他說這樣不乖 當初誰也是這樣熬過來
都別亂動 聽他說 那套成功典範 什麼都懂 你是對的我要專心發呆 努力一點 開口閉口早就成了習慣 笑著說：「ok 我會照辦（屁啦）」。
就認啦 他也不懂體諒 就唱吧 找不到那個 自己模樣
你誰啊？ 請你遠離我 別製造麻煩 你誰啊？ 憑什麼媽的管得很寬 你誰啊？ 隨便敷衍你 假裝好精彩 沒事就搖頭晃腦聽聽就好 反正已經早有答案
Rap. 說人生要有態度 具體是哪種態度 他們都說不清楚到底該是什麼要素 沒事想什麼幸福 好像那就是歸宿 請不要說著說著（斷點）欸你就想要哭 ：「聽我的準沒錯 這是成功唯一出路 眼淚不要太多 你就跟著我的腳步」
但我想說 喜歡掌握自己的人生自己做主 不需聽誰的話誰想法誰規定誰在乎 活成別人的路數
誰認啦 憑什麼要退讓 就唱吧 我試著活成 自己模樣
你誰啊？ 請你遠離我 別製造麻煩 你誰啊？ 憑什麼媽的管得很寬 你誰啊？ 隨便敷衍你 假裝好精彩 沒事就搖頭晃腦聽聽就好 反正已經早有答案
🎵
Ha ah 你誰啊？ 請你遠離我 別製造麻煩 你誰啊？ 憑什麼媽的管得很寬 你誰啊？ 隨便敷衍你 假裝好精彩 沒事就搖頭晃腦聽聽就好 反正已經早有答案
留言（ 2 ） 最相關留言 所有留言
留言（ 2 ）",2026-05-08,,False,False,
2026-05-09 21:47:14,31,,,1,34,4,https://streetvoice.com/chupoband/songs/857635/,https://streetvoice.com/chupoband/,"https://akstatic.streetvoice.com/song_covers/ch/up/chupoband/GyPb2rKXWuWNvirzuda6ir.jpeg?x-oss-process=image/resize,m_fixed,h_1,w_1,limit_0/resize,m_fixed,h_630,w_1200,limit_0/watermark,image_c29uZ19jb3ZlcnMvY2gvdXAvY2h1cG9iYW5kL0d5UGIycktYV3VXTnZpcnp1ZGE2aXIuanBlZz94LW9zcy1wcm9jZXNzPWltYWdlL3Jlc2l6ZSxtX2ZpeGVkLGhfMzQ0LHdfMzQ0LGxpbWl0XzA,g_nw,x_428,y_143/watermark,image_YXNzZXQvaW1hZ2VzL21ldGFpbWFnZS1zb25nLnBuZw,g_nw,x_0,y_0",@chupoband,音樂人,,,2023-06-13 16:24,3,191,,https://www.facebook.com/chupoband,https://www.instagram.com/chupoband/,https://youtube.com/@chupoband,Rock,,,,,"說不清的話 請就別再藏著 說不清的話 只等靜靜看著 熄燈以前 ⽤無能的語彙補洞 說不清的話 請就別再講了 說不清的話 要比疼痛難忍 燉煮餘暉 留多的明天過冬 你說危險要想念再清醒⼀點 你說危險要毀滅再靠近⼀點 可能終點是反覆無常在表演 清算我們的不安 你說危險很慚愧連夢都抱怨 你說危險要純潔都⾃慚形穢 濾出汙點 只有最空洞的諾⾔ 有成堆的苦難重現 你說危險要想念再清醒⼀點 你說危險要毀滅再靠近⼀點 可能終點是反覆無常在表演 清算我們的愛 你說危險很慚愧連夢都抱怨 你說危險要純潔都⾃慚形穢 濾出汙點 只有最空洞的諾⾔ 有成堆的苦難重現 
說不清的話 請就別再藏著 說不清的話 只等靜靜看著 熄燈以前 ⽤無能的語彙補洞 說不清的話 請就別再講了 說不清的話 要比疼痛難忍 燉煮餘暉 留多的明天過冬
你說危險要想念再清醒⼀點 你說危險要毀滅再靠近⼀點 可能終點是反覆無常在表演 清算我們的不安 你說危險很慚愧連夢都抱怨 你說危險要純潔都⾃慚形穢 濾出汙點 只有最空洞的諾⾔ 有成堆的苦難重現
你說危險要想念再清醒⼀點 你說危險要毀滅再靠近⼀點 可能終點是反覆無常在表演 清算我們的愛 你說危險很慚愧連夢都抱怨 你說危險要純潔都⾃慚形穢 濾出汙點 只有最空洞的諾⾔ 有成堆的苦難重現
留言（ 4 ） 最相關留言 所有留言
留言（ 4 ）",2026-05-07,,True,False,
2026-05-09 21:47:14,32,,,3,49,4,https://streetvoice.com/ismewen/songs/857760/,https://streetvoice.com/ismewen/,"https://akstatic.streetvoice.com/song_covers/is/me/ismewen/959yXsDPgiDZcq8ezLtQpX.jpg?x-oss-process=image/resize,m_fixed,h_1,w_1,limit_0/resize,m_fixed,h_630,w_1200,limit_0/watermark,image_c29uZ19jb3ZlcnMvaXMvbWUvaXNtZXdlbi85NTl5WHNEUGdpRFpjcThlekx0UXBYLmpwZz94LW9zcy1wcm9jZXNzPWltYWdlL3Jlc2l6ZSxtX2ZpeGVkLGhfMzQ0LHdfMzQ0LGxpbWl0XzA,g_nw,x_428,y_143/watermark,image_YXNzZXQvaW1hZ2VzL21ldGFpbWFnZS1zb25nLnBuZw,g_nw,x_0,y_0",@ismewen,音樂人,,,,,4,1,,,https://www.youtube.com/user/StreetVoiceTV,Rock,,,,,"我握著你的手 想待在你身邊 簇擁一朵玫瑰 格外鮮紅 手掌的皮膚 一陣刺痛 我怕你流血 把多刺的花柄給你有多危險 但你說你被我愛著 血色的花瓣 充滿幻覺的危險 如果愛可能不是愛 如果連你我都沒辦法愛 抱緊了一束玫瑰 嘗試著理解什麼是愛 趁我們還開心 趁幸福還可以是現在 試著不再繼續無法對你依賴 拒絕承認玫瑰的鮮紅 在愛意之後會是重傷的血紅 我握著你的手 想待在你身邊 為什麼你明明在我身邊 孤單還在縈繞在我的另一邊 但你說你被我愛著 血色的花瓣 充滿幻覺的危險 如果愛可能不是愛 如果連你我都沒辦法愛 抱緊了一束玫瑰 嘗試著理解什麼是愛 趁我們還開心 趁幸福還可以是現在 試著不再繼續無法對你依賴 拒絕承認玫瑰的鮮紅 在愛意之後會是重傷的血紅 趁我們還開心 趁幸福還可以是現在 試著不再繼續無法對你依賴 拒絕承認玫瑰的鮮紅 在愛意之後會是重傷的血紅 
我握著你的手 想待在你身邊 簇擁一朵玫瑰 格外鮮紅 手掌的皮膚 一陣刺痛 我怕你流血 把多刺的花柄給你有多危險
但你說你被我愛著 血色的花瓣 充滿幻覺的危險 如果愛可能不是愛 如果連你我都沒辦法愛 抱緊了一束玫瑰 嘗試著理解什麼是愛
趁我們還開心 趁幸福還可以是現在 試著不再繼續無法對你依賴 拒絕承認玫瑰的鮮紅 在愛意之後會是重傷的血紅
我握著你的手 想待在你身邊 為什麼你明明在我身邊 孤單還在縈繞在我的另一邊
但你說你被我愛著 血色的花瓣 充滿幻覺的危險 如果愛可能不是愛 如果連你我都沒辦法愛 抱緊了一束玫瑰 嘗試著理解什麼是愛
趁我們還開心 趁幸福還可以是現在 試著不再繼續無法對你依賴 拒絕承認玫瑰的鮮紅 在愛意之後會是重傷的血紅
趁我們還開心 趁幸福還可以是現在 試著不再繼續無法對你依賴 拒絕承認玫瑰的鮮紅 在愛意之後會是重傷的血紅
留言（ 4 ） 最相關留言 所有留言
留言（ 4 ）",2026-05-08,,False,False,
2026-05-09 21:47:14,33,,,3,100,0,https://streetvoice.com/HugMuzik/songs/857758/,https://streetvoice.com/HugMuzik/,"https://akstatic.streetvoice.com/song_covers/Hu/gM/HugMuzik/3UWq8eo7XCvVrkBQP2Zq7L.jpeg?x-oss-process=image/resize,m_fixed,h_1,w_1,limit_0/resize,m_fixed,h_630,w_1200,limit_0/watermark,image_c29uZ19jb3ZlcnMvSHUvZ00vSHVnTXV6aWsvM1VXcThlbzdYQ3ZWcmtCUVAyWnE3TC5qcGVnP3gtb3NzLXByb2Nlc3M9aW1hZ2UvcmVzaXplLG1fZml4ZWQsaF8zNDQsd18zNDQsbGltaXRfMA,g_nw,x_428,y_143/watermark,image_YXNzZXQvaW1hZ2VzL21ldGFpbWFnZS1zb25nLnBuZw,g_nw,x_0,y_0",@HugMuzik,音樂人,彰化縣,2008-05-01,2025-07-24 17:13,2,15,1,https://www.facebook.com/hugmuzik,https://www.instagram.com/hug_muzik,https://youtube.com/@racioix,Alternative,,,,"「孤獨」與「情感渴望」是詐騙的敲門磚，那些假扮的天使，演出一場為你/妳量身打造的愛情戲碼。 -- 製作：曾立馨Hug Muzik 詞/曲-曾立馨 立馨-主唱/合聲 布萊恩-電貝斯 井上-電吉他 阿志-鼓 晴儀-椰子弦 Jerry-鍵盤 承晏-錄音/混音 封面圖/AI產出 
「孤獨」與「情感渴望」是詐騙的敲門磚，那些假扮的天使，演出一場為你/妳量身打造的愛情戲碼。 -- 製作：曾立馨Hug Muzik 詞/曲-曾立馨 立馨-主唱/合聲 布萊恩-電貝斯 井上-電吉他 阿志-鼓 晴儀-椰子弦 Jerry-鍵盤 承晏-錄音/混音 封面圖/AI產出","警察先生ioh 我無予人騙ooh 你毋通誤會 警察先生ioh 阮是真真正正的愛人ooh 佇~鬱卒的早起　齷齪的熱天 是伊 予我寬心 佇~痛疼的暗暝　孤單的寒天 是伊 付出情意 無人親像伊 予我安~~慰 無人親像伊 共我關~~心 無人親像伊 予我安~~慰 無人親像伊 共我關~~心 Dorian Hey 假扮的天使 (華語和聲) 警察先生ioh 我的愛人無拄好欠錢ooh 警察先生ioh 伊說過二工就還我囉 我的愛人是大頭家 有田有地有車有船有公司嘛有十條街 莫講一百萬 二百萬 抑是一千萬 對伊來講攏簡單簡單 佇彼个 鬱卒的早起 彼个齷齪的熱天 是伊 予我寬心 佇彼个 痛疼的暗暝 彼个孤單的寒天 是伊 共阮安慰 安~~慰~~安~~慰~~有關心 警察先生ioh 我無予人騙ooh 你毋通誤會 警察先生ioh 伊趕緊欲用錢囉 無人親像伊 予我安~~慰  無人親像伊 共我關~~心 無人親像伊 予我安~~慰  無人親像伊 共我關~~心 假使伊真正是一個騙子 嘛是一個愛情的騙子 真正對我好 共我照三頓 あいさつ 我的大姨媽來的時陣 伊會叫foodpada 送來紅豆湯 彼時陣爸爸媽媽佇佗位？ 親情五十又閣佇佗位？ 
警察先生ioh 我無予人騙ooh 你毋通誤會 警察先生ioh 阮是真真正正的愛人ooh
佇~鬱卒的早起　齷齪的熱天 是伊 予我寬心 佇~痛疼的暗暝　孤單的寒天 是伊 付出情意
無人親像伊 予我安~~慰 無人親像伊 共我關~~心 無人親像伊 予我安~~慰 無人親像伊 共我關~~心
Dorian Hey 假扮的天使 (華語和聲)
警察先生ioh 我的愛人無拄好欠錢ooh 警察先生ioh 伊說過二工就還我囉 我的愛人是大頭家 有田有地有車有船有公司嘛有十條街 莫講一百萬 二百萬 抑是一千萬 對伊來講攏簡單簡單
佇彼个 鬱卒的早起 彼个齷齪的熱天 是伊 予我寬心 佇彼个 痛疼的暗暝 彼个孤單的寒天 是伊 共阮安慰 安~~慰~~安~~慰~~有關心
警察先生ioh 我無予人騙ooh 你毋通誤會 警察先生ioh 伊趕緊欲用錢囉 無人親像伊 予我安~~慰  無人親像伊 共我關~~心 無人親像伊 予我安~~慰  無人親像伊 共我關~~心
假使伊真正是一個騙子 嘛是一個愛情的騙子 真正對我好 共我照三頓 あいさつ 我的大姨媽來的時陣 伊會叫foodpada 送來紅豆湯 彼時陣爸爸媽媽佇佗位？ 親情五十又閣佇佗位？
留言（ 0 ） 最相關留言 所有留言
留言（ 0 ）",2026-05-08,,True,False,
2026-05-09 21:47:14,34,,,4,69,0,https://streetvoice.com/laciffoncoi/songs/858031/,https://streetvoice.com/laciffoncoi/,"https://akstatic.streetvoice.com/song_covers/la/ci/laciffoncoi/X6M44cXcdXTohRrnoAf8dc.jpeg?x-oss-process=image/resize,m_fixed,h_1,w_1,limit_0/resize,m_fixed,h_630,w_1200,limit_0/watermark,image_c29uZ19jb3ZlcnMvbGEvY2kvbGFjaWZmb25jb2kvWDZNNDRjWGNkWFRvaFJybm9BZjhkYy5qcGVnP3gtb3NzLXByb2Nlc3M9aW1hZ2UvcmVzaXplLG1fZml4ZWQsaF8zNDQsd18zNDQsbGltaXRfMA,g_nw,x_428,y_143/watermark,image_YXNzZXQvaW1hZ2VzL21ldGFpbWFnZS1zb25nLnBuZw,g_nw,x_0,y_0",@laciffoncoi,音樂人,新北市,2020-08-01,2025-05-19 14:12,7,118,3,,https://www.instagram.com/laciffoncoi/,https://www.youtube.com/user/StreetVoiceTV,Rock,,,,,"I guess that’s enough That’s enough That’s enough Now you don’t Feel it, don’t you? Roll back the fine line Now I’m far Far from the scene No I don’t Feel it. Don’t you? Crime Scene Over daylight Says I, ‘She’s currently under a mission.’ 
I guess that’s enough That’s enough That’s enough Now you don’t Feel it, don’t you?
Roll back the fine line Now I’m far Far from the scene No I don’t Feel it. Don’t you?
Crime Scene Over daylight Says I, ‘She’s currently under a mission.’
留言（ 0 ） 最相關留言 所有留言
留言（ 0 ）",2026-05-08,,False,False,
2026-05-09 21:47:14,35,,,5,273,0,https://streetvoice.com/badlarry/songs/857527/,https://streetvoice.com/badlarry/,"https://akstatic.streetvoice.com/song_covers/ba/dl/badlarry/RmJxjTqzU4d8Nt27haNL4U.jpg?x-oss-process=image/resize,m_fixed,h_1,w_1,limit_0/resize,m_fixed,h_630,w_1200,limit_0/watermark,image_c29uZ19jb3ZlcnMvYmEvZGwvYmFkbGFycnkvUm1KeGpUcXpVNGQ4TnQyN2hhTkw0VS5qcGc_eC1vc3MtcHJvY2Vzcz1pbWFnZS9yZXNpemUsbV9maXhlZCxoXzM0NCx3XzM0NCxsaW1pdF8w,g_nw,x_428,y_143/watermark,image_YXNzZXQvaW1hZ2VzL21ldGFpbWFnZS1zb25nLnBuZw,g_nw,x_0,y_0",@badlarry,音樂人,台北市,2022-03-01,2023-05-16 14:35,1,17,1,https://www.facebook.com/profile.php?id=100076981923425,https://www.instagram.com/badlarrytw/,https://www.youtube.com/@badlarrytw,Rock,,,,"whyusosAd. 
whyusosAd.","熱烈的心 被寂寞綁票 空虛趁機 蔓延到手腳 為什麼會在人群中流浪 三月的枝枒不懂冬天的花 身邊的人是誰 已經都不要緊 任你塗改撕毀 墨水早已滲入的信 我知道曾經的 所有的衝動和感動 都是真的 身邊的人是誰 都不會再是你 冷冽的風把我給吹醒 思念是退不去的酒精 還在我心門徘徊 明知道還是在 沈淪在欲蓋彌彰的狂歡 時間無法掩埋空洞的期盼 (I don’t wanna move on) tho I really know that I can’t outrun 我的心卻還在為你空轉 身邊的人是誰 已經都不要緊 任你塗改撕毀 墨水早已滲入的信 我知道曾經的 所有的衝動和感動 都是真的 身邊的人是誰 都不會再是你 都不會再是你 都不會再是 我知道曾經的 所有的衝動和感動 都是真的 身邊的人是誰 已經都不要緊 任你塗改撕毀 墨水早已滲入的信 我知道曾經的 所有的衝動和感動 都是真的 身邊的人是誰 都不會再是你 
熱烈的心 被寂寞綁票 空虛趁機 蔓延到手腳 為什麼會在人群中流浪 三月的枝枒不懂冬天的花
身邊的人是誰 已經都不要緊 任你塗改撕毀 墨水早已滲入的信 我知道曾經的 所有的衝動和感動 都是真的 身邊的人是誰 都不會再是你
冷冽的風把我給吹醒 思念是退不去的酒精 還在我心門徘徊 明知道還是在 沈淪在欲蓋彌彰的狂歡 時間無法掩埋空洞的期盼 (I don’t wanna move on) tho I really know that I can’t outrun 我的心卻還在為你空轉
身邊的人是誰 已經都不要緊 任你塗改撕毀 墨水早已滲入的信 我知道曾經的 所有的衝動和感動 都是真的 身邊的人是誰 都不會再是你 都不會再是你 都不會再是
我知道曾經的 所有的衝動和感動 都是真的
身邊的人是誰 已經都不要緊 任你塗改撕毀 墨水早已滲入的信 我知道曾經的 所有的衝動和感動 都是真的 身邊的人是誰 都不會再是你
留言（ 0 ） 最相關留言 所有留言
留言（ 0 ）",2026-05-07,,True,False,
2026-05-09 21:47:14,36,,,14,1679,4,https://streetvoice.com/hoaaa0130/songs/857488/,https://streetvoice.com/hoaaa0130/,"https://akstatic.streetvoice.com/song_covers/ho/aa/hoaaa0130/SDug8AhV6e8ZT2W9yRUD69.jpg?x-oss-process=image/resize,m_fixed,h_1,w_1,limit_0/resize,m_fixed,h_630,w_1200,limit_0/watermark,image_c29uZ19jb3ZlcnMvaG8vYWEvaG9hYWEwMTMwL1NEdWc4QWhWNmU4WlQyVzl5UlVENjkuanBnP3gtb3NzLXByb2Nlc3M9aW1hZ2UvcmVzaXplLG1fZml4ZWQsaF8zNDQsd18zNDQsbGltaXRfMA,g_nw,x_428,y_143/watermark,image_YXNzZXQvaW1hZ2VzL21ldGFpbWFnZS1zb25nLnBuZw,g_nw,x_0,y_0",@hoaaa0130,音樂人,台北市,2026-04-01,,,,,,,https://www.youtube.com/user/StreetVoiceTV,Singer / Songwriter,,,,"你受夠天天被困在教室的生活了嗎 反正我受夠了 我現在就去海邊😛😛 作詞人：池子 作曲人：池子 製作人：陳宇翰 錄音、混音、母帶：陳宇翰 爵士鼓編曲人：吳政哲 
你受夠天天被困在教室的生活了嗎 反正我受夠了 我現在就去海邊😛😛 作詞人：池子 作曲人：池子 製作人：陳宇翰 錄音、混音、母帶：陳宇翰 爵士鼓編曲人：吳政哲","又到了凌晨的四點半 夢卻還不真實 清晨正在向我奔跑 也已經控制不了 喔今天不想上學 因為我要去海邊 看看那些風景 能否為了 我而不改變 不想再看簡報 只想胡鬧 想要逃離這座城堡 我說嘿 要不要去海邊 太多太多的四季 還卡在我的夢裡 就怕明天來不及 讓我再見你 望著你 思緒在飄逸 會不會 跟我 一起揭開謎底 喔今天不想上學 只想跟你去海邊 看看那些風景 能否為了 我們不改變 不想再看簡報 只想胡鬧 想要點頭對你說好 你說嘿 要不要去海邊 喔今天不想上學 只想跟你去海邊 看看那些風景 能否為 了 我們不改變 快放上行程表 不能出包 這次要當自己主角 你說嘿 要不要去海邊 
又到了凌晨的四點半 夢卻還不真實 清晨正在向我奔跑 也已經控制不了
喔今天不想上學 因為我要去海邊 看看那些風景 能否為了 我而不改變 不想再看簡報 只想胡鬧 想要逃離這座城堡 我說嘿 要不要去海邊
太多太多的四季 還卡在我的夢裡 就怕明天來不及 讓我再見你
望著你 思緒在飄逸 會不會 跟我 一起揭開謎底
喔今天不想上學 只想跟你去海邊 看看那些風景 能否為了 我們不改變 不想再看簡報 只想胡鬧 想要點頭對你說好 你說嘿 要不要去海邊
喔今天不想上學 只想跟你去海邊 看看那些風景 能否為 了 我們不改變 快放上行程表 不能出包 這次要當自己主角 你說嘿 要不要去海邊
留言（ 4 ） 最相關留言 所有留言
留言（ 4 ）",2026-05-06,,False,False,
2026-05-09 21:47:14,37,,,7,517,7,https://streetvoice.com/happyland/songs/857731/,https://streetvoice.com/happyland/,"https://akstatic.streetvoice.com/song_covers/ha/pp/happyland/9QbcqhXVXYEwmPJWXqCkze.jpeg?x-oss-process=image/resize,m_fixed,h_1,w_1,limit_0/resize,m_fixed,h_630,w_1200,limit_0/watermark,image_c29uZ19jb3ZlcnMvaGEvcHAvaGFwcHlsYW5kLzlRYmNxaFhWWFlFd21QSldYcUNremUuanBlZz94LW9zcy1wcm9jZXNzPWltYWdlL3Jlc2l6ZSxtX2ZpeGVkLGhfMzQ0LHdfMzQ0LGxpbWl0XzA,g_nw,x_428,y_143/watermark,image_YXNzZXQvaW1hZ2VzL21ldGFpbWFnZS1zb25nLnBuZw,g_nw,x_0,y_0",@happyland,音樂人,台北市,2026-04-01,,2,8,,,,https://www.youtube.com/user/StreetVoiceTV,Rock,,,,"〈寶座〉沒有含著金湯匙，靠我自己打寶座，生不帶來何物，靠著自己的信念、意志、霸氣成為王，結合Rap以及磅礴史詩般的氛圍呈現征途之路。 
〈寶座〉沒有含著金湯匙，靠我自己打寶座，生不帶來何物，靠著自己的信念、意志、霸氣成為王，結合Rap以及磅礴史詩般的氛圍呈現征途之路。","Verse1: 沒有含著金湯匙 靠我自己打寶座 無名的小丑 演著沒有人會想看的show Show me the money 好像到底道理多了不起 香檳名利那不過是浮雲而已 30而立男子漢頂天立地 成功的路上會佈滿荊棘 保持信心維持冷靜 會不斷的持續著出現著眼紅的 hater 那些虛偽的假裝著為你好噁心的 其實是想害你的Faker Pre chorus: Born a king, I fear no challenges Chorus: The king’s fire is rising to the sky I feel my power wild burning now （burning now burning now） My name is written by my own two hands No one else can ever bring me down today Verse2 沒有含著金湯匙 靠我自己打寶座 無名的小丑 演著沒有人會想看的show Show me the money 好像到底道理多了不起 香檳名利那不過是浮雲而已 30而立男子漢頂天立地 成功的路上會佈滿荊棘 保持 信心 維持冷靜 會不斷的持續著出現著眼紅的 hater 那些虛偽的假裝著為你好噁心的 其實是想害你的Faker Chorus 2 The king’s fire is rising to the sky I feel my power wild burning now （burning now burning now） My name is written by my own two hands No one else can ever bring me down today Chorus3 The king’s fire is rising to the sky I feel my power wild My name is written by my own two hands No one else can ever Chorus 4 The king’s fire is rising to the sky I feel my power wild burning now （burning now burning now） My name is written by my own two hands No one else can ever bring me down today 
Verse1: 沒有含著金湯匙 靠我自己打寶座 無名的小丑 演著沒有人會想看的show Show me the money 好像到底道理多了不起 香檳名利那不過是浮雲而已 30而立男子漢頂天立地 成功的路上會佈滿荊棘 保持信心維持冷靜 會不斷的持續著出現著眼紅的 hater 那些虛偽的假裝著為你好噁心的 其實是想害你的Faker
Pre chorus: Born a king, I fear no challenges
Chorus: The king’s fire is rising to the sky I feel my power wild burning now （burning now burning now） My name is written by my own two hands No one else can ever bring me down today
Verse2 沒有含著金湯匙 靠我自己打寶座 無名的小丑 演著沒有人會想看的show Show me the money 好像到底道理多了不起 香檳名利那不過是浮雲而已 30而立男子漢頂天立地 成功的路上會佈滿荊棘 保持 信心 維持冷靜 會不斷的持續著出現著眼紅的 hater 那些虛偽的假裝著為你好噁心的 其實是想害你的Faker
Chorus 2 The king’s fire is rising to the sky I feel my power wild burning now （burning now burning now） My name is written by my own two hands No one else can ever bring me down today
Chorus3 The king’s fire is rising to the sky I feel my power wild My name is written by my own two hands No one else can ever
Chorus 4 The king’s fire is rising to the sky I feel my power wild burning now （burning now burning now） My name is written by my own two hands No one else can ever bring me down today
留言（ 7 ） 最相關留言 所有留言
留言（ 7 ）",2026-05-08,,False,False,
