snapshot_time,rank,artist_name,song_title,likes_count,play_count,comments_count,song_url,artist_url,cover_image_url,artist_handle,artist_identity,artist_city,artist_joined_date,artist_accredited_datetime,artist_music_count,artist_fans_count,artist_following_count,artist_facebook_url,artist_instagram_url,artist_youtube_url,genre,album_title,album_url,collaborators,description,lyrics,release_date,song_accredited_datetime,is_editor_recommended,is_song_of_the_day,critic_review_url
2026-05-09 21:47:14,9,,,2,171,2,https://streetvoice.com/bubbletea20260321/songs/857501/,https://streetvoice.com/bubbletea20260321/,"https://akstatic.streetvoice.com/song_covers/bu/bb/bubbletea20260321/XRjjANZhThWWaB3KUe8rgZ.jpeg?x-oss-process=image/resize,m_fixed,h_1,w_1,limit_0/resize,m_fixed,h_630,w_1200,limit_0/watermark,image_c29uZ19jb3ZlcnMvYnUvYmIvYnViYmxldGVhMjAyNjAzMjEvWFJqakFOWmhUaFdXYUIzS1VlOHJnWi5qcGVnP3gtb3NzLXByb2Nlc3M9aW1hZ2UvcmVzaXplLG1fZml4ZWQsaF8zNDQsd18zNDQsbGltaXRfMA,g_nw,x_428,y_143/watermark,image_YXNzZXQvaW1hZ2VzL21ldGFpbWFnZS1zb25nLnBuZw,g_nw,x_0,y_0",@bubbletea20260321,音樂人,台灣,2026-03-01,,2,12,2,,,https://www.youtube.com/user/StreetVoiceTV,Alternative,,,YOSHI、Yu Chiao、樂承宇 Yue Yu、幽冥券,"𝗟𝘆𝗿𝗶𝗰𝗶𝘀𝘁 & 𝗖𝗼𝗺𝗽𝗼𝘀𝗲𝗿｜𝗕𝘂𝗯𝗯𝗹𝗲 𝗧𝗲𝗮 𝗔𝗿𝗿𝗮𝗻𝗴𝗲𝗺𝗲𝗻𝘁｜𝗬𝗢𝗦𝗛𝗜 𝗚𝘂𝗶𝘁𝗮𝗿｜𝗬𝘂𝗲 𝗬𝘂 𝗞𝗲𝘆𝘀 / 𝗦𝘆𝗻𝘁𝗵｜𝗬𝗢𝗦𝗛𝗜 𝗗𝗿𝘂𝗺𝘀｜𝗬𝘂-𝗖𝗵𝗶𝗮𝗼 𝗧𝗮𝗻𝗴 𝗕𝗮𝘀𝘀 | 𝗕𝗶𝗿𝗱𝘆.𝗖 𝗠𝗜𝗫 | 𝘁𝘇𝘂𝗱𝗮𝗻 𝗦𝘂 
𝗟𝘆𝗿𝗶𝗰𝗶𝘀𝘁 & 𝗖𝗼𝗺𝗽𝗼𝘀𝗲𝗿｜𝗕𝘂𝗯𝗯𝗹𝗲 𝗧𝗲𝗮
𝗔𝗿𝗿𝗮𝗻𝗴𝗲𝗺𝗲𝗻𝘁｜𝗬𝗢𝗦𝗛𝗜 𝗚𝘂𝗶𝘁𝗮𝗿｜𝗬𝘂𝗲 𝗬𝘂 𝗞𝗲𝘆𝘀 / 𝗦𝘆𝗻𝘁𝗵｜𝗬𝗢𝗦𝗛𝗜 𝗗𝗿𝘂𝗺𝘀｜𝗬𝘂-𝗖𝗵𝗶𝗮𝗼 𝗧𝗮𝗻𝗴 𝗕𝗮𝘀𝘀 | 𝗕𝗶𝗿𝗱𝘆.𝗖 𝗠𝗜𝗫 | 𝘁𝘇𝘂𝗱𝗮𝗻 𝗦𝘂","𝕍𝟙 𝗔𝗳𝘁𝗲𝗿 𝗽𝗮𝗿𝘁𝘆'𝘀 𝗰𝗿𝗼𝘄𝗱𝗲𝗱, 𝗹𝗶𝗴𝗵𝘁𝘀 𝗯𝘂𝗿𝗻𝗶𝗻𝗴 𝗺𝘆 𝗲𝘆𝗲𝘀 𝗧𝗼𝗼 𝗺𝗮𝗻𝘆 𝗯𝗼𝗱𝗶𝗲𝘀, 𝗻𝗼 𝘀𝗽𝗮𝗰𝗲 𝘁𝗼 𝗵𝗶𝗱𝗲 𝗜𝘀 𝗱𝗮 𝗳𝗹𝗼𝗼𝗿 𝘀𝗽𝗶𝗻𝗻𝗶𝗻𝗴, 𝗼𝗿 𝗶𝘀 𝗶𝘁 𝗺𝘆 𝗺𝗶𝗻𝗱? 𝗟𝗼𝘀𝘁 𝗶𝗻𝘀𝗶𝗱𝗲 𝗱𝗮 𝘃𝗲𝗻𝘂𝗲, 𝘁𝘂𝗿𝗻𝗶𝗻𝗴 𝗰𝗶𝗿𝗰𝗹𝗲𝘀 𝗮𝗹𝗹 𝗻𝗶𝗴𝗵𝘁 ℂ𝟙 𝗔𝗻𝗱 𝗜 𝘀𝗲𝗲 𝘆𝗼𝘂 𝗳𝗿𝗼𝗺 𝗱𝗮 𝗱𝗼𝗼𝗿 𝗬𝗼𝘂𝗿 𝘀𝗽𝗮𝗿𝗸 𝗜 𝗰𝗮𝗻'𝘁 𝗶𝗴𝗻𝗼𝗿𝗲 𝗘𝘃𝗲𝗿𝘆 𝗻𝗲𝗿𝘃𝗲 𝗶𝘀 𝘀𝗰𝗿𝗲𝗮𝗺𝗶𝗻𝗴 - 𝗜'𝘃𝗲 𝗯𝗲𝗲𝗻 𝗵𝗲𝗿𝗲 𝗯𝗲𝗳𝗼𝗿𝗲 𝗙𝗼𝗿𝗴𝗼𝘁 𝗺𝘆 𝗼𝘄𝗻 𝗻𝗮𝗺𝗲 𝗢𝗵 𝗜 𝘀𝗮𝘆 ""𝗛𝗲𝘆, 𝗵𝗼𝘄 𝗮𝗿𝗲 𝘆𝗼𝘂?"" ""𝗛𝗲𝗹𝗹𝗼, 你好” 𝗡𝗼, 𝗻𝗼𝘁 𝗰𝗼𝗼𝗹 𝗡𝗼 𝘄𝗼𝗿𝗿𝗶𝗲𝘀, 𝗜𝗺𝗺𝗮 𝗳𝗼𝗼𝗹 𝗬𝗼𝘂'𝗿𝗲 𝗱𝗮 𝗾𝘂𝗶𝗲𝘁 𝗜 𝗱𝗲𝘀𝗶𝗿𝗲 𝗜 𝘄𝗮𝗻𝗻𝗮 𝘀𝘁𝗮𝗻𝗱 𝗿𝗶𝗴𝗵𝘁 𝘁𝗵𝗲𝗿𝗲 𝗔𝗻𝗱 𝗜 𝗰𝗮𝗻'𝘁 𝗳𝗼𝗿𝗴𝗲𝘁 𝘆𝗼𝘂𝗿 𝗳𝗮𝗰𝗲 𝗪𝗵𝗲𝗻 𝘆𝗼𝘂'𝗿𝗲 𝗴𝗹𝗮𝗻𝗰𝗶𝗻𝗴 𝗼𝘃𝗲𝗿 𝗵𝗲𝗿𝗲 𝗪𝗵𝗮𝘁 𝗰𝗮𝗻 𝗜 𝘀𝗮𝘆? ""𝗛𝗲𝘆, 𝗵𝗼𝘄 𝗮𝗿𝗲 𝘆𝗼𝘂?"" ""こんにちは"" 𝗡𝗼𝘁 𝗰𝗼𝗼𝗹 𝗟𝗲𝗮𝘃𝗶𝗻𝗴 𝗮𝗹𝗹 𝗺𝘆 𝗰𝗮𝗿𝗲𝘀, 𝗹𝗲𝘁 𝗱𝗮 𝗺𝘂𝘀𝗶𝗰 𝘁𝗮𝗸𝗲 𝗰𝗼𝗻𝘁𝗿𝗼𝗹 𝔹𝕣𝕚𝕕𝕘𝕖 𝗝𝘂𝘀𝘁 𝗹𝗲𝘁 𝘁𝗵𝗲𝗺 𝗰𝗵𝗮𝘀𝗲 𝗮𝗳𝘁𝗲𝗿 𝗱𝗮 𝗳𝗹𝗮𝘀𝗵𝗲𝘀 𝗮𝗻𝗱 𝗵𝗮𝘃𝗲 𝗮 𝗰𝗿𝗮𝘇𝘆 𝗻𝗶𝗴𝗵𝘁 𝗜 𝘄𝗶𝘀𝗵 𝗜 𝗰𝗼𝘂𝗹𝗱 𝗷𝘂𝘀𝘁 𝗳𝗿𝗲𝗲𝘇𝗲 𝘁𝗶𝗺𝗲 𝗔𝗻𝗱 𝗹𝗲𝗮𝘃𝗲 𝗶𝘁 𝗮𝗹𝗹 𝗯𝗲𝗵𝗶𝗻𝗱 𝕍𝟚 𝗔𝗹𝗹 𝘁𝗵𝗲 𝗽𝗮𝗿𝘁𝘆'𝘀 𝗰𝗿𝗼𝘄𝗱𝗲𝗱, 𝗹𝗶𝗴𝗵𝘁𝘀 𝗯𝘂𝗿𝗻𝗶𝗻𝗴 𝗺𝘆 𝗲𝘆𝗲𝘀 𝗟𝗶𝗸𝗲 𝗮𝗻 𝗮𝗰𝘁𝗼𝗿 𝗼𝗻 𝘀𝘁𝗮𝗴𝗲, 𝘄𝗵𝗮𝘁'𝘀 𝗺𝘆 𝗻𝗲𝘅𝘁 𝗹𝗶𝗻𝗲? 𝗜𝘀 𝘁𝗵𝗲𝗿𝗲 𝗮 𝗰𝗵𝗮𝗻𝗰𝗲 𝘁𝗵𝗮𝘁, 𝘆𝗼𝘂'𝗱 𝗲𝘃𝗲𝗻 𝗹𝗼𝗼𝗸 𝘁𝘄𝗶𝗰𝗲? 𝗢𝗿 𝗶𝘀 𝘁𝗵𝗮𝘁 𝗷𝘂𝘀𝘁 𝗮 𝘁𝗿𝗶𝗰𝗸 𝗳𝗿𝗼𝗺 𝘁𝗵𝗲 𝗳𝗹𝗮𝘀𝗵𝗶𝗻𝗴 𝗹𝗶𝗴𝗵𝘁𝘀 ℂ𝟚 𝗜 𝘀𝗲𝗲 𝘆𝗼𝘂 𝗳𝗿𝗼𝗺 𝗱𝗮 𝗱𝗼𝗼𝗿 𝗬𝗼𝘂’𝗿𝗲 𝗮 𝘀𝗽𝗮𝗿𝗸  — 𝘆𝗲𝘀, 𝘀𝗼𝗺𝗲𝘁𝗵𝗶𝗻𝗴 𝗺𝗼𝗿𝗲 𝗘𝘃𝗲𝗿𝘆 𝗻𝗲𝗿𝘃𝗲 𝗶𝘀 𝘀𝗰𝗿𝗲𝗮𝗺𝗶𝗻𝗴 - 𝗜'𝘃𝗲 𝗯𝗲𝗲𝗻 𝗵𝗲𝗿𝗲 𝗯𝗲𝗳𝗼𝗿𝗲 𝗪𝗮𝗻𝗻𝗮 𝗸𝗻𝗼𝘄 𝘆𝗼𝘂𝗿 𝗻𝗮𝗺𝗲 𝗜 𝘀𝗮𝘆""𝗛𝗲𝘆, 𝗛𝗼𝘄 𝗮𝗿𝗲 𝘆𝗼𝘂? ""𝗛𝗲𝗹𝗹𝗼, 你好"" 𝗡𝗼𝘁 𝗰𝗼𝗼𝗹 𝗡𝗼 𝘄𝗼𝗿𝗿𝗶𝗲𝘀, 𝗜𝗺𝗺𝗮 𝗳𝗼𝗼𝗹 𝗬𝗼𝘂'𝗿𝗲 𝗱𝗮 𝗾𝘂𝗶𝗲𝘁 𝗜 𝗱𝗲𝘀𝗶𝗿𝗲 𝗜 𝘄𝗮𝗻𝗻𝗮 𝘀𝘁𝗮𝗻𝗱 𝗿𝗶𝗴𝗵𝘁 𝘁𝗵𝗲𝗿𝗲 𝗔𝗻𝗱 𝗜 𝗰𝗮𝗻'𝘁 𝗳𝗼𝗿𝗴𝗲𝘁 𝘆𝗼𝘂𝗿 𝗳𝗮𝗰𝗲 𝗪𝗵𝗲𝗻 𝘆𝗼𝘂'𝗿𝗲 𝗴𝗹𝗮𝗻𝗰𝗶𝗻𝗴 𝗼𝘃𝗲𝗿 𝗵𝗲𝗿𝗲 𝗪𝗵𝗮𝘁 𝗰𝗮𝗻 𝗜 𝘀𝗮𝘆? ""𝗛𝗲𝘆, 𝗵𝗼𝘄 𝗮𝗿𝗲 𝘆𝗼𝘂?"" ""안녕하세요"" 𝗡𝗼𝘁 𝗰𝗼𝗼𝗹 𝗟𝗲𝗮𝘃𝗶𝗻𝗴 𝗮𝗹𝗹 𝗺𝘆 𝗰𝗮𝗿𝗲𝘀, 𝗹𝗲𝘁 𝗱𝗮 𝗺𝘂𝘀𝗶𝗰 𝘁𝗮𝗸𝗲 𝗰𝗼𝗻𝘁𝗿𝗼𝗹 ℂ𝟛 𝗔𝗻𝗱 𝗜 𝘀𝗲𝗲 𝘆𝗼𝘂 𝗳𝗿𝗼𝗺 𝗱𝗮 𝗱𝗼𝗼𝗿 𝗬𝗼𝘂’𝗿𝗲 𝗮 𝘀𝗽𝗮𝗿𝗸  — 𝘆𝗲𝘀, 𝘀𝗼𝗺𝗲𝘁𝗵𝗶𝗻𝗴 𝗺𝗼𝗿𝗲 𝗘𝘃𝗲𝗿𝘆 𝗻𝗲𝗿𝘃𝗲 𝗶𝘀 𝘀𝗰𝗿𝗲𝗮𝗺𝗶𝗻𝗴 - 𝗜'𝘃𝗲 𝗯𝗲𝗲𝗻 𝗵𝗲𝗿𝗲 𝗯𝗲𝗳𝗼𝗿𝗲 𝗪𝗮𝗻𝗻𝗮 𝗸𝗻𝗼𝘄 𝘆𝗼𝘂𝗿 𝗻𝗮𝗺𝗲 𝗜 𝘀𝗮𝘆""𝗛𝗲𝘆, 𝗛𝗼𝘄 𝗮𝗿𝗲 𝘆𝗼𝘂?"" ""𝗛𝗲𝗹𝗹𝗼, 你好"" 𝗡𝗼𝘁 𝗰𝗼𝗼𝗹 𝗡𝗼 𝘄𝗼𝗿𝗿𝗶𝗲𝘀, 𝗜𝗺𝗺𝗮 𝗳𝗼𝗼𝗹 𝗬𝗼𝘂'𝗿𝗲 𝗱𝗮 𝗾𝘂𝗶𝗲𝘁 𝗜 𝗱𝗲𝘀𝗶𝗿𝗲 𝗜 𝘄𝗮𝗻𝗻𝗮 𝘀𝘁𝗮𝗻𝗱 𝗿𝗶𝗴𝗵𝘁 𝘁𝗵𝗲𝗿𝗲 𝗔𝗻𝗱 𝗜 𝗰𝗮𝗻'𝘁 𝗳𝗼𝗿𝗴𝗲𝘁 𝘆𝗼𝘂𝗿 𝗳𝗮𝗰𝗲 𝗪𝗵𝗲𝗻 𝘆𝗼𝘂'𝗿𝗲 𝗴𝗹𝗮𝗻𝗰𝗶𝗻𝗴 𝗼𝘃𝗲𝗿 𝗵𝗲𝗿𝗲 𝗪𝗵𝗮𝘁 𝗰𝗮𝗻 𝗜 𝘀𝗮𝘆? ""𝗛𝗲𝘆, 𝗵𝗼𝘄 𝗮𝗿𝗲 𝘆𝗼𝘂?"" ""สวัสดีครับ"" 𝗡𝗼𝘁 𝗰𝗼𝗼𝗹 𝗟𝗲𝗮𝘃𝗶𝗻𝗴 𝗮𝗹𝗹 𝗺𝘆 𝗰𝗮𝗿𝗲𝘀, 𝗹𝗲𝘁 𝗱𝗮 𝗺𝘂𝘀𝗶𝗰 𝘁𝗮𝗸𝗲 𝗰𝗼𝗻𝘁𝗿𝗼𝗹 
𝕍𝟙 𝗔𝗳𝘁𝗲𝗿 𝗽𝗮𝗿𝘁𝘆'𝘀 𝗰𝗿𝗼𝘄𝗱𝗲𝗱, 𝗹𝗶𝗴𝗵𝘁𝘀 𝗯𝘂𝗿𝗻𝗶𝗻𝗴 𝗺𝘆 𝗲𝘆𝗲𝘀 𝗧𝗼𝗼 𝗺𝗮𝗻𝘆 𝗯𝗼𝗱𝗶𝗲𝘀, 𝗻𝗼 𝘀𝗽𝗮𝗰𝗲 𝘁𝗼 𝗵𝗶𝗱𝗲 𝗜𝘀 𝗱𝗮 𝗳𝗹𝗼𝗼𝗿 𝘀𝗽𝗶𝗻𝗻𝗶𝗻𝗴, 𝗼𝗿 𝗶𝘀 𝗶𝘁 𝗺𝘆 𝗺𝗶𝗻𝗱? 𝗟𝗼𝘀𝘁 𝗶𝗻𝘀𝗶𝗱𝗲 𝗱𝗮 𝘃𝗲𝗻𝘂𝗲, 𝘁𝘂𝗿𝗻𝗶𝗻𝗴 𝗰𝗶𝗿𝗰𝗹𝗲𝘀 𝗮𝗹𝗹 𝗻𝗶𝗴𝗵𝘁
ℂ𝟙 𝗔𝗻𝗱 𝗜 𝘀𝗲𝗲 𝘆𝗼𝘂 𝗳𝗿𝗼𝗺 𝗱𝗮 𝗱𝗼𝗼𝗿 𝗬𝗼𝘂𝗿 𝘀𝗽𝗮𝗿𝗸 𝗜 𝗰𝗮𝗻'𝘁 𝗶𝗴𝗻𝗼𝗿𝗲 𝗘𝘃𝗲𝗿𝘆 𝗻𝗲𝗿𝘃𝗲 𝗶𝘀 𝘀𝗰𝗿𝗲𝗮𝗺𝗶𝗻𝗴 - 𝗜'𝘃𝗲 𝗯𝗲𝗲𝗻 𝗵𝗲𝗿𝗲 𝗯𝗲𝗳𝗼𝗿𝗲 𝗙𝗼𝗿𝗴𝗼𝘁 𝗺𝘆 𝗼𝘄𝗻 𝗻𝗮𝗺𝗲 𝗢𝗵 𝗜 𝘀𝗮𝘆 ""𝗛𝗲𝘆, 𝗵𝗼𝘄 𝗮𝗿𝗲 𝘆𝗼𝘂?"" ""𝗛𝗲𝗹𝗹𝗼, 你好” 𝗡𝗼, 𝗻𝗼𝘁 𝗰𝗼𝗼𝗹 𝗡𝗼 𝘄𝗼𝗿𝗿𝗶𝗲𝘀, 𝗜𝗺𝗺𝗮 𝗳𝗼𝗼𝗹
𝗬𝗼𝘂'𝗿𝗲 𝗱𝗮 𝗾𝘂𝗶𝗲𝘁 𝗜 𝗱𝗲𝘀𝗶𝗿𝗲 𝗜 𝘄𝗮𝗻𝗻𝗮 𝘀𝘁𝗮𝗻𝗱 𝗿𝗶𝗴𝗵𝘁 𝘁𝗵𝗲𝗿𝗲 𝗔𝗻𝗱 𝗜 𝗰𝗮𝗻'𝘁 𝗳𝗼𝗿𝗴𝗲𝘁 𝘆𝗼𝘂𝗿 𝗳𝗮𝗰𝗲 𝗪𝗵𝗲𝗻 𝘆𝗼𝘂'𝗿𝗲 𝗴𝗹𝗮𝗻𝗰𝗶𝗻𝗴 𝗼𝘃𝗲𝗿 𝗵𝗲𝗿𝗲 𝗪𝗵𝗮𝘁 𝗰𝗮𝗻 𝗜 𝘀𝗮𝘆? ""𝗛𝗲𝘆, 𝗵𝗼𝘄 𝗮𝗿𝗲 𝘆𝗼𝘂?"" ""こんにちは"" 𝗡𝗼𝘁 𝗰𝗼𝗼𝗹 𝗟𝗲𝗮𝘃𝗶𝗻𝗴 𝗮𝗹𝗹 𝗺𝘆 𝗰𝗮𝗿𝗲𝘀, 𝗹𝗲𝘁 𝗱𝗮 𝗺𝘂𝘀𝗶𝗰 𝘁𝗮𝗸𝗲 𝗰𝗼𝗻𝘁𝗿𝗼𝗹 𝔹𝕣𝕚𝕕𝕘𝕖 𝗝𝘂𝘀𝘁 𝗹𝗲𝘁 𝘁𝗵𝗲𝗺 𝗰𝗵𝗮𝘀𝗲 𝗮𝗳𝘁𝗲𝗿 𝗱𝗮 𝗳𝗹𝗮𝘀𝗵𝗲𝘀 𝗮𝗻𝗱 𝗵𝗮𝘃𝗲 𝗮 𝗰𝗿𝗮𝘇𝘆 𝗻𝗶𝗴𝗵𝘁 𝗜 𝘄𝗶𝘀𝗵 𝗜 𝗰𝗼𝘂𝗹𝗱 𝗷𝘂𝘀𝘁 𝗳𝗿𝗲𝗲𝘇𝗲 𝘁𝗶𝗺𝗲 𝗔𝗻𝗱 𝗹𝗲𝗮𝘃𝗲 𝗶𝘁 𝗮𝗹𝗹 𝗯𝗲𝗵𝗶𝗻𝗱
𝕍𝟚 𝗔𝗹𝗹 𝘁𝗵𝗲 𝗽𝗮𝗿𝘁𝘆'𝘀 𝗰𝗿𝗼𝘄𝗱𝗲𝗱, 𝗹𝗶𝗴𝗵𝘁𝘀 𝗯𝘂𝗿𝗻𝗶𝗻𝗴 𝗺𝘆 𝗲𝘆𝗲𝘀 𝗟𝗶𝗸𝗲 𝗮𝗻 𝗮𝗰𝘁𝗼𝗿 𝗼𝗻 𝘀𝘁𝗮𝗴𝗲, 𝘄𝗵𝗮𝘁'𝘀 𝗺𝘆 𝗻𝗲𝘅𝘁 𝗹𝗶𝗻𝗲? 𝗜𝘀 𝘁𝗵𝗲𝗿𝗲 𝗮 𝗰𝗵𝗮𝗻𝗰𝗲 𝘁𝗵𝗮𝘁, 𝘆𝗼𝘂'𝗱 𝗲𝘃𝗲𝗻 𝗹𝗼𝗼𝗸 𝘁𝘄𝗶𝗰𝗲? 𝗢𝗿 𝗶𝘀 𝘁𝗵𝗮𝘁 𝗷𝘂𝘀𝘁 𝗮 𝘁𝗿𝗶𝗰𝗸 𝗳𝗿𝗼𝗺 𝘁𝗵𝗲 𝗳𝗹𝗮𝘀𝗵𝗶𝗻𝗴 𝗹𝗶𝗴𝗵𝘁𝘀
ℂ𝟚 𝗜 𝘀𝗲𝗲 𝘆𝗼𝘂 𝗳𝗿𝗼𝗺 𝗱𝗮 𝗱𝗼𝗼𝗿 𝗬𝗼𝘂’𝗿𝗲 𝗮 𝘀𝗽𝗮𝗿𝗸  — 𝘆𝗲𝘀, 𝘀𝗼𝗺𝗲𝘁𝗵𝗶𝗻𝗴 𝗺𝗼𝗿𝗲 𝗘𝘃𝗲𝗿𝘆 𝗻𝗲𝗿𝘃𝗲 𝗶𝘀 𝘀𝗰𝗿𝗲𝗮𝗺𝗶𝗻𝗴 - 𝗜'𝘃𝗲 𝗯𝗲𝗲𝗻 𝗵𝗲𝗿𝗲 𝗯𝗲𝗳𝗼𝗿𝗲 𝗪𝗮𝗻𝗻𝗮 𝗸𝗻𝗼𝘄 𝘆𝗼𝘂𝗿 𝗻𝗮𝗺𝗲 𝗜 𝘀𝗮𝘆""𝗛𝗲𝘆, 𝗛𝗼𝘄 𝗮𝗿𝗲 𝘆𝗼𝘂? ""𝗛𝗲𝗹𝗹𝗼, 你好"" 𝗡𝗼𝘁 𝗰𝗼𝗼𝗹 𝗡𝗼 𝘄𝗼𝗿𝗿𝗶𝗲𝘀, 𝗜𝗺𝗺𝗮 𝗳𝗼𝗼𝗹
𝗬𝗼𝘂'𝗿𝗲 𝗱𝗮 𝗾𝘂𝗶𝗲𝘁 𝗜 𝗱𝗲𝘀𝗶𝗿𝗲 𝗜 𝘄𝗮𝗻𝗻𝗮 𝘀𝘁𝗮𝗻𝗱 𝗿𝗶𝗴𝗵𝘁 𝘁𝗵𝗲𝗿𝗲 𝗔𝗻𝗱 𝗜 𝗰𝗮𝗻'𝘁 𝗳𝗼𝗿𝗴𝗲𝘁 𝘆𝗼𝘂𝗿 𝗳𝗮𝗰𝗲 𝗪𝗵𝗲𝗻 𝘆𝗼𝘂'𝗿𝗲 𝗴𝗹𝗮𝗻𝗰𝗶𝗻𝗴 𝗼𝘃𝗲𝗿 𝗵𝗲𝗿𝗲 𝗪𝗵𝗮𝘁 𝗰𝗮𝗻 𝗜 𝘀𝗮𝘆? ""𝗛𝗲𝘆, 𝗵𝗼𝘄 𝗮𝗿𝗲 𝘆𝗼𝘂?"" ""안녕하세요"" 𝗡𝗼𝘁 𝗰𝗼𝗼𝗹 𝗟𝗲𝗮𝘃𝗶𝗻𝗴 𝗮𝗹𝗹 𝗺𝘆 𝗰𝗮𝗿𝗲𝘀, 𝗹𝗲𝘁 𝗱𝗮 𝗺𝘂𝘀𝗶𝗰 𝘁𝗮𝗸𝗲 𝗰𝗼𝗻𝘁𝗿𝗼𝗹
ℂ𝟛 𝗔𝗻𝗱 𝗜 𝘀𝗲𝗲 𝘆𝗼𝘂 𝗳𝗿𝗼𝗺 𝗱𝗮 𝗱𝗼𝗼𝗿 𝗬𝗼𝘂’𝗿𝗲 𝗮 𝘀𝗽𝗮𝗿𝗸  — 𝘆𝗲𝘀, 𝘀𝗼𝗺𝗲𝘁𝗵𝗶𝗻𝗴 𝗺𝗼𝗿𝗲 𝗘𝘃𝗲𝗿𝘆 𝗻𝗲𝗿𝘃𝗲 𝗶𝘀 𝘀𝗰𝗿𝗲𝗮𝗺𝗶𝗻𝗴 - 𝗜'𝘃𝗲 𝗯𝗲𝗲𝗻 𝗵𝗲𝗿𝗲 𝗯𝗲𝗳𝗼𝗿𝗲 𝗪𝗮𝗻𝗻𝗮 𝗸𝗻𝗼𝘄 𝘆𝗼𝘂𝗿 𝗻𝗮𝗺𝗲 𝗜 𝘀𝗮𝘆""𝗛𝗲𝘆, 𝗛𝗼𝘄 𝗮𝗿𝗲 𝘆𝗼𝘂?"" ""𝗛𝗲𝗹𝗹𝗼, 你好"" 𝗡𝗼𝘁 𝗰𝗼𝗼𝗹 𝗡𝗼 𝘄𝗼𝗿𝗿𝗶𝗲𝘀, 𝗜𝗺𝗺𝗮 𝗳𝗼𝗼𝗹
𝗬𝗼𝘂'𝗿𝗲 𝗱𝗮 𝗾𝘂𝗶𝗲𝘁 𝗜 𝗱𝗲𝘀𝗶𝗿𝗲 𝗜 𝘄𝗮𝗻𝗻𝗮 𝘀𝘁𝗮𝗻𝗱 𝗿𝗶𝗴𝗵𝘁 𝘁𝗵𝗲𝗿𝗲 𝗔𝗻𝗱 𝗜 𝗰𝗮𝗻'𝘁 𝗳𝗼𝗿𝗴𝗲𝘁 𝘆𝗼𝘂𝗿 𝗳𝗮𝗰𝗲 𝗪𝗵𝗲𝗻 𝘆𝗼𝘂'𝗿𝗲 𝗴𝗹𝗮𝗻𝗰𝗶𝗻𝗴 𝗼𝘃𝗲𝗿 𝗵𝗲𝗿𝗲 𝗪𝗵𝗮𝘁 𝗰𝗮𝗻 𝗜 𝘀𝗮𝘆? ""𝗛𝗲𝘆, 𝗵𝗼𝘄 𝗮𝗿𝗲 𝘆𝗼𝘂?"" ""สวัสดีครับ"" 𝗡𝗼𝘁 𝗰𝗼𝗼𝗹 𝗟𝗲𝗮𝘃𝗶𝗻𝗴 𝗮𝗹𝗹 𝗺𝘆 𝗰𝗮𝗿𝗲𝘀, 𝗹𝗲𝘁 𝗱𝗮 𝗺𝘂𝘀𝗶𝗰 𝘁𝗮𝗸𝗲 𝗰𝗼𝗻𝘁𝗿𝗼𝗹
留言（ 2 ） 最相關留言 所有留言
留言（ 2 ）",2026-05-08,,True,False,
2026-05-09 21:47:14,10,,,11,624,4,https://streetvoice.com/Demodelica/songs/857586/,https://streetvoice.com/Demodelica/,"https://akstatic.streetvoice.com/song_covers/De/mo/Demodelica/8pUBSscNVn9Jw7c4bqauMB.jpeg?x-oss-process=image/resize,m_fixed,h_1,w_1,limit_0/resize,m_fixed,h_630,w_1200,limit_0/watermark,image_c29uZ19jb3ZlcnMvRGUvbW8vRGVtb2RlbGljYS84cFVCU3NjTlZuOUp3N2M0YnFhdU1CLmpwZWc_eC1vc3MtcHJvY2Vzcz1pbWFnZS9yZXNpemUsbV9maXhlZCxoXzM0NCx3XzM0NCxsaW1pdF8w,g_nw,x_428,y_143/watermark,image_YXNzZXQvaW1hZ2VzL21ldGFpbWFnZS1zb25nLnBuZw,g_nw,x_0,y_0",@Demodelica,音樂人,台北市,2025-04-01,2025-12-04 10:01,5,153,2,https://www.facebook.com/profile.php?id=61584045424470,https://www.instagram.com/theallergics0730/,https://www.youtube.com/user/StreetVoiceTV,Rock,,,陳竑宇,"詞曲：陳竑宇 編曲：陳竑宇 混音：陳竑宇 封面：陳竑睿\陳竑宇 母帶：陳翰 
詞曲：陳竑宇 編曲：陳竑宇 混音：陳竑宇 封面：陳竑睿\陳竑宇 母帶：陳翰","往前看 看著那段鋪陳的故事 往回看 看著那份刻苦的偏執 仔細看 試著描述鏡子裡的自己 卻一句話也說不出來 往前站 站在戰戰兢兢的前方 往回看 數著自己留下的步伐 仔細看 數著身旁閃爍的風景 消失的你還有自己 曾經也有想過 看見未來的夢 原來我們早就已經擁有 那些來自前方 不真實的幻想 他們早就已經消失了 在都已經成真的時候 往前看 幻想著那些新的故事 往回看 忘記了什麼才是真實 仔細看 試著描述鏡子裡的自己 他停不下來 停不下來 停不下來 曾經也有想過 看見未來的夢 原來我們早就已經擁有 那些來自前方 不真實的幻想 他們早就已經消失了 在都已經成真的時候 
往前看 看著那段鋪陳的故事 往回看 看著那份刻苦的偏執 仔細看 試著描述鏡子裡的自己 卻一句話也說不出來
往前站 站在戰戰兢兢的前方 往回看 數著自己留下的步伐 仔細看 數著身旁閃爍的風景 消失的你還有自己
曾經也有想過 看見未來的夢 原來我們早就已經擁有 那些來自前方 不真實的幻想 他們早就已經消失了 在都已經成真的時候
往前看 幻想著那些新的故事 往回看 忘記了什麼才是真實 仔細看 試著描述鏡子裡的自己 他停不下來 停不下來 停不下來
曾經也有想過 看見未來的夢 原來我們早就已經擁有 那些來自前方 不真實的幻想 他們早就已經消失了 在都已經成真的時候
留言（ 4 ） 最相關留言 所有留言
留言（ 4 ）",2026-05-07,,True,False,
2026-05-09 21:47:14,11,,,1,32,2,https://streetvoice.com/lowshuki13/songs/858012/,https://streetvoice.com/lowshuki13/,"https://akstatic.streetvoice.com/profile_images/lo/ws/lowshuki13/KLEg7HzdRry3soY76GtZaf.jpeg?x-oss-process=image/resize,m_fixed,h_1,w_1,limit_0/resize,m_fixed,h_630,w_1200,limit_0/watermark,image_cHJvZmlsZV9pbWFnZXMvbG8vd3MvbG93c2h1a2kxMy9LTEVnN0h6ZFJyeTNzb1k3Nkd0WmFmLmpwZWc_eC1vc3MtcHJvY2Vzcz1pbWFnZS9yZXNpemUsbV9maXhlZCxoXzM0NCx3XzM0NCxsaW1pdF8w,g_nw,x_428,y_143/watermark,image_YXNzZXQvaW1hZ2VzL21ldGFpbWFnZS1zb25nLnBuZw,g_nw,x_0,y_0",@lowshuki13,音樂人,,,,1,2,,,,https://www.youtube.com/user/StreetVoiceTV,Singer / Songwriter,,,,"「淡水河畔的約定」，這首歌由戴念國作詞，林淑凌作曲，寰宇安琪菈主唱。歌曲輕快感情豐富，描述淡水河畔風光與情人相知相惜相守，約定未來一起奮鬥面對美好人生。祝福天下有情人，不止成為眷屬，更成為人生奮鬥的夥伴，衝過人生驚濤駭浪，駛向美麗港灣。 月光鋪滿 老橋石階 夜色溫柔長 河風低唱 藏著我們 未說的渴望 肩並著肩 望著遠方 不慌不忙 約好以後 苦樂同嘗 不負時光 潮起又潮落 歲月流淌 初心不曾改 依然明亮 平凡日子 因為有你 閃閃發光 這條河 陪我們 把未來寫上 淡水河畔 許下一生盟約 兩顆心 緊緊相繫 不離不別 同風同雨 同走漫漫歲月 一起成長 一起奔赴 每個明天 愛是承諾 也是執著的堅定你我 牽著手 就敢擁抱 未來每個秋冬 
「淡水河畔的約定」，這首歌由戴念國作詞，林淑凌作曲，寰宇安琪菈主唱。歌曲輕快感情豐富，描述淡水河畔風光與情人相知相惜相守，約定未來一起奮鬥面對美好人生。祝福天下有情人，不止成為眷屬，更成為人生奮鬥的夥伴，衝過人生驚濤駭浪，駛向美麗港灣。
月光鋪滿 老橋石階 夜色溫柔長 河風低唱 藏著我們 未說的渴望 肩並著肩 望著遠方 不慌不忙 約好以後 苦樂同嘗 不負時光
潮起又潮落 歲月流淌 初心不曾改 依然明亮 平凡日子 因為有你 閃閃發光 這條河 陪我們 把未來寫上 淡水河畔 許下一生盟約 兩顆心 緊緊相繫 不離不別 同風同雨 同走漫漫歲月 一起成長 一起奔赴 每個明天 愛是承諾 也是執著的堅定你我 牽著手 就敢擁抱 未來每個秋冬","月光灑在 淡水河面 金波盪漾 風吹過堤岸 輕輕撥亂 妳髮梢的香 腳步緩緩 踩著波光 把心事輕講 指尖相碰 一瞬慌張 卻不肯放 看船隻緩緩 駛向遠方 時光也慢慢 落在肩膀 不必多言 一個眼神 就懂嚮往 這條河 見證我們 最初模樣 淡水河畔 許下一生盟約 兩顆心 緊緊相繫 不離不別 同風同雨 同走漫漫歲月 一起成長 一起奔赴 每個明天 愛是承諾 也是執著的堅定你我 牽著手 就敢擁抱 未來每個春夏秋冬 月光鋪滿 老橋石階 夜色溫柔長 河風低唱 藏著我們 未說的渴望 肩並著肩 望著遠方 不慌不忙 約好以後 苦樂同嘗 不負時光 潮起又潮落 歲月流淌 初心不曾改 依然明亮 平凡日子 因為有你 閃閃發光 這條河 陪我們 把未來寫上 淡水河畔 許下一生盟約 兩顆心 緊緊相繫 不離不別 同風同雨 同走漫漫歲月 一起成長 一起奔赴 每個明天 愛是承諾 也是執著的堅定你我 牽著手 就敢擁抱 未來每個春夏秋冬 從青澀相遇 到深情相依 從輕許諾言 到一生珍惜 奮鬥有你 陪伴有你 四季更替 我只願 身旁是你 不問前路 多少崎嶇 只要同心 就有勇氣 走到底 淡水河畔 風依舊輕揚 我們的愛 像河水綿長 一生相伴 一世守望 把相守的日子 過成永恆的詩章 
月光灑在 淡水河面 金波盪漾 風吹過堤岸 輕輕撥亂 妳髮梢的香 腳步緩緩 踩著波光 把心事輕講 指尖相碰 一瞬慌張 卻不肯放
看船隻緩緩 駛向遠方 時光也慢慢 落在肩膀 不必多言 一個眼神 就懂嚮往 這條河 見證我們 最初模樣
淡水河畔 許下一生盟約 兩顆心 緊緊相繫 不離不別 同風同雨 同走漫漫歲月 一起成長 一起奔赴 每個明天 愛是承諾 也是執著的堅定你我 牽著手 就敢擁抱 未來每個春夏秋冬
月光鋪滿 老橋石階 夜色溫柔長 河風低唱 藏著我們 未說的渴望 肩並著肩 望著遠方 不慌不忙 約好以後 苦樂同嘗 不負時光
潮起又潮落 歲月流淌 初心不曾改 依然明亮 平凡日子 因為有你 閃閃發光 這條河 陪我們 把未來寫上
淡水河畔 許下一生盟約 兩顆心 緊緊相繫 不離不別 同風同雨 同走漫漫歲月 一起成長 一起奔赴 每個明天 愛是承諾 也是執著的堅定你我 牽著手 就敢擁抱 未來每個春夏秋冬
從青澀相遇 到深情相依 從輕許諾言 到一生珍惜 奮鬥有你 陪伴有你 四季更替 我只願 身旁是你 不問前路 多少崎嶇 只要同心 就有勇氣 走到底
淡水河畔 風依舊輕揚 我們的愛 像河水綿長 一生相伴 一世守望 把相守的日子 過成永恆的詩章
留言（ 2 ） 最相關留言 所有留言
留言（ 2 ）",2026-05-08,,False,False,
2026-05-09 21:47:14,12,,,16,988,0,https://streetvoice.com/XDingMu/songs/856349/,https://streetvoice.com/XDingMu/,"https://akstatic.streetvoice.com/song_covers/XD/in/XDingMu/BPnWGvfHnXg2Swt7qAmVuC.jpeg?x-oss-process=image/resize,m_fixed,h_1,w_1,limit_0/resize,m_fixed,h_630,w_1200,limit_0/watermark,image_c29uZ19jb3ZlcnMvWEQvaW4vWERpbmdNdS9CUG5XR3ZmSG5YZzJTd3Q3cUFtVnVDLmpwZWc_eC1vc3MtcHJvY2Vzcz1pbWFnZS9yZXNpemUsbV9maXhlZCxoXzM0NCx3XzM0NCxsaW1pdF8w,g_nw,x_428,y_143/watermark,image_YXNzZXQvaW1hZ2VzL21ldGFpbWFnZS1zb25nLnBuZw,g_nw,x_0,y_0",@XDingMu,音樂人,上海,2021-03-01,,5,17,2,,,https://www.youtube.com/user/StreetVoiceTV,Alternative,,,,"这首作品的灵感来源于键盘手Freddy在波士顿留学期间每天上学都会经过的一条拥有悠久历史的大道名字。Commonwealth Ave上永远是车水马龙，即便是零下20度的大雪天，街上行走的人群也都是行色匆匆。 因为总是一个人在这条道上走很长的路，这个行走的意象就贯穿了Freddy的整个波士顿时期，也深深地刻进了他的脑海。碰巧那段时间又特别痴迷迪斯科音乐，所以就把这两者揉合到了一起。 然而，这首作品是在离开波士顿后才写的，属于是情绪沉淀之后的产物。Freddy回国后，某丁目乐队的成员们又加入了各自新奇的想法，使这首作品的听感和原本想表达的荒诞性更加升级了。 
这首作品的灵感来源于键盘手Freddy在波士顿留学期间每天上学都会经过的一条拥有悠久历史的大道名字。Commonwealth Ave上永远是车水马龙，即便是零下20度的大雪天，街上行走的人群也都是行色匆匆。
因为总是一个人在这条道上走很长的路，这个行走的意象就贯穿了Freddy的整个波士顿时期，也深深地刻进了他的脑海。碰巧那段时间又特别痴迷迪斯科音乐，所以就把这两者揉合到了一起。
然而，这首作品是在离开波士顿后才写的，属于是情绪沉淀之后的产物。Freddy回国后，某丁目乐队的成员们又加入了各自新奇的想法，使这首作品的听感和原本想表达的荒诞性更加升级了。","Walking on the Commonwealth Avenue 漫步在联邦大道 Walking on the Commonwealth Avenue 漫步在联邦大道 Whirling snow all over the sky 漫天飞雪舞翩跹 She～She broke my heart 她～她伤透我心 
Walking on the Commonwealth Avenue 漫步在联邦大道 Walking on the Commonwealth Avenue 漫步在联邦大道 Whirling snow all over the sky 漫天飞雪舞翩跹 She～She broke my heart 她～她伤透我心
留言（ 0 ） 最相關留言 所有留言
留言（ 0 ）",2026-05-01,,True,True,
